name;province
Di tích lịch sử - văn hóa căn cứ địa cách mạng Hải Chi (Đình Làng Dạ);Quảng Ninh
Chợ Trung tâm Ba Chẽ;Quảng Ninh
Di tích lịch sử Miếu Ông – Miếu Bà;Quảng Ninh
Phố đi bộ Tiên Yên;Quảng Ninh
Trung tâm Văn hóa, Thể thao các dân tộc vùng Đông Bắc;Quảng Ninh
Đền thờ Đức ông Hoàng Cần (Miếu Đại Vương);Quảng Ninh
Chợ Tiên Yên;Quảng Ninh
Thác Pạc Sủi;Quảng Ninh
Cột mốc 1317(2) và cửa khẩu Hoành Mô;Quảng Ninh
Chợ Đồng Văn;Quảng Ninh
Chợ Trung tâm huyện Bình Liêu;Quảng Ninh
Đình Lục Nà;Quảng Ninh
Thác Sông Moóc;Quảng Ninh
Thác Khe Tiền;Quảng Ninh
Thác Khe Vằn;Quảng Ninh
Bãi tắm Lương Ngọc;Quảng Ninh
Bãi tắm Quảng Hồng;Quảng Ninh
Trung tâm Khoáng nóng Địa chất;Quảng Ninh
Khu di tích lịch sử - Văn hóa Đền Cửa Ông;Quảng Ninh
Khu di tích lịch sử và Danh thắng Vũng Đục;Quảng Ninh
Quảng Ninh Gate;Quảng Ninh
Công viên Hà Lan;Quảng Ninh
Hồ Khe Chè;Quảng Ninh
Làng quê Yên Đức;Quảng Ninh
Cụm di tích lịch sử cách mạng khu mỏ than Mạo Khê;Quảng Ninh
Trung tâm chiến khu Đông Triều - chùa Bắc Mã;Quảng Ninh
Chùa Hồ Thiên;Quảng Ninh
Chùa Quỳnh Lâm;Quảng Ninh
Đền Thái;Quảng Ninh
Đền An Sinh;Quảng Ninh
Chợ Rừng;Quảng Ninh
Làng nghề truyền thống Hưng Học;Quảng Ninh
Thác Mơ;Quảng Ninh
Chùa Yên Mỹ;Quảng Ninh
Đền thờ Tiến sỹ Vũ Phi Hổ;Quảng Ninh
Đền thờ Vua Lê Thái Tổ;Quảng Ninh
Miếu Tiên Công;Quảng Ninh
Chùa Yên Giang;Quảng Ninh
Đình, chùa Yên Đông;Quảng Ninh
Nhà thờ họ Lê;Quảng Ninh
Đình Phong Cốc;Quảng Ninh
Hai cây Lim Giếng Rừng;Quảng Ninh
Bảo tàng Bạch Đằng;Quảng Ninh
Khu trung tâm di tích lịch sử Bạch Đằng;Quảng Ninh
Quần thể danh lam thắng cảnh Núi Mằn;Quảng Ninh
Khu bảo tồn bản văn hóa người Dao Thanh Y Bằng Cả;Quảng Ninh
Thiên đường hoa Quảng La;Quảng Ninh
Đại Yên Plaza, Vụng Cặp Táo;Quảng Ninh
Cung Quy hoạch và Hội chợ triển lãm tỉnh Quảng Ninh;Quảng Ninh
Vụng Tùng Sâu;Quảng Ninh
Cụm di tích Chùa Lôi Âm và Hồ Yên Lập;Quảng Ninh
Đền Cái Lân;Quảng Ninh
Trung tâm Mỹ Ngọc - Công ty CP Ngọc trai Hạ Long;Quảng Ninh
Trung tâm thương mại Marine Plaza;Quảng Ninh
Trung tâm Thương mại Vincom Hạ Long center;Quảng Ninh
Chợ Hạ Long 1;Quảng Ninh
Bảo tàng - Thư viện tỉnh - Quảng trường 30/10;Quảng Ninh
Công viên Hạ Long;Quảng Ninh
Nhà thờ Hòn Gai;Quảng Ninh
Chùa Long Tiên;Quảng Ninh
Trung tâm Văn hóa Núi Bài Thơ và Đền thờ Đức ông Trần Quốc Nghiễn;Quảng Ninh
Chùa Ba Vàng;Quảng Ninh
Thác Lựng Xanh;Quảng Ninh
Chùa Phổ Am;Quảng Ninh
Đình Đền Công - chùa Long Khánh - miếu Cổ Linh;Quảng Ninh
Di tích danh thắng Yên Tử;Quảng Ninh
Văn Miếu - Quốc Tử Giám;Thành phố Hà Nội
Vườn Dâu Tằm Mỹ Khánh ở An Giang;Thành phố Long Xuyên
Du lịch sinh thái Rừng tràm Tân Tuyến;Huyện Tri Tôn
Vườn trái cây Gò Chùa;Huyện Gò Dầu
Tháp cổ Bình Thạnh;Huyện Trảng Bàng
Công viên nước Thanh Lễ;Bình Dương
Khu du lịch làng cổ Phước Lộc Thọ;Tây Ninh
Quán Café Gió & Nước Bình Dương;Bình Dương
Cụm du lịch hồ Dầu Tiếng;Bình Dương
Khu Du Lịch Thủy Châu;Bình Dương
Làng Tre Phú An;Bình Dương
Hàng cau vua Tân Trụ;Tây Ninh
Khu du lịch Cánh Đồng Bất Tận;Tây Ninh
Làng nổi Tân Lập;Tây Ninh
Khu Lưu Niệm Nhạc Sĩ Cao Văn Lầu;Bạc Liêu
Vườn chim Bạc Liêu;Bạc Liêu
Khu du lịch Nhà Mát;Bạc Liêu
Tháp Chóp Mạt;Huyện Tân Biên
Tham quan căn cứ trung ương cục miền Nam;Huyện Tân Biên
Khu vui chơi giải trí Sala;Thành phố Tây Ninh
Khu du lịch Ma Thiên Lãnh;Thành phố Tây Ninh
Khu du lịch Long Điền Sơn;Thành phố Tây Ninh
Di tích lịch sử văn hóa chiến thắng Tua Hai;Huyện Châu Thành
Cồn Phú Đa;Bến Tre
Khu du lịch Làng bè;Bến Tre
Khu du lịch Lan Vương;Bến Tre
Bãi biển Thừa Đức Bình Đại;Bến Tre
Búng Bình Thiên;Huyện An Phú
Khu Sinh thái Nhà Xưa;Vĩnh Long
Khu du lịch Vinh Sang;Vĩnh Long
Khu du lich sinh thái Hoàng Hảo;Vĩnh Long
Chùa cổ Long An;Vĩnh Long
Chợ nổi Trà Ôn;Vĩnh Long
Thác đá Granite;Đắc Nông
Núi lửa Băng Mo;Đắc Nông
Di tích lịch sử Ngục Đắk Mil;Đắc Nông
Hồ Tây;Đắc Nông
Di tích Đồi 722;Đắc Nông
Tháp Yang Prong;Đắc Lắk
Thác Thủy Tiên;Đắc Lắk
Thác Dray Nur;Đắc Lắk
Đình Lạc Giao;Đắc Lắk
Bảo tàng Đắk Lắk;Đắc Lắk
Làng nghề dệt chiếu Hới;Thái Bình
Khu du lịch Cồn Đen;Thái Bình
Lễ hội Đình Sàn;Bắc Ninh
Thác Háng Tề Chơ;Lào Cai
Thác Pú Nhu;Lào Cai
Suối Giàng;Lào Cai
Thác Pa Sỹ;Kon Tum
Núi Chư Hreng;Kon Tum
Khu du lịch Đầm Vạc;Vĩnh Phúc
Hồ Đăk Ke;Kon Tum
Cầu treo Kon Klor;Kon Tum
Bảo tàng Kon Tum;Kon Tum
Hồ Xạ Hương;Vĩnh Phúc
Làng gốm Hương Canh;Vĩnh Phúc
Khu du lịch Văn hóa Phương Nam - Nam Phương Linh Từ;Huyện Lấp Vò
Khu di tích Gò Tháp;Huyện Tháp Mười
Chùa Phước Kiển (Chùa Lá Sen);Huyện Châu Thành
Khu du lịch sinh thái Gáo Giồng;Huyện Cao Lãnh
Khu du lịch Cánh đồng Hoa Hồng Sa Đéc;Thành phố Sa Đéc
Nhà cổ Huỳnh Thủy Lê;Thành phố Sa Đéc
Vườn cò Hải Lựu;Vĩnh Phúc
Thác Phú Cường;Huyện Chư Sê
Thác Lệ Kim;Huyện Ia Grai
Thác Chín Tầng;Huyện Ia Grai
Thác Bàu Cạn;Huyện Chư Prông
Núi Hàm Rồng;Thành phố Pleiku
Nhà thờ Bác Trạch;Thái Bình
Làng nhà sàn Thái Hải;Thái Nguyên
Trại ngựa Bá Vân;Thái Nguyên
Hồ Vai Miếu;Thái Nguyên
Thác Khuôn Tát;Thái Nguyên
Hồ Ghềnh Chè;Thái Nguyên
Chùa Hang Thái Nguyên;Thái Nguyên
Đồi chè Tân Cương;Thái Nguyên
Đát Đắng;Thái Nguyên
Thác Nậm Rứt (Mưa Rơi);Thái Nguyên
Thác Prenn;Lâm Đồng
Thác Gougah;Lâm Đồng
Làng Cù Lần;Lâm Đồng
Đường hầm điêu khắc;Lâm Đồng
Chùa Linh Phước;Lâm Đồng
Danh thắng thác Bản Ba;Tuyên Quang
Núi Vọng Phu;Thanh Hoá
Thác Mây;Thanh Hoá
Thác Hiêu;Thanh Hoá
Động Kim Sơn;Thanh Hoá
Đền thờ các vua thời Lê Trung Hưng;Thanh Hoá
Khu du lịch Núi Dùm – Cổng Trời;Tuyên Quang
Đền Lê Hoàn;Thanh Hoá
Chùa Tạu;Thanh Hoá
Ruộng bậc thang Hồng Thái;Tuyên Quang
Chùa Phúc Lâm – Dấu tích nhà Phật nơi miền sơn cước;Tuyên Quang
Khám phá động Song Long;Tuyên Quang
Thác Khuổi Nhi – điểm du lịch hấp dẫn;Tuyên Quang
Hang Thắm Nàng Màn;Nghệ An
Di tích Mộ bà Hoàng Thị Loan;Nghệ An
Cụm di tích Làng Sen;Nghệ An
Cụm di tích Hoàng Trù;Nghệ An
Cánh đồng hoa hướng dương;Nghệ An
Thác Khe Kèm;Nghệ An
Đảo chè Thanh Chương;Nghệ An
Danh thắng Thượng Lâm;Tuyên Quang
Đền Pác Tạ;Tuyên Quang
Nhà máy Thủy điện Na Hang;Tuyên Quang
Suối khoáng Mỹ Lâm;Tuyên Quang
Biển Thạch Hải;Hà Tĩnh
Chùa Hương Tích;Hà Tĩnh
Nhà thờ Hải Thượng Lãn Ông;Hà Tĩnh
Quần thể khu di tích Hải Thượng Lãn Ông Lê Hữu Trác;Hà Tĩnh
Thác Vũ Môn;Hà Tĩnh
Vườn Quốc gia Vũ Quang;Hà Tĩnh
Thành cổ Tuyên Quang;Tuyên Quang
Bảo tàng tỉnh Tuyên Quang;Tuyên Quang
Lán Nà Nưa;Tuyên Quang
Nhà lưu niệm Đại tướng Võ Nguyên Giáp;Quảng Trị
Làng Bích Họa Cảnh Dương;Quảng Trị
Hang Va - Hang Nước Nứt;Quảng Trị
Đèo Ngang;Quảng Trị
Bãi biển Nhật Lệ;Quảng Trị
Sông Gianh;Quảng Trị
Động Phong Nha;Quảng Trị
Bãi Đá Nhảy;Quảng Trị
Tượng đường kéo pháo;Điện Biên
Thị xã Mường Lay;Điện Biên
Tháp Chiềng Sơ;Điện Biên
Tây Bắc Bách Hoa Viên;Điện Biên
Nghĩa trang liệt sỹ A1;Điện Biên
Hồ Pá Khoang;Điện Biên
Hang Thẩm Váng;Điện Biên
Động Pê Răng Ky;Điện Biên
Đèo Pha Đin;Điện Biên
Cầu Mường Thanh;Điện Biên
Cầu Hang Tôm;Điện Biên
Thánh địa La Vang;Huyện Hải Lăng
Thác Tà Puồng;Huyện Hướng Hóa
Thác Chênh Vênh;Huyện Hướng Hóa
Mũi Trèo;Huyện Vĩnh Linh
Làng cổ Bích La;Huyện Triệu Phong
Hang động Brai;Huyện Hướng Hóa
Đảo Cồn Cỏ;huyện Cồn Cỏ
Bãi biển Cửa Việt;Huyện Gio Linh
Nhà thờ Phủ Cam;Thành phố Huế
Hồ Tịnh Tâm;Thành phố Huế
Đồi Vọng Cảnh;Thành phố Huế
Chùa Từ Đàm;Thành phố Huế
Bảo tàng Hồ Chí Minh Thừa Thiên Huế;Thành phố Huế
Vịnh Lăng Cô;Thành phố Huế
Núi Bạch Mã;Thành phố Huế
Khu du lịch Sinh thái Lái Thiêu;Thành phố Đà Nẵng
Đình làng Hải Châu;Thành phố Đà Nẵng
Công viên Châu Á;Thành phố Đà Nẵng
Chùa Linh Ứng Sơn Trà;Thành phố Đà Nẵng
Bảo tàng văn hóa Phật giáo;Thành phố Đà Nẵng
Bảo tàng Mỹ Thuật Đà Nẵng;Thành phố Đà Nẵng
Thác Ồ Ồ;Quảng Nam
Rừng dừa Bảy Mẫu;Quảng Nam
Quần thể Tượng đài Mẹ Việt Nam anh hùng;Quảng Nam
Nhà lưu niệm Huỳnh Thúc Kháng;Quảng Nam
Biển Rạng;Quảng Nam
Vườn Anh Đào Mường Phăng;Điện Biên
Tháp Mường Luân;Điện Biên
Thành Bản Phủ;Điện Biên
Suối Khoáng Nóng Hua Pe;Điện Biên
Khu bảo tồn thiên nhiên Mường Nhé;Điện Biên
Hang Thẩm Púa;Điện Biên
Hang Mường Tỉnh;Điện Biên
Động Pa Thơm;Điện Biên
Động Xá Nhè;Điện Biên
Đồi Độc Lập;Điện Biên
Đồi C1;Điện Biên
Du lịch cộng đồng Bản Mển;Điện Biên
Biển Quy Nhơn;Gia Lai
Vịnh Cam Ranh;Khánh Hoà
Thác Tà Gụ;Khánh Hoà
Suối Hoa Lan;Khánh Hoà
Suối Ba Hồ;Khánh Hoà
Làng cổ Phú Vinh;Khánh Hoà
Khu di tích Trường Dục Thanh;Bình Thuận
Tháp nước Phan Thiết;Bình Thuận
Gành Son;Bình Thuận
Đồi cát bay Mũi Né;Bình Thuận
Dinh Thầy Thím;Bình Thuận
Bàu Trắng;Bình Thuận
Bãi biển Mỹ Khê;Quảng Ngãi
Thạch Ky điếu tẩu;Quảng Ngãi
Hang Câu;Quảng Ngãi
Gành Yến;Quảng Ngãi
Di tích Chiến thắng Mỏ Cày;Quảng Ngãi
Bảo tàng Tổng hợp tỉnh Quảng Ngãi;Quảng Ngãi
Bãi biển Sa Huỳnh;Quảng Ngãi
Di tích lịch sử Sơn Mỹ;Quảng Ngãi
Đảo Lý Sơn;Quảng Ngãi
Thắng cảnh Eo Gió;Gia Lai
Đầm Thị Nại;Gia Lai
Khu sinh thái Cồn Chim;Gia Lai
Bảo tàng Tổng hợp;Gia Lai
Nhà thờ Mằng Lăng;Phú Yên
Không gian trưng bày Quảng Đức Xưa;Phú Yên
Hòn lao Mái Nhà;Phú Yên
Hòn Chùa;Phú Yên
Bảo tàng Phú Yên;Phú Yên
Núi Đá Bia;Phú Yên
Đồng Cừu An Hòa;Ninh Thuận
Hòn Đỏ;Ninh Thuận
Vườn nho Ba Mọi;Ninh Thuận
Cồn cát trắng Tuấn Tú;Ninh Thuận
Trùng Sơn Cổ Tự;Ninh Thuận
Tháp Pô Klông Garai;Ninh Thuận
Sở chỉ huy chiến dịch Điện Biên Phủ;Điện Biên
Suối nước nóng U Va;Điện Biên
Cánh đồng Mường Thanh;Điện Biên
Du lịch A Pa Chải;Điện Biên
Chợ phiên vùng cao Tả Sìn Thàng;Điện Biên
Di tích đồi Him Lam;Điện Biên
Khu di tích hầm Đờ Cát;Điện Biên
Hải đăng Mũi Dinh;Ninh Thuận
Bảo tàng Ninh Thuận;Ninh Thuận
Khu du lịch sinh thái Sakai;Ninh Thuận
Làng dệt thổ cẩm Chăm Mỹ Nghiệp;Ninh Thuận
Làng nghề gốm Bàu Trúc;Ninh Thuận
Đền Bà Chúa Kho;Thành phố Bắc Ninh
Đền Vua Bà;Thành phố Bắc Ninh
Đình Đẩu Hàn;Thành phố Bắc Ninh
Lễ hội chùa Đống Lân;Cao Bằng
Chùa Đống Lân;Cao Bằng
Vườn hoa cẩm tú;Cao Bằng
Đèo Mã Phục;Cao Bằng
Lễ hội Đền Vua Lê;Cao Bằng
Hồ Thang Hen;Cao Bằng
Vườn Quốc gia Phja Oắc - Phja Đén;Cao Bằng
Lễ hội Đền Kỳ Sầm;Cao Bằng
Lễ hội đền Dẻ Đoóng;Cao Bằng
Chùa Phật tích Trúc Lâm Bản Giốc;Cao Bằng
Đồn Phai Khắt;Cao Bằng
Chùa Vân An;Cao Bằng
Đền Vua Lê;Cao Bằng
Lễ hội pháo hoa Quảng Uyên;Cao Bằng
Lễ hội Thanh Minh;Cao Bằng
Lễ hội Mời Mẹ Trăng;Cao Bằng
Lễ hội Lồng Tồng;Cao Bằng
Khu di tích Chủ tịch Hồ Chí Minh với chiến dịch biên giới 1950;Cao Bằng
Di tích Hoàng Đình Giong;Cao Bằng
Nhà thờ Chính tòa Bắc Ninh;Thành phố Bắc Ninh
Giếng Ngọc - Đền Cùng;Thành phố Bắc Ninh
Làng tranh Đông Hồ;Huyện Thuận Thành
Lăng Kinh Dương Vương;Huyện Thuận Thành
Thành cổ Luy Lâu;Huyện Thuận Thành
Văn Miếu Bắc Ninh;Thành phố Bắc Ninh
Đền Dẻ Đoóng;Cao Bằng
Khu di tích anh hùng liệt sỹ Kim Đồng;Cao Bằng
Đền Kỳ Sầm;Cao Bằng
Làng rèn Phúc Sen;Cao Bằng
Di tích Pắc Bó;Cao Bằng
Khu di tích rừng Trần Hưng Đạo;Cao Bằng
Khu di tích Đông Khê;Cao Bằng
Động Ngườm Ngao;Cao Bằng
Thác Bản Giốc;Cao Bằng
Thành cổ Bắc Ninh;Thành phố Bắc Ninh
Chùa Tiêu Sơn;Thị xã Từ Sơn
Chùa Sùng Phúc;Cao Bằng
Chùa Đà Quận;Cao Bằng
Lễ hội chùa Phật Tích;Huyện Tiên Du
Lễ hội chùa Dâu;Huyện Thuận Thành
Lễ hội đình Đình Bảng;Thị xã Từ Sơn
Lễ hội làng tranh Đông Hồ;Huyện Thuận Thành
Lễ hội đền Vua bà;Thành phố Bắc Ninh
Lễ hội đền Bà Chúa Kho;Thành phố Bắc Ninh
Lễ hội chùa Bút Tháp;Huyện Thuận Thành
Làng quan họ Viêm Xá;Thành phố Bắc Ninh
Làng nghề đúc đồng Đại Bái;Huyện Gia Bình
Lễ hội làng Đồng Kỵ;Thị xã Từ Sơn
Đền thờ Lê Phụng Hiểu;Thành phố Bắc Ninh
Chùa Phúc Lâm;Huyện Tiên Du
Đình - Chùa Khúc Toại;Thành phố Bắc Ninh
Chùa Dạm;Thành phố Bắc Ninh
Chùa Đại Bi;Huyện Gia Bình
Hội Lim;Huyện Tiên Du
Lễ hội đền Đô;Thị xã Từ Sơn
Chùa Tổ (Phúc Nghiêm tự);Huyện Thuận Thành
Chùa Tam Sơn;Thị xã Từ Sơn
Thác Roọm;Bắc Kạn
Thác Đầu Đẳng;Bắc Kạn
Đền Thắm;Bắc Kạn
Điểm du lịch Phya Khao;Bắc Kạn
Chùa Thạch Long;Bắc Kạn
Vườn Quốc Gia Ba Bể;Bắc Kạn
Di tích Đèo Giàng;Bắc Kạn
Chợ tình Xuân Dương;Bắc Kạn
Lễ hội Lồng tồng;Bắc Kạn
Lễ hội Đền Từ Hả;Bắc Ninh
Lễ hội Thổ Hà;Bắc Ninh
Lễ hội Yên Thế;Bắc Ninh
Lễ hội Suối Mỡ;Bắc Ninh
Làng gốm Thổ Hà;Bắc Ninh
Khu di tích Khởi nghĩa Yên Thế;Bắc Ninh
Cây dã hương nghìn năm tuổi;Bắc Ninh
Hồ Khe Chão;Bắc Ninh
Chùa Kim Tràng;Bắc Ninh
Chùa Vẽ;Bắc Ninh
Đền Nguyệt Hồ;Bắc Ninh
Thác Ba Tia;Bắc Ninh
Cánh Đồng Hoa Hướng Dương;Bắc Ninh
Khu Du Lịch Sinh Thái Đồng Thông;Bắc Ninh
Khu bảo tồn thiên nhiên Tây Yên Tử;Bắc Ninh
Lăng Dinh Hương;Bắc Ninh
Thác nước Hang Chiêng - Khe Nương Dâu;Bắc Ninh
Thành cổ Xương Giang;Bắc Ninh
Tây Yên Tử;Bắc Ninh
Lễ hội Xuân Ba Bể;Bắc Kạn
Khu ATK, Chợ Đồn Bắc Kạn;Bắc Kạn
Di tích Đồn Phủ Thông;Bắc Kạn
Khu di tích lịch sử Nà Tu;Bắc Kạn
Khu Bảo Tồn Thiên Nhiên Kim Hỷ;Bắc Kạn
Hồ Sinh Thái Bản Chang;Bắc Kạn
Đèo Gió;Bắc Kạn
Thác Nà Khoang;Bắc Kạn
Động Hua Mạ;Bắc Kạn
Động Nàng Tiên;Bắc Kạn
Động Nả Phoòng;Bắc Kạn
Đền An Mã;Bắc Kạn
Thác Bạc bản Vàng;Bắc Kạn
Bản Du Lịch Pác Ngòi;Bắc Kạn
Đảo Bà Góa;Bắc Kạn
Ao Tiên;Bắc Kạn
Làng nghề tương Bần;Hưng Yên
Làng nghề Đúc đồng Lộng Thượng;Hưng Yên
Hồ Bán Nguyệt;Hưng Yên
Đình Đa Ngưu - Đình trăm cột;Hưng Yên
Đền Phượng Hoàng;Hưng Yên
Cụm di tích đền Đa Hòa - đền Dạ Trạch - cửa Hàm Tử - Bãi Sậy;Hưng Yên
Chùa Thái Lạc;Hưng Yên
Chùa Phú Thị;Hưng Yên
Chùa Hương Lãng;Hưng Yên
Văn Miếu Hưng Yên;Hưng Yên
Làng Rượu Vân Hà;Bắc Ninh
Núi Dành;Bắc Ninh
Làng nghề Thổ Hà;Bắc Ninh
Hồ Cấm Sơn;Bắc Ninh
Làng Nôm;Hưng Yên
Làng nghề đan đó Thủ Sỹ;Hưng Yên
Đồng Cao Bắc Giang;Bắc Ninh
Đền Thiên Hậu;Hưng Yên
Đền Quốc Mẫu Âu Cơ;Hưng Yên
Bản Đá Húc;Bắc Ninh
Đền Phượng Hoàng;Hưng Yên
Chùa Phúc Lâm;Hưng Yên
Chùa Chuông;Hưng Yên
Mộ Cổ Đống Thếch;Hoà Bình
Hang Chiều;Hoà Bình
Động Thác Bờ;Hoà Bình
Đền Bồng Lai;Hoà Bình
Bản Văn Mai Châu;Hoà Bình
Bản Pom Coọng;Hoà Bình
Bản Ngòi;Hoà Bình
Bản Giang Mỗ;Hoà Bình
Bản Đá Bia;Hoà Bình
Bản Bước;Hoà Bình
Hồ Hoàn Kiếm;Thành phố Hà Nội
Quần đảo Nam Du;An Giang
Hòn Một;An Giang
Hòn Gầm Ghì;An Giang
Hòn Mây Rút;An Giang
Côn Đảo;Bà Rịa - Vũng Tàu
Hòn Móng Tay;An Giang
Hòn Thơm;An Giang
Hồ Tà Pạ;Huyện Tri Tôn
Rừng tràm Trà Sư;Huyện Tịnh Biên
Cánh đồng Tà Pạ;Huyện Tri Tôn
Cồn Phụng (Cồn Đạo Dừa);Bến Tre
Đồng sen Tháp Mười;Huyện Tháp Mười
Vườn Quốc gia Tràm Chim;Huyện Tam Nông
Làng hoa Sa Đéc;Thành phố Sa Đéc
Thác Voi;Bình Phước
Bãi biển Hồ Cốc;Bà Rịa - Vũng Tàu
Thung Nai;Hoà Bình
Khu Du lịch Sinh thái Vàm Sát;Thành phố Hồ Chí Minh
Thung lũng Mai Châu;Hoà Bình
Vườn quốc gia Nam Cát Tiên;Lâm Đồng
Nhà trưng bày hiện vật, cổ vật văn hoá Thái;Hoà Bình
Lũng Vân;Hoà Bình
Đèo Long Lanh;Lâm Đồng
Thác Đambri;Lâm Đồng
Động Thiên Long;Hoà Bình
Cánh đồng Cẩm Tú Cầu;Lâm Đồng
Động Hoa Tiên;Hoà Bình
Động Đá Bạc;Hoà Bình
Di tích lịch sử Nhà máy in tiền;Hoà Bình
Đèo Đá Trắng;Hoà Bình
Bảo tàng không gian văn hóa Mường;Hoà Bình
Ba Khan;Hoà Bình
Thiền viện Trúc Lâm Hậu Giang;Hậu Giang
Rừng Tràm Vị Thủy - Khu du lịch sinh thái Việt Úc;Hậu Giang
Làng trầu Vị Thủy;Hậu Giang
Khu du lịch sinh thái Tầm Vu;Hậu Giang
Khu căn cứ Tỉnh ủy (căn cứ Bà Bái);Hậu Giang
Khu Bảo tồn Thiên nhiên Lung Ngọc Hoàng;Hậu Giang
Di tích lịch sử quốc gia đặc biệt Chiến thắng Chương Thiện;Hậu Giang
Đền thờ Bác Hồ;Hậu Giang
Chùa Aranhứt;Hậu Giang
Hải đăng Kê Gà;Bình Thuận
Núi lửa Chư Đăng Ya;Huyện Chư Păh
Hồ T’Nưng;Thành phố Pleiku
Biển Hồ chè;Huyện KBang
Núi Ngọc Linh;Kon Tum
Thác Dray Sáp;Đắc Nông
Hồ Tà Đùng;Đắc Nông
Linh Sơn Viên Giác Tự;Thành phố Hải Phòng
Thác Pongour;Lâm Đồng
Hồ Tuyền Lâm;Lâm Đồng
Khu Di tích núi Voi;Thành phố Hải Phòng
Cung đường Tà Năng;Lâm Đồng
Núi Lang Bian;Lâm Đồng
Cù Lao Câu;Bình Thuận
Chùa Cao Linh;Thành phố Hải Phòng
Bãi biển Kỳ Co;Gia Lai
Cù lao Chàm;Quảng Nam
Phá Tam Giang;Thành phố Huế
Sông Hương;Thành phố Huế
Động Thiên Đường;Quảng Trị
Hang Sơn Đoòng;Quảng Trị
Hang Én;Quảng Trị
Biển Cổ Thạch;Bình Thuận
Đồi cát Nam Cương;Ninh Thuận
Hang Rái;Ninh Thuận
Vịnh Vĩnh Hy;Ninh Thuận
Vườn Quốc Gia Cát Bà;Thành phố Hải Phòng
Vịnh Lan Hạ;Thành phố Hải Phòng
Quán Hoa;Thành phố Hải Phòng
Quần đảo Cát Bà;Thành phố Hải Phòng
Làng Chài Việt Hải;Thành phố Hải Phòng
Đền Bà Đế;Thành phố Hải Phòng
Khu tưởng niệm Vương triều Mạc;Thành phố Hải Phòng
Bãi biển Cửa Lò;Nghệ An
Khu bảo tồn thiên nhiên Pù Luông;Thanh Hoá
Khu du lịch sinh thái Tràng An;Ninh Bình
Tam Cốc - Bích Động;Ninh Bình
Bản Lác - Mai Châu;Hoà Bình
Đảo Điệp Sơn;Khánh Hoà
Đảo Bình Ba;Khánh Hoà
Đảo Bình Hưng;Khánh Hoà
Thác Yang Bay;Khánh Hoà
Biển Đại Lãnh;Khánh Hoà
Hòn Yến;Phú Yên
Hòn Nưa;Phú Yên
Chùa Tháp Tường Long;Thành phố Hải Phòng
Cù Lao Xanh;Gia Lai
Thác K50;Huyện KBang
Ghềnh Đá Đĩa;Phú Yên
Bãi Xép;Phú Yên
Chùa Phổ Chiếu;Thành phố Hải Phòng
Chùa Đỏ (Linh Độ Tự);Thành phố Hải Phòng
Bến nghiêng - Bến tàu không số;Thành phố Hải Phòng
Hồ Ba Bể;Bắc Kạn
Bãi biển Hoàng Hậu;Gia Lai
Đèo Mã Pì Lèng;Hà Giang
Núi đôi Quản Bạ;Hà Giang
Động Thác Bờ;Hoà Bình
Đền Đại Cại - núi Hắc Y;Lào Cai
Vườn thú Hà Nội;Thành phố Hà Nội
Điểm du lịch làng nghề sinh vật cảnh Hồng Vân;Thành phố Hà Nội
Điểm du lịch làng nghề may Vân Từ;Thành phố Hà Nội
Điểm du lịch làng nghề khảm trai - sơn mài Chuyên Mỹ;Thành phố Hà Nội
Điểm du lịch Di tích Lịch sử nhà tù Hỏa Lò;Thành phố Hà Nội
Làng gốm Bát Tràng;Thành phố Hà Nội
Làng cổ Đường Lâm;Thành phố Hà Nội
Điểm du lịch Bảo tàng Lịch sử quốc gia;Thành phố Hà Nội
Bảo tàng Lịch sử Quân sự (Bảo tàng Quân Đội);Thành phố Hà Nội
Công viên Thiên đường Bảo Sơn;Thành phố Hà Nội
Khu du lịch sinh thái nước khoáng nóng Tiên Lãng;Thành phố Hải Phòng
Khu di tích Trạng Trình Nguyễn Bỉnh Khiêm;Thành phố Hải Phòng
Trung tâm Văn hóa Huyền Trân;Thành phố Huế
Cầu Ngói Thanh Toàn;Thành phố Huế
Nhà vườn Lương Quán – Nguyệt Biều;Thành phố Huế
Làng Cổ Phước Tích;Thành phố Huế
Điểm du lịch sinh thái Đầm Chuồn;Thành phố Huế
Làng nghề truyền thống Hoa giấy Thanh Tiên – Tranh dân gian Làng Sình;Thành phố Huế
Điểm du lịch sinh thái YesHue Eco;Thành phố Huế
Hồ Truồi;Thành phố Huế
Thác Nhị Hồ;Thành phố Huế
Bảo tàng Lịch sử thành phố Hồ Chí Minh;Thành phố Hồ Chí Minh
Chợ Bến Thành;Thành phố Hồ Chí Minh
Nhà trưng bày Hoàng Sa;Thành phố Đà Nẵng
Thắng cảnh Hương Sơn;Thành phố Hà Nội
Thắng cảnh Tràng Kênh;Thành phố Hải Phòng
Cảng cá - Chợ cá Thuận Phước;Thành phố Đà Nẵng
Làng cổ Tuý Loan;Thành phố Đà Nẵng
Đền Nghè;Thành phố Hải Phòng
Khu Bảo tồn sinh quyển thế giới Cát Bà;Thành phố Hải Phòng
Thành phố Hải Phòng;Thành phố Hải Phòng
Biệt thự Bảo Đại;Thành phố Hải Phòng
Nghĩa trang Khuê Trung;Thành phố Đà Nẵng
Đình Nại Nam;Thành phố Đà Nẵng
Nhà thờ phái chư tộc Quá Giáng;Thành phố Đà Nẵng
Thành Điện Hải;Thành phố Đà Nẵng
Mộ Ông Ích Khiêm;Thành phố Đà Nẵng
Cung Thể thao Tiên Sơn;Thành phố Đà Nẵng
Đình Bồ Bản;Thành phố Đà Nẵng
Đình Tuý Loan;Thành phố Đà Nẵng
Làng đá mỹ nghệ Non Nước;Thành phố Đà Nẵng
Bãi biển Nam Ô;Thành phố Đà Nẵng
Bảo tàng điêu khắc Chămpa;Thành phố Đà Nẵng
Bà Nà - Núi Chúa;Thành phố Đà Nẵng
Ngũ Hành Sơn;Thành phố Đà Nẵng
Đình Hàng Kênh;Thành phố Hải Phòng
Bãi biển Ðồ Sơn;Thành phố Hải Phòng
Chùa Tam Thai;Thành phố Đà Nẵng
Đèo Hải Vân;Thành phố Đà Nẵng
Khu bảo tồn thiên nhiên Sơn Trà;Thành phố Đà Nẵng
Lễ hội Cá Ông;Thành phố Đà Nẵng
Bảo tàng Hồ Chí Minh;Thành phố Đà Nẵng
Bến Ninh Kiều;Thành phố Cần Thơ
Thiền viện Trúc Lâm Phương Nam;Thành phố Cần Thơ
Chùa Nam Nhã;Thành phố Cần Thơ
Du lịch vườn Cần Thơ;Thành phố Cần Thơ
Đình Bình Thủy;Thành phố Cần Thơ
Chợ nổi Cái Răng;Thành phố Cần Thơ
Nhà cổ Bình Thủy;Thành phố Cần Thơ
Chùa Ông;Thành phố Cần Thơ
Bảo tàng Phụ nữ Nam Bộ;Thành phố Hồ Chí Minh
Bảo tàng Mỹ thuật Tp. Hồ Chí Minh;Thành phố Hồ Chí Minh
Bảo tàng chứng tích chiến tranh;Thành phố Hồ Chí Minh
Đền Ngọc Sơn;Thành phố Hà Nội
Lăng Đồng Khánh;Thành phố Huế
Hội quán Quảng Đông;Quảng Nam
Bãi biển Sầm Sơn;Thanh Hoá
Chùa Quán Sứ;Thành phố Hà Nội
Hồ Đa Nhim - Đèo Ngoạn Mục;Lâm Đồng
Bãi biển Cửa Tùng;Huyện Vĩnh Linh
Suối nước khoáng Mỹ An;Thành phố Huế
Khu di tích lăng Mạc Cửu;An Giang
Cầu Trường Tiền;Thành phố Huế
Vườn quốc gia Bạch Mã;Thành phố Huế
Lăng Dục Ðức;Thành phố Huế
Lăng Gia Long (Thiên Thọ Lăng);Thành phố Huế
Núi Ngự Bình;Thành phố Huế
Trung tâm văn hóa Huyền Trân;Thành phố Huế
Làng Dương Nỗ;Thành phố Huế
Làng cổ Phước Tích;Thành phố Huế
Chùa Thiên Mụ;Thành phố Huế
Cửu vị thần công;Thành phố Huế
Lăng Minh Mạng;Thành phố Huế
Ngọ Môn;Thành phố Huế
Chợ Đông Ba;Thành phố Huế
Lăng Tự Ðức (Khiêm Lăng);Thành phố Huế
Lăng Khải Định (Ứng Lăng);Thành phố Huế
Bãi biển Thuận An;Thành phố Huế
