name;province
Xí nghiệp sản xuất Gốm cổ Huế;TP. Huế
Trung tâm thương mại Vincom Plaza Trà Vinh;Vĩnh Long
Cửa hàng thời trang N2.Store;Vĩnh Long
Cửa hàng chả hoa Năm Thụy;Vĩnh Long
Cửa hàng quần áo nữ Mây Shop TV;Vĩnh Long
Siêu thị Co.opmart Trà Vinh;Vĩnh Long
Cửa hàng Trầm Hương Việt;TP. Hồ Chí Minh
Trung tam thương mại Gigamall;TP. Hồ Chí Minh
Trung tâm thương mại Crescent Mall;TP. Hồ Chí Minh
Cửa hàng mua sắm quà lưu niệm tại Khu du lịch Vinh Sang;Vĩnh Long
Phố đi bộ Vĩnh Long;Vĩnh Long
Vincom Plaza Vĩnh Long;Vĩnh Long
Chợ Mường Lò;Lào Cai
Trung tâm thương mại Vincom Plaza;Lào Cai
Siêu thị Bách hóa XANH 70 Hùng Vương;Vĩnh Long
Siêu thị GO! Trà Vinh;Vĩnh Long
Siêu thị Lý Hùng;Phú Thọ
Siêu thị Lan Chi Mart Vĩnh Yên;Phú Thọ
Siêu thị Coopmart Vĩnh Yên;Phú Thọ
Siêu thị Big C Vĩnh Phúc;Phú Thọ
Siêu thị Battrang Family Vĩnh Phúc;Phú Thọ
Làng mộc Bích Chu;Phú Thọ
Làng gốm Hương Canh;Phú Thọ
Điểm dừng chân Tam Đảo;Phú Thọ
Chợ Vĩnh Yên;Phú Thọ
Chợ đêm Tam Đảo;Phú Thọ
Cửa hàng thời trang Vascara;Vĩnh Long
Siêu thị Co.op Mart Vĩnh Long;Vĩnh Long
Cơ sở chè Suối Giàng Duy Thịnh;Lào Cai
Cửa hàng thời trang Zenda;Lào Cai
Trung tâm mua sắm Dũng Linh;Lào Cai
Siêu thị TDM;Vĩnh Long
Chợ Vĩnh Long;Vĩnh Long
HTX bánh tráng Cù Lao Mây;Vĩnh Long
Vĩnh Long Bưởi năm roi;Vĩnh Long
Vườn Thanh Trà Ông Hai;Vĩnh Long
Bánh ú Đa Lộc;Vĩnh Long
Cơ sở sản xuất củ cải muối Chịt Sa;Vĩnh Long
Cơ sở Thủy Tiên (Cô Tư Cúc);Vĩnh Long
Cửa hàng bát tét Trà Cuôn;Vĩnh Long
Doanh nghiệp Long Vinh;Vĩnh Long
Dừa sáp Cầu Kè;Vĩnh Long
Tôm khô Vinh Kim dì Hai Khâm;Vĩnh Long
