province,region,hashtag_query,video_id,title,channel_title,published_at,views,likes,comments,url,province_normalized
Hà Nội,ĐỒNG BẰNG SÔNG HỒNG,#hanoi,tQmIozp0D5g,"Dự báo thời tiết Hà Nội hôm nay 17/12 | Hà Nội sáng có mưa nhỏ rải rác, trời rét, trưa hửng nắng",HTV - Đài Hà Nội,2025-12-16T23:30:21Z,1407,17,0,https://www.youtube.com/watch?v=tQmIozp0D5g,TP. Hà Nội
Hà Nội,ĐỒNG BẰNG SÔNG HỒNG,#hanoi,CSolf4tKhKY,"Dự báo thời tiết Hà Nội đêm nay, ngày mai 17/12 | Hà Nội đêm lạnh sâu, ngày nắng ấm",HTV - Đài Hà Nội,2025-12-16T13:42:17Z,6491,37,0,https://www.youtube.com/watch?v=CSolf4tKhKY,TP. Hà Nội
Hà Nội,ĐỒNG BẰNG SÔNG HỒNG,#hanoi,3Eb3PnIdUKo,Hà Nội bắt đầu mở bán hàng trăm nhà ở xã hội với mức giá thấp đến ngỡ ngàng,Thể Thao Văn Hóa,2025-12-17T03:32:29Z,49,1,1,https://www.youtube.com/watch?v=3Eb3PnIdUKo,TP. Hà Nội
Hà Nội,ĐỒNG BẰNG SÔNG HỒNG,#hanoi,bPsZk4guaJI,"Bức xúc vụ tài xế xe buýt ở Hà Nội bị nhóm người đánh dã man ngay trên xe, công an vào cuộc khẩn",Tạp chí VietTimes,2025-12-16T07:38:24Z,1892,10,0,https://www.youtube.com/watch?v=bPsZk4guaJI,TP. Hà Nội
Hà Nội,ĐỒNG BẰNG SÔNG HỒNG,#hanoi,z-aBp_Gw_HY,Vụ tài xế xe buýt bị hành hung ở Hà Nội: Tiết lộ lời đe dọa lạnh người của kẻ côn đồ,Báo Sức khỏe & Đời sống,2025-12-16T22:01:08Z,7320,25,0,https://www.youtube.com/watch?v=z-aBp_Gw_HY,TP. Hà Nội
Hà Nội,ĐỒNG BẰNG SÔNG HỒNG,#hanoi,uMHekjJTcaQ,"""Rước nàng về rinh"" - Iphone 17pro max... Cảm ơn chị Mạnh Thường Quân",Minh Hà Nội,2025-12-16T10:49:04Z,15303,2024,137,https://www.youtube.com/watch?v=uMHekjJTcaQ,TP. Hà Nội
Hà Nội,ĐỒNG BẰNG SÔNG HỒNG,#hanoi,nXjKuPuTbp8,"Hà Nội “bấm nút” 2 siêu dự án triệu tỷ: lớn nhất đất nước , ngỡ ngàng về kế hoạch",Thể Thao Văn Hóa,2025-12-14T08:21:08Z,65824,1739,2,https://www.youtube.com/watch?v=nXjKuPuTbp8,TP. Hà Nội
Hà Nội,ĐỒNG BẰNG SÔNG HỒNG,#hanoi,WHQFnE6J5_g,"Công an Hà Nội kiểm tra, xử lý xe khách vi phạm trước Tết dương lịch | Báo Đại Đoàn Kết",Đại Đoàn Kết TV,2025-12-17T02:30:51Z,426,2,0,https://www.youtube.com/watch?v=WHQFnE6J5_g,TP. Hà Nội
Hà Nội,ĐỒNG BẰNG SÔNG HỒNG,#hanoi,yjeVZ7x12qs,Hà Nội: Công bố đường dây nóng tiếp nhận phản ánh vận tải Tết 2026,Báo An ninh Thủ đô,2025-12-17T03:26:26Z,324,1,0,https://www.youtube.com/watch?v=yjeVZ7x12qs,TP. Hà Nội
Hà Nội,ĐỒNG BẰNG SÔNG HỒNG,#hanoi,YoPOcmZK0zw,Thủ tướng Phạm Minh Chính: Định hướng quy hoạch Hà Nội với tầm nhìn trăm năm | Báo Đại Đoàn Kết,Đại Đoàn Kết TV,2025-12-16T10:00:55Z,7631,33,0,https://www.youtube.com/watch?v=YoPOcmZK0zw,TP. Hà Nội
Hà Nội,ĐỒNG BẰNG SÔNG HỒNG,#hanoi,UvaE52ljacc,"Tài xế 'đầu trần' lái xe biển xanh giữa phố Hà Nội, cảnh sát tìm ra cơ quan sở hữu",Báo Tuổi Trẻ,2025-12-16T10:30:32Z,7306,66,0,https://www.youtube.com/watch?v=UvaE52ljacc,TP. Hà Nội
Hà Nội,ĐỒNG BẰNG SÔNG HỒNG,#hanoi,NSA4d-9_k6k,"Choáng với hình hài rộng thênh thang của đường ""đắt nhất hành tinh"" ở Hà Nội sau giải tỏa ""thần tốc""",VTC NEWS,2025-12-15T13:30:32Z,51817,242,4,https://www.youtube.com/watch?v=NSA4d-9_k6k,TP. Hà Nội
Hà Nội,ĐỒNG BẰNG SÔNG HỒNG,#hanoi,KrjPaGODxT8,2 siêu dự án hàng triệu tỷ của Hà Nội khiến người dân chờ đợi sự phát triển,Báo Pháp luật Việt Nam,2025-12-14T08:24:03Z,5365,349,1,https://www.youtube.com/watch?v=KrjPaGODxT8,TP. Hà Nội
Hà Nội,ĐỒNG BẰNG SÔNG HỒNG,#hanoi,1LOJ9JWWpHE,Trả lại tiền cho Moom? Iphone 17 promax sắp về - Cậy khế lại đánh đu...,Minh Hà Nội,2025-12-16T04:19:24Z,11610,1660,204,https://www.youtube.com/watch?v=1LOJ9JWWpHE,TP. Hà Nội
Hà Nội,ĐỒNG BẰNG SÔNG HỒNG,#hanoi,fbgvzNFecOU,"Thời sự Hà Nội tối 16/12/2025: Khởi công và khánh thành các công trình trị giá 3,4 triệu tỷ đồng,...",HTV - Đài Hà Nội,2025-12-16T13:31:10Z,3910,22,0,https://www.youtube.com/watch?v=fbgvzNFecOU,TP. Hà Nội
Hà Nội,ĐỒNG BẰNG SÔNG HỒNG,#hanoi,VDctUL1GLkI,Dự báo thời tiết ngày mai 17/12: Hà Nội mưa nhỏ và TP. HCM có mưa diện rộng | BXD,Báo Xây dựng,2025-12-16T13:00:07Z,1780,7,0,https://www.youtube.com/watch?v=VDctUL1GLkI,TP. Hà Nội
Hà Nội,ĐỒNG BẰNG SÔNG HỒNG,#hanoi,WXdukCR_enw,"Hà Nội: Nhóm thanh niên hành hung tài xế xe buýt đến mức nhập viện, công an xác minh khẩn",Báo Tiền Phong News,2025-12-16T09:03:00Z,3182,12,0,https://www.youtube.com/watch?v=WXdukCR_enw,TP. Hà Nội
Hà Nội,ĐỒNG BẰNG SÔNG HỒNG,#hanoi,gHTkq9dMh7Y,"Hiệu trưởng Cao đẳng Du lịch Hà Nội “ăn chặn” tiền A80 bị khởi tố, sinh viên chưa nhận hỗ trợ đợt 2",Vietnam Plus,2025-12-16T15:15:10Z,408,0,0,https://www.youtube.com/watch?v=gHTkq9dMh7Y,TP. Hà Nội
Hà Nội,ĐỒNG BẰNG SÔNG HỒNG,#hanoi,giECnu9ICr4,"Thời sự Hà Nội sáng 16/12/2025: Khai mạc Đại hội TDTT Thủ đô lần thứ XI – Năm 2025,...",HTV - Đài Hà Nội,2025-12-16T00:43:20Z,5205,17,0,https://www.youtube.com/watch?v=giECnu9ICr4,TP. Hà Nội
Hà Nội,ĐỒNG BẰNG SÔNG HỒNG,#hanoi,k2ZkuIGcoUY,Hà Nội thông qua 'siêu dự án' 855 nghìn tỉ bên sông Hồng - VNAMedia,VNAMEDIA - TRUNG TÂM NỘI DUNG SỐ VÀ TRUYỀN THÔNG,2025-12-14T12:01:24Z,11182,43,2,https://www.youtube.com/watch?v=k2ZkuIGcoUY,TP. Hà Nội
Hà Nội,ĐỒNG BẰNG SÔNG HỒNG,#hanoi,DIzuNOMM26c,Thời sự nóng: Hà Nội: Nữ chủ tịch nổi tiếng bán ‘dự án ảo’ lừa đảo người dân hơn 850 tỷ đồng,Tiền Phong TV,2025-12-14T23:00:15Z,8152,102,2,https://www.youtube.com/watch?v=DIzuNOMM26c,TP. Hà Nội
Hà Nội,ĐỒNG BẰNG SÔNG HỒNG,#hanoi,NU-bH0b3FsE,Tổng Bí thư Tô Lâm tiếp xúc cử tri Hà Nội và Hưng Yên| VTV4,VTV4,2025-12-15T18:00:05Z,10342,38,0,https://www.youtube.com/watch?v=NU-bH0b3FsE,TP. Hà Nội
Hà Nội,ĐỒNG BẰNG SÔNG HỒNG,#hanoi,HmV-Dq77kJ0,Khởi tố hiệu trưởng Trường cao đẳng Du lịch Hà Nội ăn chặn tiền A80 của sinh viên| Báo Đại Đoàn Kết,Đại Đoàn Kết TV,2025-12-16T05:00:32Z,2547,10,0,https://www.youtube.com/watch?v=HmV-Dq77kJ0,TP. Hà Nội
Hà Nội,ĐỒNG BẰNG SÔNG HỒNG,#hanoi,hwKUiAQNzWw,Khởi tố Hiệu trưởng Trường Cao đẳng Du lịch Hà Nội cùng đồng phạm| QTTV #shorts,"Báo và Phát thanh, Truyền hình Quảng Trị",2025-12-16T14:38:44Z,788,5,0,https://www.youtube.com/watch?v=hwKUiAQNzWw,TP. Hà Nội
Hà Nội,ĐỒNG BẰNG SÔNG HỒNG,#hanoi,CAf2fb_y24c,"Tường lửa Tràng An [Tập 23] Full 4K | Phim Đài Hà Nội, Phim cảnh sát hình sự, Tội phạm mạng",HTV - Đài Hà Nội,2025-12-16T15:02:31Z,11813,94,0,https://www.youtube.com/watch?v=CAf2fb_y24c,TP. Hà Nội
Hà Nội,ĐỒNG BẰNG SÔNG HỒNG,#hanoi,jrr6gXv0M7I,"Thời sự Hà Nội sáng 17/12/2025: Hệ thống y tế hiện đại nâng cao chất lượng điều trị,...",HTV - Đài Hà Nội,2025-12-17T01:45:57Z,641,10,0,https://www.youtube.com/watch?v=jrr6gXv0M7I,TP. Hà Nội
Hà Nội,ĐỒNG BẰNG SÔNG HỒNG,#hanoi,YijuI2K_8TU,"Bản tin trưa 14-12: Hà Nội rét mướt, nhiệt độ từ 12 đến 21 độ C",Báo Sài Gòn Giải Phóng ,2025-12-14T06:00:06Z,14951,23,0,https://www.youtube.com/watch?v=YijuI2K_8TU,TP. Hà Nội
Hà Nội,ĐỒNG BẰNG SÔNG HỒNG,#hanoi,EOk8FBBWQsI,"Hà Nội sắp có khu đô thị thể thao Olympic hơn 9.000 ha, trị giá 925.000 tỷ đồng | THCL",Thương hiệu & Công luận TV,2025-12-14T13:45:02Z,3070,21,1,https://www.youtube.com/watch?v=EOk8FBBWQsI,TP. Hà Nội
Hà Nội,ĐỒNG BẰNG SÔNG HỒNG,#hanoi,kppr7J1LmXk,"Miền Bắc se lạnh, Hà Nội có mưa nhỏ? | Tin nhanh",Báo Pháp Luật TP HCM,2025-12-16T09:00:06Z,1269,2,0,https://www.youtube.com/watch?v=kppr7J1LmXk,TP. Hà Nội
Hà Nội,ĐỒNG BẰNG SÔNG HỒNG,#hanoi,_mU2WNJ_2lk,"Công an Hà Nội đã dẫn độ “Mr Hunter” Lê Khắc Ngọ về Việt Nam, tiếp tục điều tra vụ án",Báo Tiền Phong News,2025-12-16T04:33:46Z,843,0,0,https://www.youtube.com/watch?v=_mU2WNJ_2lk,TP. Hà Nội
Hà Nội,ĐỒNG BẰNG SÔNG HỒNG,#hanoi,NSJUOsRjFic,"Không khí lạnh liên tục dội về, Bắc Bộ giảm bao nhiêu độ, Hà Nội mưa rét đến bao giờ?",Báo VietNamNet,2025-12-16T13:00:57Z,1834,3,0,https://www.youtube.com/watch?v=NSJUOsRjFic,TP. Hà Nội
Hà Nội,ĐỒNG BẰNG SÔNG HỒNG,#hanoi,VX6mLTE-f4U,Nóng: Danh Sách 9 Phường Tại Hà Nội Cấm Xe Máy Xăng Từ 01/7/2026 #shorts | LuatVietnam.vn,LuatVietnam,2025-12-12T08:25:45Z,23733,74,5,https://www.youtube.com/watch?v=VX6mLTE-f4U,TP. Hà Nội
Hà Nội,ĐỒNG BẰNG SÔNG HỒNG,#hanoi,4l0u-GvZi0c,"Xuyên đêm phá dỡ, cưỡng chế 357 hộ dân để làm tuyến đường “đắt nhất hành tinh” ở ""đất vàng"" Hà Nội! ",VTC NEWS,2025-12-12T11:30:08Z,98248,344,3,https://www.youtube.com/watch?v=4l0u-GvZi0c,TP. Hà Nội
Hà Nội,ĐỒNG BẰNG SÔNG HỒNG,#hanoi,Fcn7dmabZSs,"Né camera AI kiểu lạ đời: Tài xế Hà Nội dùng cát, bã kẹo cao su | BXD",Báo Xây dựng,2025-12-16T13:00:34Z,1526,2,0,https://www.youtube.com/watch?v=Fcn7dmabZSs,TP. Hà Nội
Hà Nội,ĐỒNG BẰNG SÔNG HỒNG,#hanoi,2c6brcmR16I,Bán xôi buổi sớm | Nhịp sống Hà Nội,HTV - Đài Hà Nội,2025-12-14T15:48:58Z,21467,240,8,https://www.youtube.com/watch?v=2c6brcmR16I,TP. Hà Nội
Hà Nội,ĐỒNG BẰNG SÔNG HỒNG,#hanoi,VMc3KYwGZlY,"Miền Bắc rét đậm cả tuần, nhiệt độ Hà Nội bao nhiêu độ? | Tin nhanh",Báo Pháp Luật TP HCM,2025-12-14T21:30:06Z,7516,31,0,https://www.youtube.com/watch?v=VMc3KYwGZlY,TP. Hà Nội
Hà Nội,ĐỒNG BẰNG SÔNG HỒNG,#hanoi,BXAkH1xI_i8,Vụ án Mr Pips: Công an Hà Nội đã dẫn độ “ông trùm” Mr Hunter Lê Khắc Ngọ về nước,Tạp chí VietTimes,2025-12-16T04:03:10Z,1014,0,0,https://www.youtube.com/watch?v=BXAkH1xI_i8,TP. Hà Nội
Hà Nội,ĐỒNG BẰNG SÔNG HỒNG,#hanoi,5kbrdwQ44wY,"Dự báo thời tiết Hà Nội hôm nay 16/12/2025 | Hà Nội trời nhiều mây, không mưa, hanh khô",HTV - Đài Hà Nội,2025-12-15T23:30:01Z,2512,20,0,https://www.youtube.com/watch?v=5kbrdwQ44wY,TP. Hà Nội
Hà Nội,ĐỒNG BẰNG SÔNG HỒNG,#hanoi,8dClDiX_ETk,Khởi tố Hiệu trưởng trường Cao đẳng ở Hà Nội: Hé lộ độc chiêu “xén tiền A80” của sinh viên,Tiền Phong TV,2025-12-16T02:37:30Z,1151,25,7,https://www.youtube.com/watch?v=8dClDiX_ETk,TP. Hà Nội
Hà Nội,ĐỒNG BẰNG SÔNG HỒNG,#hanoi,tPlA9EQCXDY,"Tường lửa Tràng An [Tập 22] Full 4K | Phim Đài Hà Nội, Phim cảnh sát hình sự, Tội phạm mạng",HTV - Đài Hà Nội,2025-12-16T14:00:07Z,21098,185,0,https://www.youtube.com/watch?v=tPlA9EQCXDY,TP. Hà Nội
Hà Nội,ĐỒNG BẰNG SÔNG HỒNG,#hanoi,I5hw3ENPpsk,Tin cực vui cho người mua nhà tại Hà Nội: Mở bán loạt căn hộ giá từ 10 triệu đồng/m2,Báo Pháp luật Việt Nam,2025-12-17T03:42:23Z,152,3,1,https://www.youtube.com/watch?v=I5hw3ENPpsk,TP. Hà Nội
Hà Nội,ĐỒNG BẰNG SÔNG HỒNG,#hanoi,djFAvYIX9uw,"Ngày mai 15/12, Hà Nội chất lượng không khí ở mức xấu | VTVWDB",VTV Thời Tiết,2025-12-14T13:44:46Z,24360,118,0,https://www.youtube.com/watch?v=djFAvYIX9uw,TP. Hà Nội
Hà Nội,ĐỒNG BẰNG SÔNG HỒNG,#hanoi,wnf-udO_mRQ,Vì sao Hà Nội ô nhiễm không khí nghiêm trọng kéo dài? | VTV24,VTV24,2025-12-12T02:10:02Z,30266,278,0,https://www.youtube.com/watch?v=wnf-udO_mRQ,TP. Hà Nội
Hà Nội,ĐỒNG BẰNG SÔNG HỒNG,#hanoi,YpkKpP88Rzc,A.I sẽ giúp giao thông Hà Nội giảm ùn tắc như thế nào? | VTV24,VTV24,2025-12-14T13:13:08Z,13416,85,0,https://www.youtube.com/watch?v=YpkKpP88Rzc,TP. Hà Nội
Hà Nội,ĐỒNG BẰNG SÔNG HỒNG,#hanoi,FATD1jS9hwo,Hà Nội đầu tư 24.000 tỉ để khắc phục úng ngập đô thị,Báo Thanh Niên,2025-12-17T00:00:06Z,338,3,0,https://www.youtube.com/watch?v=FATD1jS9hwo,TP. Hà Nội
Hà Nội,ĐỒNG BẰNG SÔNG HỒNG,#hanoi,lFHgEeeDzbY,Lòng se điếu dài 10m ngon rẻ tại chợ Hà Nội | Bộ lòng se điếu khủng hơn 18m là có thật,BCB,2025-12-15T12:51:27Z,3334,17,49,https://www.youtube.com/watch?v=lFHgEeeDzbY,TP. Hà Nội
Hà Nội,ĐỒNG BẰNG SÔNG HỒNG,#hanoi,8pAymlOkj2g,"Dự báo thời tiết Hà Nội đêm nay, ngày mai 16/12 | Hà Nội đêm lạnh sâu, sáng ra có nắng, trời ấm lên",HTV - Đài Hà Nội,2025-12-15T12:54:24Z,4728,27,0,https://www.youtube.com/watch?v=8pAymlOkj2g,TP. Hà Nội
Hà Nội,ĐỒNG BẰNG SÔNG HỒNG,#hanoi,3UlwRF1HwSE,Đền bù “khu đất kim cương” làm quảng trường Hồ Gươm - Hà Nội: Một hộ dân nhận 400 tỷ đồng | VTC News,VTC NEWS,2025-12-12T13:00:08Z,81925,301,3,https://www.youtube.com/watch?v=3UlwRF1HwSE,TP. Hà Nội
Hà Nội,ĐỒNG BẰNG SÔNG HỒNG,#hanoi,NrsMf55KyDc,"Bản tin trưa 16/12: Hiệu trưởng Trường Cao đẳng Du lịch Hà Nội bị lật tẩy chiêu ""mập mờ"" tiền A80",Báo Điện tử Tiếng nói Việt Nam (VOV),2025-12-16T05:45:06Z,709,10,0,https://www.youtube.com/watch?v=NrsMf55KyDc,TP. Hà Nội
Hà Nội,ĐỒNG BẰNG SÔNG HỒNG,#hanoi,9btK2mGu34s,"Điểm nóng: Hà Nội: 'Mưa lựu đạn' trấn áp ổ quỷ, công an đối mặt ‘tử thần trắng’",Báo Pháp luật Việt Nam,2025-12-10T22:00:09Z,148658,1050,34,https://www.youtube.com/watch?v=9btK2mGu34s,TP. Hà Nội
Phú Thọ,ĐỒNG BẰNG SÔNG HỒNG,#vinhphuc,RTIcrKDSBYM,DÁNG VẺ KHÁC LẠ của cựu bí thư tỉnh ủy Vĩnh Phúc cũ Hoàng Thị Thúy Lan,NEWS TBL ONE,2025-12-16T11:00:52Z,4278,18,1,https://www.youtube.com/watch?v=RTIcrKDSBYM,Phú Thọ
Phú Thọ,ĐỒNG BẰNG SÔNG HỒNG,#vinhphuc,OlNOfYZdxGw,Cựu Bí thư Vĩnh Phúc Hoàng Thị Thúy Lan  khai 'góp công sức đưa kinh tế Vĩnh Phúc đi lên',"Báo và phát thanh, truyền hình Đà Nẵng",2025-12-15T11:21:47Z,17455,64,0,https://www.youtube.com/watch?v=OlNOfYZdxGw,Phú Thọ
Phú Thọ,ĐỒNG BẰNG SÔNG HỒNG,#vinhphuc,yaMH2omoypw,Cựu Bí thư Vĩnh Phúc cũ Hoàng Thị Thúy Lan được đề nghị giảm 24-30 tháng tù,News 24H Việt Nam,2025-12-16T10:30:50Z,42864,38,2,https://www.youtube.com/watch?v=yaMH2omoypw,Phú Thọ
Phú Thọ,ĐỒNG BẰNG SÔNG HỒNG,#vinhphuc,Pny70fBgyKo,"Cựu Bí thư Vĩnh Phúc cũ Hoàng Thị Thuý Lan khóc nghẹn trước tòa, xin được giảm án",Báo Sức khỏe & Đời sống,2025-12-15T11:21:23Z,1983,10,2,https://www.youtube.com/watch?v=Pny70fBgyKo,Phú Thọ
Phú Thọ,ĐỒNG BẰNG SÔNG HỒNG,#vinhphuc,FGSZ4FFBUQ8,"Bất ngờ với DUNG NHAN CỰU BÍ THƯ Vĩnh Phúc Hoàng Thị Thúy Lan tại tòa: Tóc nhuộm đen, trông xinh đẹp",PKT,2025-12-15T11:12:25Z,26829,357,21,https://www.youtube.com/watch?v=FGSZ4FFBUQ8,Phú Thọ
Phú Thọ,ĐỒNG BẰNG SÔNG HỒNG,#vinhphuc,2J546oA7HD4,"Ngày mai cựu Bí thư, cựu Chủ tịch tỉnh Vĩnh Phúc cũ hầu tòa phúc thẩm",TheAnh24h,2025-12-16T03:12:18Z,12325,12,1,https://www.youtube.com/watch?v=2J546oA7HD4,Phú Thọ
Phú Thọ,ĐỒNG BẰNG SÔNG HỒNG,#vinhphuc,iIFuC-AO-W4,Cựu Bí thư Tỉnh ủy Vĩnh Phúc cũ Hoàng Thị Thúy Lan lộ dáng vẻ khác lạ trong phiên xét xử,Báo Sức khỏe & Đời sống,2025-12-15T08:06:06Z,1246,6,0,https://www.youtube.com/watch?v=iIFuC-AO-W4,Phú Thọ
Phú Thọ,ĐỒNG BẰNG SÔNG HỒNG,#vinhphuc,-LTbQYLj1uU,Hình ảnh cựu Bí thư Vĩnh Phúc cũ Hoàng Thị Thúy Lan tại phiên tòa phúc thẩm | Tin nhanh,Báo Pháp Luật TP HCM,2025-12-15T10:30:06Z,826,0,0,https://www.youtube.com/watch?v=-LTbQYLj1uU,Phú Thọ
Phú Thọ,ĐỒNG BẰNG SÔNG HỒNG,#vinhphuc,4sFz1khpzOE,Thái độ lạ của Cựu Bí thư Vĩnh Phúc (cũ) trong phiên tòa phúc thẩm vụ Tập đoàn Phúc Sơn,Thể Thao Văn Hóa,2025-12-15T10:52:49Z,1001,29,1,https://www.youtube.com/watch?v=4sFz1khpzOE,Phú Thọ
Phú Thọ,ĐỒNG BẰNG SÔNG HỒNG,#vinhphuc,DnWGTE9TEmw,"Cựu Bí thư Vĩnh Phúc cũ Hoàng Thị Thuý Lan nghẹn ngào: Gia đình rất khó khăn, xin được giảm án",Báo Tiền Phong News,2025-12-15T22:33:01Z,1366,0,0,https://www.youtube.com/watch?v=DnWGTE9TEmw,Phú Thọ
Phú Thọ,ĐỒNG BẰNG SÔNG HỒNG,#vinhphuc,TQjOOA0u7MU,Dáng vẻ khác lạ của cựu Bí thư Tỉnh ủy Vĩnh Phúc cũ Hoàng Thị Thúy Lan,Vietnam Now,2025-12-15T05:38:32Z,3142,6,0,https://www.youtube.com/watch?v=TQjOOA0u7MU,Phú Thọ
Phú Thọ,ĐỒNG BẰNG SÔNG HỒNG,#vinhphuc,Ls9kQwuyzt8,Cựu Bí thư tỉnh Vĩnh Phúc xin hưởng án treo để chăm lo mộ phần tổ tiên | SKĐS,Báo Sức khỏe & Đời sống,2025-12-16T07:02:27Z,1140,13,0,https://www.youtube.com/watch?v=Ls9kQwuyzt8,Phú Thọ
Phú Thọ,ĐỒNG BẰNG SÔNG HỒNG,#vinhphuc,-wvINi91LiE,Dáng vẻ khác lạ của cựu Bí thư Tỉnh ủy Vĩnh Phúc cũ Hoàng Thị Thúy Lan trong phiên tòa xét xử,Tạp chí VietTimes,2025-12-15T08:32:53Z,1268,1,0,https://www.youtube.com/watch?v=-wvINi91LiE,Phú Thọ
Phú Thọ,ĐỒNG BẰNG SÔNG HỒNG,#vinhphuc,xr4YwHK1IaI,Cựu Bí thư Tỉnh ủy Vĩnh Phúc (cũ) khóc như mưa trong phiên tòa phúc thẩm vụ Tập đoàn Phúc Sơn,VẤN ĐỀ HÔM NAY,2025-12-15T11:09:04Z,3822,296,3,https://www.youtube.com/watch?v=xr4YwHK1IaI,Phú Thọ
Phú Thọ,ĐỒNG BẰNG SÔNG HỒNG,#vinhphuc,TaCe3kP998Y,Cựu Bí thư Vĩnh Phúc Hoàng Thị Thúy Lan được đề nghị giảm 24 - 30 tháng tù,Báo Thanh Niên,2025-12-16T08:15:07Z,2717,17,0,https://www.youtube.com/watch?v=TaCe3kP998Y,Phú Thọ
Phú Thọ,ĐỒNG BẰNG SÔNG HỒNG,#vinhphuc,lU0i0F_blpY,"Cựu Bí thư Vĩnh Phúc Hoàng Thị Thúy Lan hầu tòa phúc thẩm, xuất hiện loạt tình tiết đặc biệt mới",Tiền Phong TV,2025-12-15T06:21:32Z,2946,78,8,https://www.youtube.com/watch?v=lU0i0F_blpY,Phú Thọ
Phú Thọ,ĐỒNG BẰNG SÔNG HỒNG,#vinhphuc,u5yXGZ_AklY,Cựu Bí thư Vĩnh Phúc Hoàng Thị Thúy Lan thú nhận ‘rất đau đớn’ khi phải đứng trước tòa,Ninh Bình Digital,2025-12-17T02:00:57Z,28,0,0,https://www.youtube.com/watch?v=u5yXGZ_AklY,Phú Thọ
Phú Thọ,ĐỒNG BẰNG SÔNG HỒNG,#vinhphuc,QBFuwmTQxUI,Sốc: Cựu Bí thư Tỉnh ủy Vĩnh Phúc Phạm Văn Vọng xin hưởng án treo để chăm sóc vợ | BXD,Báo Xây dựng,2025-12-16T11:46:25Z,145,2,0,https://www.youtube.com/watch?v=QBFuwmTQxUI,Phú Thọ
Phú Thọ,ĐỒNG BẰNG SÔNG HỒNG,#vinhphuc,zgFlGgqE8kI,Vụ Phúc Sơn: Cựu Bí thư Vĩnh Phúc Phạm Văn Vọng xin hưởng án treo vì vợ bị ung thư | THCL,Thương hiệu & Công luận TV,2025-12-16T08:05:55Z,431,4,3,https://www.youtube.com/watch?v=zgFlGgqE8kI,Phú Thọ
Phú Thọ,ĐỒNG BẰNG SÔNG HỒNG,#vinhphuc,HFReSiQWgrY,Cựu Bí thư Tỉnh ủy Vĩnh Phúc khai gì tại phiên tòa phúc thẩm?,TẠP CHÍ KINH TẾ ,2025-12-15T11:00:36Z,4431,16,0,https://www.youtube.com/watch?v=HFReSiQWgrY,Phú Thọ
Phú Thọ,ĐỒNG BẰNG SÔNG HỒNG,#vinhphuc,HDB6yeSuii4,"Gia đình cựu Bí thư Tỉnh ủy Vĩnh Phúc mong dư luận thấu hiểu, chia sẻ  #tintuc #news",Báo Hà Nội Mới,2025-12-13T15:55:03Z,2662,12,0,https://www.youtube.com/watch?v=HDB6yeSuii4,Phú Thọ
Phú Thọ,ĐỒNG BẰNG SÔNG HỒNG,#vinhphuc,tjBrcHP5VI0,Bị cáo Hoàng Thị Thúy Lan và các cựu lãnh đạo tỉnh Vĩnh Phúc được đề nghị giảm án,Báo Sài Gòn Giải Phóng ,2025-12-16T07:50:10Z,207,1,0,https://www.youtube.com/watch?v=tjBrcHP5VI0,Phú Thọ
Phú Thọ,ĐỒNG BẰNG SÔNG HỒNG,#vinhphuc,pnqiNHwmCI0,Vì sao cựu bí thư Vĩnh Phúc và nhiều cấp dưới được đề nghị giảm án? | ANTV,ANTV - Truyền hình Công an Nhân dân,2025-12-16T08:57:30Z,2188,7,0,https://www.youtube.com/watch?v=pnqiNHwmCI0,Phú Thọ
Phú Thọ,ĐỒNG BẰNG SÔNG HỒNG,#vinhphuc,QLC812YYc0k,Cựu Bí thư Tỉnh ủy Vĩnh Phúc khai gì tại phiên tòa phúc thẩm?,BẢO HIỂM PJICO,2025-12-15T10:45:58Z,1676,10,0,https://www.youtube.com/watch?v=QLC812YYc0k,Phú Thọ
Phú Thọ,ĐỒNG BẰNG SÔNG HỒNG,#vinhphuc,aNqGsjbVOCA,Bị cáo Hoàng Thị Thúy Lan và các cựu lãnh đạo tỉnh Vĩnh Phúc được đề nghị giảm án,Báo Sài Gòn Giải Phóng ,2025-12-16T09:30:00Z,1216,4,0,https://www.youtube.com/watch?v=aNqGsjbVOCA,Phú Thọ
Phú Thọ,ĐỒNG BẰNG SÔNG HỒNG,#vinhphuc,X8HN4NbSowA,Xét xử phúc thẩm vụ án Tập đoàn Phúc Sơn: Dáng vẻ khác lạ của cựu Bí thư Tỉnh ủy Vĩnh Phúc cũ,Báo Tiền Phong News,2025-12-15T08:33:00Z,1473,0,0,https://www.youtube.com/watch?v=X8HN4NbSowA,Phú Thọ
Phú Thọ,ĐỒNG BẰNG SÔNG HỒNG,#vinhphuc,w2hHwIKiFVM,Thi công chống sét hiện đại nhà cao 2 tầng ở Vĩnh Phúc #hungdiensach #tintuc #quattrandep #chongset,Hưng Điện Sạch,2025-12-15T12:35:12Z,665,7,0,https://www.youtube.com/watch?v=w2hHwIKiFVM,Phú Thọ
Phú Thọ,ĐỒNG BẰNG SÔNG HỒNG,#vinhphuc,WVfJsTVBPi0,Nhà giáo 8x Huỳnh Vĩnh Phúc đạt chuẩn Giáo sư,Miền Tây THĐT2,2025-11-19T04:00:36Z,45,0,0,https://www.youtube.com/watch?v=WVfJsTVBPi0,Phú Thọ
Phú Thọ,ĐỒNG BẰNG SÔNG HỒNG,#vinhphuc,zHmJ6w2-Nss,bán nhà cấp 4 đẹp tp Vĩnh Yên,Bất động sản Vĩnh Phúc ( Hồng Nhung ),2025-12-16T12:53:55Z,886,2,0,https://www.youtube.com/watch?v=zHmJ6w2-Nss,Phú Thọ
Phú Thọ,ĐỒNG BẰNG SÔNG HỒNG,#vinhphuc,y5PR_TmVyBo,Bàn giao xe Toyota Vios màu trắng ngọc trai - Toyota Vĩnh Phúc : 0978495552  #toyotavinhphuc,Toyota Hiroshima Vĩnh Phúc - HT ,2025-12-16T04:00:59Z,1066,3,0,https://www.youtube.com/watch?v=y5PR_TmVyBo,Phú Thọ
Phú Thọ,ĐỒNG BẰNG SÔNG HỒNG,#vinhphuc,XuTFgt87xc4,Em giao kia moning vĩnh phúc . Em cảm ơn anh hải đã ủng hộ em 0913501229 ,Thành Đạt xe tốt Quảng Ninh,2025-12-16T11:57:14Z,469,24,8,https://www.youtube.com/watch?v=XuTFgt87xc4,Phú Thọ
Phú Thọ,ĐỒNG BẰNG SÔNG HỒNG,#vinhphuc,B8YYEe7Ywa8,Nóng: Cựu Bí thư Tỉnh ủy Vĩnh Phúc Hoàng Thị Thúy Lan sắp hầu tòa phúc thẩm | VTC News,VTC NEWS,2025-11-30T04:30:15Z,2420,15,2,https://www.youtube.com/watch?v=B8YYEe7Ywa8,Phú Thọ
Phú Thọ,ĐỒNG BẰNG SÔNG HỒNG,#vinhphuc,SnGxghkYXBs,Dáng vẻ khác lạ của Cựu Bí thư tỉnh ủy Vĩnh Phúc cũ Hoàng Thị Thúy Lan,BẢO HIỂM PJICO,2025-12-15T11:00:52Z,231,2,2,https://www.youtube.com/watch?v=SnGxghkYXBs,Phú Thọ
Phú Thọ,ĐỒNG BẰNG SÔNG HỒNG,#vinhphuc,WJ9V3GQCNM0,FULL Chung kết : FC Bãi Nội - FC Vĩnh Phúc 🔥 Giải Bóng đá TN xã Liệp Tuyết ( cũ) năm 2025,BÓNG ĐÁ PLUS + HD,2025-12-16T02:53:17Z,4,0,0,https://www.youtube.com/watch?v=WJ9V3GQCNM0,Phú Thọ
Phú Thọ,ĐỒNG BẰNG SÔNG HỒNG,#vinhphuc,6eXp5q9dQJg,Cựu Bí thư Tỉnh ủy Vĩnh Phúc xin giảm án cho cựu chủ tịch tỉnh,Bảo Hân chibi,2025-12-17T00:18:31Z,2194,2,0,https://www.youtube.com/watch?v=6eXp5q9dQJg,Phú Thọ
Phú Thọ,ĐỒNG BẰNG SÔNG HỒNG,#vinhphuc,N1AkfZTnh2Y,PT SHOW| GIẢI PICKLEBALL PT SHOW VĨNH PHÚC MỞ RỘNG LÂN THỨ 1 - NĂM 2025| #ptshow,PT Group ,2025-11-21T07:10:56Z,3,0,0,https://www.youtube.com/watch?v=N1AkfZTnh2Y,Phú Thọ
Phú Thọ,ĐỒNG BẰNG SÔNG HỒNG,#vinhphuc,gRKwbhJqaNU,Cảm kết xe cho anh em vĩnh phúc,Lợi mua bán xe oto cũ 0986265090,2025-12-16T13:04:03Z,1065,7,0,https://www.youtube.com/watch?v=gRKwbhJqaNU,Phú Thọ
Phú Thọ,ĐỒNG BẰNG SÔNG HỒNG,#vinhphuc,3VOhBzBNjrQ,PGS. TS Huỳnh Vĩnh Phúc - Nhà giáo đầu tiên đạt chuẩn Giáo sư của Trường Đại học Đồng Tháp | DThU,"TT CHUYỂN GIAO CÔNG NGHỆ, KHỞI NGHIỆP VÀ SỰ KIỆN",2025-11-23T05:58:03Z,16,0,0,https://www.youtube.com/watch?v=3VOhBzBNjrQ,Phú Thọ
Phú Thọ,ĐỒNG BẰNG SÔNG HỒNG,#vinhphuc,Z0EmqCh2TW0,Tiệc cưới Vĩnh Phúc cô dâu chú rể dễ thương quá❣️,Lê Thu Thảo Official,2025-11-30T01:13:57Z,30158,258,9,https://www.youtube.com/watch?v=Z0EmqCh2TW0,Phú Thọ
Phú Thọ,ĐỒNG BẰNG SÔNG HỒNG,#vinhphuc,zohFID8fuJ8,Một dự án trọng điểm ở Phú Thọ vẫn có vốn vì sao  “treo” suốt 16 năm,Thể Thao Văn Hóa,2025-12-11T09:34:21Z,638,19,1,https://www.youtube.com/watch?v=zohFID8fuJ8,Phú Thọ
Phú Thọ,ĐỒNG BẰNG SÔNG HỒNG,#vinhphuc,o_AbH8tw8wA,Đề nghị giảm án 24–30 tháng tù với cựu Bí thư Vĩnh Phúc Hoàng Thị Thúy Lan | THCL,Thương hiệu & Công luận TV,2025-12-16T11:24:22Z,107,1,0,https://www.youtube.com/watch?v=o_AbH8tw8wA,Phú Thọ
Phú Thọ,ĐỒNG BẰNG SÔNG HỒNG,#vinhphuc,R7AfqAFMnyc,Giá xe Toyota Cross Hev màu trắng - #toyotavinhphuc Toyota Vĩnh Phúc : 0978495552,Toyota Hiroshima Vĩnh Phúc - HT ,2025-12-15T23:00:30Z,809,2,0,https://www.youtube.com/watch?v=R7AfqAFMnyc,Phú Thọ
Phú Thọ,ĐỒNG BẰNG SÔNG HỒNG,#vinhphuc,AvB8BsMM6YI,bán nhà đẹp Tp Vĩnh Yên chỉ 3ty2xxtr có ngay nhà đẹp Tp Vĩnh Yên,Bất động sản Vĩnh Phúc ( Hồng Nhung ),2025-12-16T12:51:50Z,853,6,0,https://www.youtube.com/watch?v=AvB8BsMM6YI,Phú Thọ
Phú Thọ,ĐỒNG BẰNG SÔNG HỒNG,#vinhphuc,CQ5AljPnnGg,Trưa 15/12: Thảm kịch sạt lở QL6: Toàn bộ thi thể được tìm thấy trong lớp đất dày |Ninh Bình Digital,Ninh Bình Digital,2025-12-15T04:35:16Z,36578,80,0,https://www.youtube.com/watch?v=CQ5AljPnnGg,Phú Thọ
Phú Thọ,ĐỒNG BẰNG SÔNG HỒNG,#vinhphuc,_P00fyd0MV4,Nhận vali tiền giao đất ưu đãi: Đại biểu Lê Như Tiến NÓI THẲNG lợi ích nhóm vụ bà Hoàng Thị Thúy Lan,VTC NEWS,2025-12-16T11:30:28Z,1155,5,1,https://www.youtube.com/watch?v=_P00fyd0MV4,Phú Thọ
Phú Thọ,ĐỒNG BẰNG SÔNG HỒNG,#vinhphuc,zASL7J5-sUk,Cựu bí thư đảng ủy tỉnh Vĩnh Phúc tại Tòa án,KA KIEM,2025-12-16T10:08:29Z,829,7,0,https://www.youtube.com/watch?v=zASL7J5-sUk,Phú Thọ
Phú Thọ,ĐỒNG BẰNG SÔNG HỒNG,#vinhphuc,VV3rW-qiFMs,Huế và nhạc sĩ Vĩnh Phúc,HUẾ TV,2025-11-24T12:16:17Z,171,4,0,https://www.youtube.com/watch?v=VV3rW-qiFMs,Phú Thọ
Phú Thọ,ĐỒNG BẰNG SÔNG HỒNG,#vinhphuc,gPXJ39IsYjY,Bà Hoàng Thị Thúy Lan xin được giảm án để 'sớm trở về đi chữa bệnh',Báo Tuổi Trẻ,2025-12-16T12:01:31Z,8209,44,0,https://www.youtube.com/watch?v=gPXJ39IsYjY,Phú Thọ
Phú Thọ,ĐỒNG BẰNG SÔNG HỒNG,#vinhphuc,cofiJ5W_3kQ,"Sáng mai, xét xử phúc thẩm hai cựu Bí thư Tỉnh ủy Vĩnh Phúc | ANTV",ANTV - Truyền hình Công an Nhân dân,2025-12-14T10:00:58Z,2305,8,0,https://www.youtube.com/watch?v=cofiJ5W_3kQ,Phú Thọ
Phú Thọ,ĐỒNG BẰNG SÔNG HỒNG,#vinhphuc,pDaQgBrLH1w,Toyota Vios màu trắng ngọc trai bản G -Toyota Vĩnh Phúc : 0978495552 #toyotavinhphuc,Toyota Hiroshima Vĩnh Phúc - HT ,2025-12-06T00:01:08Z,777,9,1,https://www.youtube.com/watch?v=pDaQgBrLH1w,Phú Thọ
Bắc Ninh,ĐỒNG BẰNG SÔNG HỒNG,#bacninh,g85J9n_DVow,Toàn cảnh Vành Đai 4 đoạn Hà Nội – Bắc Ninh || Siêu Dự Án Trọng Điểm Quốc Gia,Hải Phòng Trong Tôi,2025-12-05T12:30:06Z,1798,30,6,https://www.youtube.com/watch?v=g85J9n_DVow,Bắc Ninh
Bắc Ninh,ĐỒNG BẰNG SÔNG HỒNG,#bacninh,uq7iFYQWP3Y,Bắc ninh sử phạt tên tin tặc #tintuc,Điệp ka,2025-12-17T00:49:51Z,593,8,0,https://www.youtube.com/watch?v=uq7iFYQWP3Y,Bắc Ninh
Bắc Ninh,ĐỒNG BẰNG SÔNG HỒNG,#bacninh,SkORvXh8RUM,Hương vị thời gian ở làng Sấu (Bắc Ninh) | Khám phá Việt Nam | VTV Times,Một Vòng Việt Nam,2025-11-23T10:30:19Z,2108,0,0,https://www.youtube.com/watch?v=SkORvXh8RUM,Bắc Ninh
Bắc Ninh,ĐỒNG BẰNG SÔNG HỒNG,#bacninh,xD9KfVuGGDQ,Bắc Ninh sẽ bắn pháo hoa tối khai mạc Lễ hội trái cây,"Báo và Phát thanh, Truyền hình Bắc Ninh",2025-11-22T13:55:16Z,219,0,0,https://www.youtube.com/watch?v=xD9KfVuGGDQ,Bắc Ninh
Bắc Ninh,ĐỒNG BẰNG SÔNG HỒNG,#bacninh,rkxGT4F_xUs,VĐV Bắc Ninh “gặt vàng” tại SEA Games 33 #bacninhtv #truyenhinhbacninh #btv #bacninh #tintucbacninh,Truyền hình Bắc Ninh,2025-12-17T01:22:17Z,1015,20,0,https://www.youtube.com/watch?v=rkxGT4F_xUs,Bắc Ninh
Bắc Ninh,ĐỒNG BẰNG SÔNG HỒNG,#bacninh,kkMhsi0UqyI,"Bắc Bling (Bắc Ninh) - Thu Hà, Đức Thinh | Khai mạc Lễ hội trái cây Bắc Ninh 2025",Truyền hình Bắc Ninh,2025-12-05T14:15:14Z,324,7,1,https://www.youtube.com/watch?v=kkMhsi0UqyI,Bắc Ninh
Bắc Ninh,ĐỒNG BẰNG SÔNG HỒNG,#bacninh,HTjU5Itu3qc,Vì Sao Bắc Ninh Cần Một Sân Bay,HungTV,2025-12-14T00:09:31Z,13888,49,5,https://www.youtube.com/watch?v=HTjU5Itu3qc,Bắc Ninh
Bắc Ninh,ĐỒNG BẰNG SÔNG HỒNG,#bacninh,IL4FlJbl0XM,Cháy lớn trong khu công nghiệp ở Bắc Ninh,Báo Nghệ An,2025-11-28T01:39:52Z,11716,65,1,https://www.youtube.com/watch?v=IL4FlJbl0XM,Bắc Ninh
Bắc Ninh,ĐỒNG BẰNG SÔNG HỒNG,#bacninh,-TwOy9WOyfk,"5 người trói, đánh hội đồng chủ nợ đến tử vong ở Bắc Ninh #antv #shorts #thoisu #gietnguoi",ANTV - Truyền hình Công an Nhân dân,2025-12-13T05:02:40Z,178944,398,8,https://www.youtube.com/watch?v=-TwOy9WOyfk,Bắc Ninh
Bắc Ninh,ĐỒNG BẰNG SÔNG HỒNG,#bacninh,aHYtmf_L8Lc,SAPA TV | HÀNH TRÌNH SĂN TÌM NGỰA LÀM THẮNG CỐ CHO LỄ HỘI TRÁI CÂY BẮC NINH 2025,SAPA TV,2025-12-04T03:49:44Z,117769,817,62,https://www.youtube.com/watch?v=aHYtmf_L8Lc,Bắc Ninh
Bắc Ninh,ĐỒNG BẰNG SÔNG HỒNG,#bacninh,uH5tpq5Bups,"BẮC NINH: C.H.Á.Y LỚN TẠI CÔNG TY SẢN XUẤT BỈM, KHĂN GIẤY","Báo và phát thanh, truyền hình Cà Mau",2025-11-28T04:47:40Z,1793,17,0,https://www.youtube.com/watch?v=uH5tpq5Bups,Bắc Ninh
Bắc Ninh,ĐỒNG BẰNG SÔNG HỒNG,#bacninh,SUVMm547CrY,"Án mạng kinh hoàng: Chủ nợ bị 5 gã đàn ông trói, hành hung dã man đến tử vong ở Bắc Ninh",Tạp chí VietTimes,2025-12-12T06:21:14Z,2445,6,0,https://www.youtube.com/watch?v=SUVMm547CrY,Bắc Ninh
Bắc Ninh,ĐỒNG BẰNG SÔNG HỒNG,#bacninh,BcdOQTK7LUs,Bắc Ninh: Cháy lớn bao trùm nhà máy bỉm trong KCN Tiên Sơn | BXD,Báo Xây dựng,2025-11-28T03:49:24Z,16339,58,3,https://www.youtube.com/watch?v=BcdOQTK7LUs,Bắc Ninh
Bắc Ninh,ĐỒNG BẰNG SÔNG HỒNG,#bacninh,kU5yrC2Z_qU,🔴 TRUYỀN HÌNH TRỰC TIẾP | CHƯƠNG TRÌNH KHAI MẠC LỄ HỘI TRÁI CÂY BẮC NINH 2025,Báo Hải Phòng Plus,2025-12-05T15:30:17Z,977,0,0,https://www.youtube.com/watch?v=kU5yrC2Z_qU,Bắc Ninh
Bắc Ninh,ĐỒNG BẰNG SÔNG HỒNG,#bacninh,CptR71H3cUw,[🔴 TRỰC TIẾP ]  LỄ HỘI TRÁI CÂY BẮC NINH 2025,ATV Giải trí,2025-12-06T03:40:11Z,843,10,0,https://www.youtube.com/watch?v=CptR71H3cUw,Bắc Ninh
Bắc Ninh,ĐỒNG BẰNG SÔNG HỒNG,#bacninh,sOb-YndC77c,"Bắc Ninh ‘rung chuyển’ chưa từng có: Xét xử 35 vụ tham nhũng, kết án 169 bị cáo",Tiền Phong TV,2025-12-09T05:11:45Z,560,0,1,https://www.youtube.com/watch?v=sOb-YndC77c,Bắc Ninh
Bắc Ninh,ĐỒNG BẰNG SÔNG HỒNG,#bacninh,SY2qCh74UBo,SAPA TV | CÂY BƯỞI 200 TRIỆU ĐẮT GIÁ NHẤT BẮC NINH TẠI NGÀY KHAI MẠC LỄ HỘI TRÁI CÂY BẮC NINH 2025,SAPA TV,2025-12-06T13:48:25Z,158735,1107,63,https://www.youtube.com/watch?v=SY2qCh74UBo,Bắc Ninh
Bắc Ninh,ĐỒNG BẰNG SÔNG HỒNG,#bacninh,I8IzzRLeg2c,🔴 TRUYỀN HÌNH TRỰC TIẾP | CHƯƠNG TRÌNH KHAI MẠC LỄ HỘI TRÁI CÂY BẮC NINH 2025,Truyền hình Bắc Ninh,2025-12-06T04:54:50Z,3160,21,1,https://www.youtube.com/watch?v=I8IzzRLeg2c,Bắc Ninh
Bắc Ninh,ĐỒNG BẰNG SÔNG HỒNG,#bacninh,c-FQfGgu2U4,"Phường Bắc Giang, tỉnh Bắc Ninh 7/12/2025",Vietnam Discovery,2025-12-10T04:02:00Z,248,2,6,https://www.youtube.com/watch?v=c-FQfGgu2U4,Bắc Ninh
Bắc Ninh,ĐỒNG BẰNG SÔNG HỒNG,#bacninh,zqUtDDHIlUc,Vào Chùa - NSƯT Hồng Luyến | Dân Ca Quan Họ Bắc Ninh Mới Nhất 2026,VanHong HDTV,2025-12-16T12:01:55Z,295,4,6,https://www.youtube.com/watch?v=zqUtDDHIlUc,Bắc Ninh
Bắc Ninh,ĐỒNG BẰNG SÔNG HỒNG,#bacninh,PbdQT99exAc,"Bảo Tàng Bắc Ninh: Tận Mắt Chiêm Ngưỡng 2 BẢO VẬT QUỐC GIA ""Vô Giá""",Go To Bac Ninh,2025-12-16T04:00:32Z,2422,1,1,https://www.youtube.com/watch?v=PbdQT99exAc,Bắc Ninh
Bắc Ninh,ĐỒNG BẰNG SÔNG HỒNG,#bacninh,2Wds2S4tZjM,"Hỏa hoạn kinh hoàng tại khu công nghiệp ở Bắc Ninh, khói đen bốc cao nghi ngút | Tin tức",Báo Người Lao Động,2025-11-28T04:30:06Z,690,0,0,https://www.youtube.com/watch?v=2Wds2S4tZjM,Bắc Ninh
Bắc Ninh,ĐỒNG BẰNG SÔNG HỒNG,#bacninh,Sdjb6wpEmpY,Lễ Hội Trái Cây Lớn Nhất Bắc Ninh Đông Chưa Từng Thấy Bắt Gặp Chị Tuyên Vợ Anh Hải SAPA TV,BẢN EM VLOG,2025-12-07T06:15:19Z,6301,15,0,https://www.youtube.com/watch?v=Sdjb6wpEmpY,Bắc Ninh
Bắc Ninh,ĐỒNG BẰNG SÔNG HỒNG,#bacninh,kJy01XdjMUg,Ông Phạm Hoàng Sơn giữ chức Chủ tịch UBND tỉnh Bắc Ninh - VNAMedia,VNAMEDIA - TRUNG TÂM NỘI DUNG SỐ VÀ TRUYỀN THÔNG,2025-11-17T23:01:05Z,1538,1,0,https://www.youtube.com/watch?v=kJy01XdjMUg,Bắc Ninh
Bắc Ninh,ĐỒNG BẰNG SÔNG HỒNG,#bacninh,KLBnKvF6WOg,Lễ hội trái cây Bắc Ninh 2025: Thêm giá trị cho nông sản địa phương,Supe Lâm Thao,2025-12-06T16:31:50Z,22,0,0,https://www.youtube.com/watch?v=KLBnKvF6WOg,Bắc Ninh
Bắc Ninh,ĐỒNG BẰNG SÔNG HỒNG,#bacninh,lP5cbGl9uqk,Bắc Ninh dẫn đầu cả nước về phát triển nhà ở xã hội | BTV,Truyền hình Bắc Ninh,2025-11-28T04:00:54Z,127,0,0,https://www.youtube.com/watch?v=lP5cbGl9uqk,Bắc Ninh
Bắc Ninh,ĐỒNG BẰNG SÔNG HỒNG,#bacninh,5jMqLz9S_P8,Phó Chủ tịch UBND tỉnh Bắc Ninh Phạm Văn Thịnh phát biểu tại Khai mạc Lễ hội Trái Cây Bắc Ninh 2025,Truyền hình Bắc Ninh,2025-12-05T14:30:09Z,439,2,0,https://www.youtube.com/watch?v=5jMqLz9S_P8,Bắc Ninh
Bắc Ninh,ĐỒNG BẰNG SÔNG HỒNG,#bacninh,2nAUASfN5g0,Go To Bac Ninh: Mô hình Chuyển đổi số Văn hóa tiêu biểu trên sóng Truyền hình Quốc gia,Go To Bac Ninh,2025-12-01T12:45:01Z,2648,2,1,https://www.youtube.com/watch?v=2nAUASfN5g0,Bắc Ninh
Bắc Ninh,ĐỒNG BẰNG SÔNG HỒNG,#bacninh,8799YkZtuGA,"2 Ngày 1 Đêm Ăn Sập Bắc Ninh: Lộ Trình ""Ăn Chơi Quên Lối Về"" Cho Hội Bạn Thân!",Go To Bac Ninh,2025-12-07T12:00:27Z,1390,4,2,https://www.youtube.com/watch?v=8799YkZtuGA,Bắc Ninh
Bắc Ninh,ĐỒNG BẰNG SÔNG HỒNG,#bacninh,6tpO8NVA50U,BẮC NINH: PHÁT TRIỂN NUÔI TRỒNG THỦY SẢN BỀN VỮNG | VTV5,VTV5 - Nhịp sống đồng bào,2025-12-05T13:00:36Z,5,0,0,https://www.youtube.com/watch?v=6tpO8NVA50U,Bắc Ninh
Bắc Ninh,ĐỒNG BẰNG SÔNG HỒNG,#bacninh,1ufH0BDRy_U,Lễ Hội Trái Cây Tỉnh Bắc Ninh Năm 2025,Thế giới tự nhiên,2025-12-04T09:31:55Z,93,8,0,https://www.youtube.com/watch?v=1ufH0BDRy_U,Bắc Ninh
Bắc Ninh,ĐỒNG BẰNG SÔNG HỒNG,#bacninh,Y-DhiKDzImQ,"Bắc Ninh nâng cao hiệu quả Dịch vụ công, giữ vị trí số 1 Toàn quốc",Trung tâm phục vụ hành chính công tỉnh Bắc Ninh,2025-11-28T09:38:22Z,17,0,0,https://www.youtube.com/watch?v=Y-DhiKDzImQ,Bắc Ninh
Bắc Ninh,ĐỒNG BẰNG SÔNG HỒNG,#bacninh,7oYz0tgmlIY,Bản tin thời sự: Lễ hội lớn nhất Bắc Ninh hỗn loạn:Đối tượng ‘lạ’ đánh trọng thương Công an,Tiền Phong TV,2025-12-06T21:30:03Z,133602,970,14,https://www.youtube.com/watch?v=7oYz0tgmlIY,Bắc Ninh
Bắc Ninh,ĐỒNG BẰNG SÔNG HỒNG,#bacninh,CgH1Q0ImGDs,"Tự Hào Kinh Bắc! VTV1 Gọi Tên ""Go To Bac Ninh"" Là Hình Mẫu Du Lịch Thời 4.0",Go To Bac Ninh,2025-12-01T13:15:01Z,2533,3,1,https://www.youtube.com/watch?v=CgH1Q0ImGDs,Bắc Ninh
Bắc Ninh,ĐỒNG BẰNG SÔNG HỒNG,#bacninh,TXlzJ1cboME,Cháy lớn tại Khu công nghiệp ở Bắc Ninh| QTTV,"Báo và Phát thanh, Truyền hình Quảng Trị",2025-11-28T14:27:18Z,1567,8,0,https://www.youtube.com/watch?v=TXlzJ1cboME,Bắc Ninh
Bắc Ninh,ĐỒNG BẰNG SÔNG HỒNG,#bacninh,P03esHqCj0g,Người dân Bắc Ninh kêu cứu: 30 chiếc loa đồng loạt ‘réo vang trời’ từ 4h30 sáng gây ám ảnh,Tiền Phong TV,2025-12-05T02:41:19Z,3317,121,9,https://www.youtube.com/watch?v=P03esHqCj0g,Bắc Ninh
Bắc Ninh,ĐỒNG BẰNG SÔNG HỒNG,#bacninh,Cg4wrocJutI,SAPA TV | TRẢI NGHIỆM VƯỜN BƯỞI DIỄN CHÍN VÀNG VÀ ĂN THẮNG CỐ NGỰA TẠI LỄ HỘI TRÁI CÂY BẮC NINH,SAPA TV,2025-12-08T11:30:08Z,63339,612,50,https://www.youtube.com/watch?v=Cg4wrocJutI,Bắc Ninh
Bắc Ninh,ĐỒNG BẰNG SÔNG HỒNG,#bacninh,XgBx45qNOA4,Bắc Ninh tăng tốc giải quyết hồ sơ lĩnh vực việc làm,Trung tâm phục vụ hành chính công tỉnh Bắc Ninh,2025-11-21T09:46:21Z,23,0,0,https://www.youtube.com/watch?v=XgBx45qNOA4,Bắc Ninh
Bắc Ninh,ĐỒNG BẰNG SÔNG HỒNG,#bacninh,Qyn_0aq4ORQ,Bắc Ninh dẫn đầu tăng trưởng nhờ công nghiệp công nghệ cao | VTV4,VTV4,2025-11-23T18:15:02Z,1070,20,0,https://www.youtube.com/watch?v=Qyn_0aq4ORQ,Bắc Ninh
Bắc Ninh,ĐỒNG BẰNG SÔNG HỒNG,#bacninh,I50CK3ISNNw,Thơm bùi nem nướng Bắc Ninh | Nhịp đập Việt Nam | VTV Times,Một Vòng Việt Nam,2025-11-25T11:30:30Z,193,0,0,https://www.youtube.com/watch?v=I50CK3ISNNw,Bắc Ninh
Bắc Ninh,ĐỒNG BẰNG SÔNG HỒNG,#bacninh,4BEivFpCtG0,"Bắc Ninh rúng động: Đi đòi tiền, người đàn ông bị con nợ đánh đến thiệt mạng",Thể Thao Văn Hóa,2025-12-12T11:30:55Z,2735,187,1,https://www.youtube.com/watch?v=4BEivFpCtG0,Bắc Ninh
Bắc Ninh,ĐỒNG BẰNG SÔNG HỒNG,#bacninh,gMgt7OQP_sc,RỘN RÀNG HỘI CHỢ TRÁI CÂY BĂC NINH NGÀY ÁP CUỐI I NÚI ĐỒI LỤC NGẠN,Nui Doi Luc Ngan 98,2025-12-10T10:23:11Z,1113,9,2,https://www.youtube.com/watch?v=gMgt7OQP_sc,Bắc Ninh
Bắc Ninh,ĐỒNG BẰNG SÔNG HỒNG,#bacninh,SG7FqhfLazo,Đãng Bắc Ninh - Mạnh Xoăn | THẾ GIỚI BIDA,Thế Giới Bida,2025-12-12T06:35:44Z,56290,305,12,https://www.youtube.com/watch?v=SG7FqhfLazo,Bắc Ninh
Bắc Ninh,ĐỒNG BẰNG SÔNG HỒNG,#bacninh,3L-lmze3lWk,🔴TRỰC TIẾP: LỄ HỘI TRÁI CÂY BẮC NINH 2025,"Báo và Phát thanh, Truyền hình Lai Châu",2025-12-05T20:56:18Z,1191,15,0,https://www.youtube.com/watch?v=3L-lmze3lWk,Bắc Ninh
Bắc Ninh,ĐỒNG BẰNG SÔNG HỒNG,#bacninh,hhnk3Tn8rfg,"Vụ mất 45 sổ đỏ: Bắc Ninh chốt hướng xử lý, hỗ trợ người dân hoàn thiện hồ sơ | THCL",Thương hiệu & Công luận TV,2025-12-03T22:30:12Z,259,1,0,https://www.youtube.com/watch?v=hhnk3Tn8rfg,Bắc Ninh
Bắc Ninh,ĐỒNG BẰNG SÔNG HỒNG,#bacninh,CwooZZd4Lh4,🔴 TRỰC TIẾP | CHƯƠNG TRÌNH LỄ HỘI TRÁI CÂY BẮC NINH 2025,Truyền hình Bắc Ninh,2025-12-06T17:15:29Z,1878,9,0,https://www.youtube.com/watch?v=CwooZZd4Lh4,Bắc Ninh
Bắc Ninh,ĐỒNG BẰNG SÔNG HỒNG,#bacninh,gFjlE46cbpk,"Bắc Ninh: Chủ nợ bị 5 người khống chế, hành hung dẫn đến bỏ mạng | BXD",Báo Xây dựng,2025-12-12T15:15:14Z,406,3,0,https://www.youtube.com/watch?v=gFjlE46cbpk,Bắc Ninh
Bắc Ninh,ĐỒNG BẰNG SÔNG HỒNG,#bacninh,cRgP02fxYlY,"Phượt Bắc Ninh 1 Ngày: Check-in Đền Đô, Chùa Phật Tích & Món Ngon Gây Nghiện",Go To Bac Ninh,2025-12-16T03:00:46Z,2418,1,1,https://www.youtube.com/watch?v=cRgP02fxYlY,Bắc Ninh
Bắc Ninh,ĐỒNG BẰNG SÔNG HỒNG,#bacninh,_Zsu6UYRuw8,"Bắc Ninh tăng tốc, bứt phá với chuyển đổi số toàn dân, toàn diện, toàn trình | VTV4",VTV4,2025-11-23T17:01:05Z,358,20,0,https://www.youtube.com/watch?v=_Zsu6UYRuw8,Bắc Ninh
Bắc Ninh,ĐỒNG BẰNG SÔNG HỒNG,#bacninh,Ib9i8wk0-jc,VIỆT NAM NGÀY MỚI | QUỐC TUẤN | Lễ hội trái cây Bắc Ninh 2025 ,Quốc Tuấn Official ,2025-12-06T17:56:48Z,56,0,0,https://www.youtube.com/watch?v=Ib9i8wk0-jc,Bắc Ninh
Quảng Ninh,ĐỒNG BẰNG SÔNG HỒNG,#quangninh,bms1mmuEE38,Quảng Ninh có tân Giám đốc Công an tỉnh,Quảng Ninh TV,2025-11-21T13:42:21Z,11334,18,1,https://www.youtube.com/watch?v=bms1mmuEE38,Quảng Ninh
Quảng Ninh,ĐỒNG BẰNG SÔNG HỒNG,#quangninh,DkEJzzR__xw,Bản tin thời sự 19h45' ngày  5/12/2025,Quảng Ninh TV,2025-12-06T01:11:14Z,1304,5,0,https://www.youtube.com/watch?v=DkEJzzR__xw,Quảng Ninh
Quảng Ninh,ĐỒNG BẰNG SÔNG HỒNG,#quangninh,gtXFWmGn3CI,Quảng Ninh - Nơi đẹp đến nao lòng nhưng đừng đi nếu bạn muốn… giá rẻ,Spiderum,2025-11-22T13:17:54Z,9725,147,30,https://www.youtube.com/watch?v=gtXFWmGn3CI,Quảng Ninh
Quảng Ninh,ĐỒNG BẰNG SÔNG HỒNG,#quangninh,rBChErRJfic,"Su Pet's House-Cẩm Phả, Quảng Ninh đang phát trực tiếp!","Su Pet's House-Cẩm Phả, Quảng Ninh",2025-12-17T02:20:13Z,79,6,0,https://www.youtube.com/watch?v=rBChErRJfic,Quảng Ninh
Quảng Ninh,ĐỒNG BẰNG SÔNG HỒNG,#quangninh,MEAV3MCnNy8,Trận Chung kết: Đội Mông Dương (Quảng Ninh) vs Đội Lâm Thượng (Lào Cai) | CUP VTV5,VTV5 - Sắc màu dân tộc,2025-12-07T03:42:43Z,100471,788,240,https://www.youtube.com/watch?v=MEAV3MCnNy8,Quảng Ninh
Quảng Ninh,ĐỒNG BẰNG SÔNG HỒNG,#quangninh,FsjrjzuVUOU,Giải bóng đã nữ các dân tộc thiểu số tỉnh Quảng Ninh mở rộng năm 2025 - CUP VTV5,VTV5 - Sắc màu dân tộc,2025-12-03T15:21:56Z,10776,56,12,https://www.youtube.com/watch?v=FsjrjzuVUOU,Quảng Ninh
Quảng Ninh,ĐỒNG BẰNG SÔNG HỒNG,#quangninh,jASP0QvpypQ,Quảng Ninh có tân Giám đốc Công an tỉnh | QTV,Quảng Ninh TV,2025-11-22T04:31:32Z,489,1,0,https://www.youtube.com/watch?v=jASP0QvpypQ,Quảng Ninh
Quảng Ninh,ĐỒNG BẰNG SÔNG HỒNG,#quangninh,DI4byh4LbMY,VỤ VIỆC ĐANG GÂY XÔN XAO DƯ LUẬN TẠI QUẢNG NINH  #tuyetnguyendautu #tintucbds #viral,TUYẾT NGUYỄN BĐS,2025-12-17T03:36:34Z,154,3,0,https://www.youtube.com/watch?v=DI4byh4LbMY,Quảng Ninh
Quảng Ninh,ĐỒNG BẰNG SÔNG HỒNG,#quangninh,I20vhDvRwe0,"Cập nhật vụ Mercedes Maybach tông vào xe khách ở Quảng Ninh, 1 người nguy kịch | Tin nhanh",Báo Pháp Luật TP HCM,2025-11-21T01:00:06Z,22414,23,0,https://www.youtube.com/watch?v=I20vhDvRwe0,Quảng Ninh
Quảng Ninh,ĐỒNG BẰNG SÔNG HỒNG,#quangninh,Y046B5wfiB0,Bản tin thời sự 19h45' ngày 10/12/2025,Quảng Ninh TV,2025-12-10T13:29:03Z,865,7,0,https://www.youtube.com/watch?v=Y046B5wfiB0,Quảng Ninh
Quảng Ninh,ĐỒNG BẰNG SÔNG HỒNG,#quangninh,zg9L3OhRycQ,"Quảng Ninh: Phụ nữ dân tộc thiểu số trong trang phục truyền thống đá bóng ""hút"" khán giả",Báo Đại Đoàn Kết,2025-12-04T08:01:20Z,1384,4,0,https://www.youtube.com/watch?v=zg9L3OhRycQ,Quảng Ninh
Quảng Ninh,ĐỒNG BẰNG SÔNG HỒNG,#quangninh,KgX1uCvLfQA,Sửa White Wizard không lên nguồn cho khách #fixtoy #kamenrider #whitewizard #kamenriderwizard #tqn,TQN Shop Quảng Ninh ,2025-12-16T08:40:23Z,4626,160,4,https://www.youtube.com/watch?v=KgX1uCvLfQA,Quảng Ninh
Quảng Ninh,ĐỒNG BẰNG SÔNG HỒNG,#quangninh,FwXvlgWyL9U,Y tế Quảng Ninh hoạt động ổn định sau sắp xếp,Quảng Ninh TV,2025-12-06T04:21:49Z,99,1,0,https://www.youtube.com/watch?v=FwXvlgWyL9U,Quảng Ninh
Quảng Ninh,ĐỒNG BẰNG SÔNG HỒNG,#quangninh,73pM82xE3sk,Dấu ấn HĐND tỉnh Quảng Ninh năm 2025,Quảng Ninh TV,2025-12-15T08:44:06Z,336,0,0,https://www.youtube.com/watch?v=73pM82xE3sk,Quảng Ninh
Quảng Ninh,ĐỒNG BẰNG SÔNG HỒNG,#quangninh,7Ij76tClyQI,Quảng Ninh có tân Giám đốc Công an tỉnh #antv #thoisu #shorts #bocongan #quangninh,ANTV - Truyền hình Công an Nhân dân,2025-11-21T16:07:02Z,11287,50,0,https://www.youtube.com/watch?v=7Ij76tClyQI,Quảng Ninh
Quảng Ninh,ĐỒNG BẰNG SÔNG HỒNG,#quangninh,7ivGZULuN0c,Đảng bộ xã Quảng Ninh triển khai nhiệm vụ năm 2026,Truyền hình Thanh Hóa,2025-12-16T14:14:46Z,33,0,0,https://www.youtube.com/watch?v=7ivGZULuN0c,Quảng Ninh
Quảng Ninh,ĐỒNG BẰNG SÔNG HỒNG,#quangninh,JDY49tiEx0A,Bản tin thời sự 19h45' ngày 21/11/2025,Quảng Ninh TV,2025-11-22T01:25:27Z,1073,8,0,https://www.youtube.com/watch?v=JDY49tiEx0A,Quảng Ninh
Quảng Ninh,ĐỒNG BẰNG SÔNG HỒNG,#quangninh,L2BgZIZ1fDY,Bản tin thời sự 19h45' ngày 30/11/2025,Quảng Ninh TV,2025-11-30T13:36:47Z,1298,3,0,https://www.youtube.com/watch?v=L2BgZIZ1fDY,Quảng Ninh
Quảng Ninh,ĐỒNG BẰNG SÔNG HỒNG,#quangninh,pR6qfwx8Jtw,Bản tin thời sự 19h45' ngày  9/12/2025,Quảng Ninh TV,2025-12-10T01:08:32Z,1093,6,0,https://www.youtube.com/watch?v=pR6qfwx8Jtw,Quảng Ninh
Quảng Ninh,ĐỒNG BẰNG SÔNG HỒNG,#quangninh,_9Wl0_NKHk8,Bản tin thời sự 19h45' ngày  8/12/2025,Quảng Ninh TV,2025-12-09T01:06:23Z,829,5,0,https://www.youtube.com/watch?v=_9Wl0_NKHk8,Quảng Ninh
Quảng Ninh,ĐỒNG BẰNG SÔNG HỒNG,#quangninh,ceIMwIgloIA,Đồng chí Quản Minh Cường giữ chức vụ Bí thư Tỉnh ủy Quảng Ninh,Quảng Ninh TV,2025-12-03T13:58:16Z,3462,10,0,https://www.youtube.com/watch?v=ceIMwIgloIA,Quảng Ninh
Quảng Ninh,ĐỒNG BẰNG SÔNG HỒNG,#quangninh,sMshN7dGbN0,"Kinh nghiệm sắp xếp, tổ chức bộ máy ở Quảng Ninh  | VTV24",VTV24,2025-12-03T05:30:28Z,2909,16,0,https://www.youtube.com/watch?v=sMshN7dGbN0,Quảng Ninh
Quảng Ninh,ĐỒNG BẰNG SÔNG HỒNG,#quangninh,0oQ0qTeDv_o,Bí ẩn vụ Mercedes lao vào xe khách ở Quảng Ninh khiến một người tử vong năm 2025,Vấn Đề Nổi Bật,2025-11-20T23:00:02Z,23510,113,29,https://www.youtube.com/watch?v=0oQ0qTeDv_o,Quảng Ninh
Quảng Ninh,ĐỒNG BẰNG SÔNG HỒNG,#quangninh,D5Ci1DTtShw,Bản tin thời sự 19h45' ngày 20/11/2025,Quảng Ninh TV,2025-11-21T01:22:44Z,891,4,0,https://www.youtube.com/watch?v=D5Ci1DTtShw,Quảng Ninh
Hải Phòng,ĐỒNG BẰNG SÔNG HỒNG,#haiduong,wWXHccIT3fw,"Vụ Án Cô Gái Hải Dương Cứu Chồng: Tại Sao Netizen Tỷ Dân Gọi Là ""Huyền Thoại""?",TIN MỚI Express,2025-11-21T05:35:46Z,15979,77,17,https://www.youtube.com/watch?v=wWXHccIT3fw,TP. Hải Phòng
Hải Phòng,ĐỒNG BẰNG SÔNG HỒNG,#haiduong,yTrmGfKwYC0,Điều Ít Ai Biết Về Việc Sáp Nhập Hải Dương Vào Hải Phòng,Hải Phòng Trong Tôi,2025-11-29T12:30:06Z,25790,219,54,https://www.youtube.com/watch?v=yTrmGfKwYC0,TP. Hải Phòng
Hải Phòng,ĐỒNG BẰNG SÔNG HỒNG,#haiduong,LuyoPhXbO80,Ôi đàn bà: Người đàn ông Hải Dương 16 năm NUÔI CON TU HÚ!?! (đau hơn hoạn),Taca WHY,2025-12-06T05:10:31Z,153233,3013,717,https://www.youtube.com/watch?v=LuyoPhXbO80,TP. Hải Phòng
Hải Phòng,ĐỒNG BẰNG SÔNG HỒNG,#haiduong,zDjdW0oQZQw,Người đàn ông Hải Dương 16 năm NUÔI CON TU HÚ!,Tâm Sự Cùng Minh Chi,2025-12-06T07:32:59Z,65,1,0,https://www.youtube.com/watch?v=zDjdW0oQZQw,TP. Hải Phòng
Hải Phòng,ĐỒNG BẰNG SÔNG HỒNG,#haiduong,_MtjEE5OTJA,"Hải Dương ơi, Miền Xứ Đông Yêu Dấu",Trạm Ký Ức,2025-12-15T09:20:05Z,59,0,0,https://www.youtube.com/watch?v=_MtjEE5OTJA,TP. Hải Phòng
Hải Phòng,ĐỒNG BẰNG SÔNG HỒNG,#haiduong,rhDGbEaQMko,Vietnam Night Market Exploring Hải Dương City Night Market Real Local Street Food Hidden Local Eats,Dinh Quan Travel,2025-11-18T18:31:20Z,5,0,0,https://www.youtube.com/watch?v=rhDGbEaQMko,TP. Hải Phòng
Hải Phòng,ĐỒNG BẰNG SÔNG HỒNG,#haiduong,ys66iOJ9rPc,Hải dương vùng đất giàu tinh thần cách mạng,sercohw,2025-11-23T17:59:32Z,6,0,0,https://www.youtube.com/watch?v=ys66iOJ9rPc,TP. Hải Phòng
Hải Phòng,ĐỒNG BẰNG SÔNG HỒNG,#haiduong,Wj_Pm8Ah5PU,Hải Dương: chồng ngất xỉu khi phát hiện 2 đứa con không phải con mình nhà vợ biết nhưng dấu 20 năm!,Công dân TV - Kiến thức giấy A4,2025-12-08T05:55:12Z,13296,31,1,https://www.youtube.com/watch?v=Wj_Pm8Ah5PU,TP. Hải Phòng
Hải Phòng,ĐỒNG BẰNG SÔNG HỒNG,#haiduong,1qPKPO9aXO0,Lê Thùy Ô TÔ Hải Dương đang phát trực tiếp!,Lê Thùy Ô TÔ Hải Dương,2025-11-20T02:19:28Z,1972,16,9,https://www.youtube.com/watch?v=1qPKPO9aXO0,TP. Hải Phòng
Hải Phòng,ĐỒNG BẰNG SÔNG HỒNG,#haiduong,Py3KVieu6dg,Nuôi con nhưng bị con phản bội ở Hải Dương các bác đã đọc chưa,Khảm Vlogs ,2025-12-05T03:02:23Z,155273,899,6,https://www.youtube.com/watch?v=Py3KVieu6dg,TP. Hải Phòng
Hải Phòng,ĐỒNG BẰNG SÔNG HỒNG,#haiduong,MDCeS57tpEo,Lê Thùy Ô TÔ Hải Dương đang phát trực tiếp!,Lê Thùy Ô TÔ Hải Dương,2025-12-10T17:34:45Z,1251,11,2,https://www.youtube.com/watch?v=MDCeS57tpEo,TP. Hải Phòng
Hải Phòng,ĐỒNG BẰNG SÔNG HỒNG,#haiduong,PFDyjkamJqc,Vở Chèo Chuyện Tình Bên Sông - nhà hát chèo Xứ Đông (nhà hát chèo Hải Dương cũ) | Sân khấu chèo  hay,Yêu Hát Chèo,2025-11-30T12:30:37Z,4360,7,0,https://www.youtube.com/watch?v=PFDyjkamJqc,TP. Hải Phòng
Hải Phòng,ĐỒNG BẰNG SÔNG HỒNG,#haiduong,-vF0OgJ_WXA,Lê Thùy Ô TÔ Hải Dương đang phát trực tiếp!,Lê Thùy Ô TÔ Hải Dương,2025-12-09T03:09:09Z,1788,14,3,https://www.youtube.com/watch?v=-vF0OgJ_WXA,TP. Hải Phòng
Hải Phòng,ĐỒNG BẰNG SÔNG HỒNG,#haiduong,Jy1Oj2kowW0,🔴 Lê Thùy Ô TÔ Hải Dương đang phát trực tiếp!,Lê Thùy Ô TÔ Hải Dương,2025-11-24T02:00:20Z,1658,19,6,https://www.youtube.com/watch?v=Jy1Oj2kowW0,TP. Hải Phòng
Hải Phòng,ĐỒNG BẰNG SÔNG HỒNG,#haiduong,6esuyjSaNTA,Lê Thùy Ô TÔ Hải Dương đang phát trực tiếp!,Lê Thùy Ô TÔ Hải Dương,2025-11-28T16:52:19Z,1676,18,2,https://www.youtube.com/watch?v=6esuyjSaNTA,TP. Hải Phòng
Hải Phòng,ĐỒNG BẰNG SÔNG HỒNG,#haiduong,BZ_exmvK9Ao,Lê Thùy Ô TÔ Hải Dương đang phát trực tiếp!,Lê Thùy Ô TÔ Hải Dương,2025-12-04T02:03:40Z,1359,9,2,https://www.youtube.com/watch?v=BZ_exmvK9Ao,TP. Hải Phòng
Hải Phòng,ĐỒNG BẰNG SÔNG HỒNG,#haiduong,dkinbO0pVTk,🔴 em Thuỳ về rất nhiều xe mới...alo e chốt 0789299111,Lê Thùy Ô TÔ Hải Dương,2025-12-08T01:42:17Z,3177,21,1,https://www.youtube.com/watch?v=dkinbO0pVTk,TP. Hải Phòng
Hải Phòng,ĐỒNG BẰNG SÔNG HỒNG,#haiduong,IuS_j7dlmag,Lê Thùy Ô TÔ Hải Dương đang phát trực tiếp!,Lê Thùy Ô TÔ Hải Dương,2025-11-28T02:12:15Z,1854,20,1,https://www.youtube.com/watch?v=IuS_j7dlmag,TP. Hải Phòng
Hải Phòng,ĐỒNG BẰNG SÔNG HỒNG,#haiduong,kEeVDlRL1aY,Hoàn thiện lắp đặt 3 bàn nâng tại Hải Dương,Cầu Công NTK ,2025-12-05T10:00:57Z,0,0,0,https://www.youtube.com/watch?v=kEeVDlRL1aY,TP. Hải Phòng
Hải Phòng,ĐỒNG BẰNG SÔNG HỒNG,#haiduong,OQ7TfFwdyN8,Lê Thùy Ô TÔ Hải Dương đang phát trực tiếp!,Lê Thùy Ô TÔ Hải Dương,2025-12-12T17:51:36Z,1123,12,2,https://www.youtube.com/watch?v=OQ7TfFwdyN8,TP. Hải Phòng
Hải Phòng,ĐỒNG BẰNG SÔNG HỒNG,#haiduong,NpnceLTmfZc,"Trực Tiếp ""Ngay Lúc Này Tại Gia Lộc"" Hải Dương Cũ, Cháy Lớn Khói Cao Ngút Trời Kéo Dài Hàng Giờ!!!",Thành Đạt Miền Tây,2025-11-24T09:28:35Z,2273,9,5,https://www.youtube.com/watch?v=NpnceLTmfZc,TP. Hải Phòng
Hải Phòng,ĐỒNG BẰNG SÔNG HỒNG,#haiduong,JGAVIm4JEXE,2/12 BIÊN XE ĐẸP HẢI DƯƠNG báo giá nhiều mẫu xe gầm cao cho ACE chọn lựa 0963882833,BIÊN XE ĐẸP HẢI DƯƠNG,2025-12-03T03:11:37Z,1454,2,0,https://www.youtube.com/watch?v=JGAVIm4JEXE,TP. Hải Phòng
Hải Phòng,ĐỒNG BẰNG SÔNG HỒNG,#haiduong,iHItlKYKXPA,XE TẢI CŨ HẢI DƯƠNG - DUY VŨ XE LƯỚT,Duy Vũ Xe Lướt,2025-11-17T10:01:16Z,324,3,0,https://www.youtube.com/watch?v=iHItlKYKXPA,TP. Hải Phòng
Hải Phòng,ĐỒNG BẰNG SÔNG HỒNG,#haiduong,Kr-iDSVBRyU,Hải Dương Niềm Thương Nhớ🎶Mở Loa Hết Cỡ LK Nhạc Sống Thôn Quê Phối Mới CỰC ÊM TAI PHỐI NGHE CỰC ÊM,Dân Ca Khánh Chi,2025-11-22T22:06:46Z,1973,210,1,https://www.youtube.com/watch?v=Kr-iDSVBRyU,TP. Hải Phòng
Hải Phòng,ĐỒNG BẰNG SÔNG HỒNG,#haiduong,XvnAO2TVDcA,Lê Thùy Ô TÔ Hải Dương đang phát trực tiếp!,Lê Thùy Ô TÔ Hải Dương,2025-12-07T02:09:42Z,1169,14,0,https://www.youtube.com/watch?v=XvnAO2TVDcA,TP. Hải Phòng
Hải Phòng,ĐỒNG BẰNG SÔNG HỒNG,#haiduong,UbnFJt3opcs,Lê Thùy Ô TÔ Hải Dương đang phát trực tiếp!,Lê Thùy Ô TÔ Hải Dương,2025-12-05T05:03:32Z,759,8,1,https://www.youtube.com/watch?v=UbnFJt3opcs,TP. Hải Phòng
Hải Phòng,ĐỒNG BẰNG SÔNG HỒNG,#haiduong,2gluvPCdOLQ,Lê Thùy Ô TÔ Hải Dương đang phát trực tiếp!,Lê Thùy Ô TÔ Hải Dương,2025-12-05T04:51:01Z,525,6,1,https://www.youtube.com/watch?v=2gluvPCdOLQ,TP. Hải Phòng
Hải Phòng,ĐỒNG BẰNG SÔNG HỒNG,#haiduong,lKl8Fl6pMbs,Lê Thùy Ô TÔ Hải Dương đang phát trực tiếp!,Lê Thùy Ô TÔ Hải Dương,2025-12-02T17:10:13Z,1158,18,3,https://www.youtube.com/watch?v=lKl8Fl6pMbs,TP. Hải Phòng
Hải Phòng,ĐỒNG BẰNG SÔNG HỒNG,#haiduong,Rd3tlOyPM2Q,CÂU CHUYỆN BÁN GIỐNG TRẢ TIỀN 50% | Trại Chồn Hương Hải Dương,CHỒN HƯƠNG HẢI DƯƠNG,2025-12-02T07:27:57Z,1315,15,12,https://www.youtube.com/watch?v=Rd3tlOyPM2Q,TP. Hải Phòng
Hải Phòng,ĐỒNG BẰNG SÔNG HỒNG,#haiduong,dlOiF4Z3C50,Lê Thùy Ô TÔ Hải Dương đang phát trực tiếp!,Lê Thùy Ô TÔ Hải Dương,2025-12-03T17:36:37Z,997,8,1,https://www.youtube.com/watch?v=dlOiF4Z3C50,TP. Hải Phòng
Hải Phòng,ĐỒNG BẰNG SÔNG HỒNG,#haiduong,RciFGEoiCak,"Vụ Cô Gái Hải Dương, 🇻🇳 Giải Cứu Chồng ở 🇰🇭: Dân Mạng 🇨🇳 Nói Gì?",Bác sĩ Hải - Sản Phụ Khoa | Hải Dương,2025-11-21T07:54:54Z,13256,139,9,https://www.youtube.com/watch?v=RciFGEoiCak,TP. Hải Phòng
Hải Phòng,ĐỒNG BẰNG SÔNG HỒNG,#haiduong,3mQwBFQ8Fuk,🔴nay mua được 3 xe mới...alo e chốt 0789299111,Lê Thùy Ô TÔ Hải Dương,2025-11-22T01:50:01Z,3442,22,2,https://www.youtube.com/watch?v=3mQwBFQ8Fuk,TP. Hải Phòng
Hải Phòng,ĐỒNG BẰNG SÔNG HỒNG,#haiduong,pvGA97eRVDs,"Hải Dương miền thương nhớ, phụ họa khánh an",Văn Kiên Nguyễn,2025-11-30T09:34:59Z,24,1,0,https://www.youtube.com/watch?v=pvGA97eRVDs,TP. Hải Phòng
Hải Phòng,ĐỒNG BẰNG SÔNG HỒNG,#haiduong,bGkU_tP9x4c,Bệnh viện Phụ sản Hải Dương – Chăm sóc sức khỏe mẹ và bé,Bệnh viện Phụ sản Hải Dương,2025-11-19T17:00:06Z,143,0,0,https://www.youtube.com/watch?v=bGkU_tP9x4c,TP. Hải Phòng
Hải Phòng,ĐỒNG BẰNG SÔNG HỒNG,#haiduong,4sqnl0QXC9k,Lê Thùy Ô TÔ Hải Dương đang phát trực tiếp!,Lê Thùy Ô TÔ Hải Dương,2025-12-01T17:42:43Z,1430,14,1,https://www.youtube.com/watch?v=4sqnl0QXC9k,TP. Hải Phòng
Hải Phòng,ĐỒNG BẰNG SÔNG HỒNG,#haiduong,p-tvrnP-VeY,Lê Thùy Ô TÔ Hải Dương đang phát trực tiếp!,Lê Thùy Ô TÔ Hải Dương,2025-12-06T21:10:19Z,717,8,1,https://www.youtube.com/watch?v=p-tvrnP-VeY,TP. Hải Phòng
Hải Phòng,ĐỒNG BẰNG SÔNG HỒNG,#haiduong,fuKOvwhfNKQ,TRUYỆN MA QUÀNG A TŨN : CẬU TẨY VI HÀNH HẢI DƯƠNG TẬP 1 | TRUYỆN PHÁP SƯ LÀNG QUÊ,Tiếng Gió Rít Đêm Khuya,2025-11-25T04:30:06Z,639,5,0,https://www.youtube.com/watch?v=fuKOvwhfNKQ,TP. Hải Phòng
Hải Phòng,ĐỒNG BẰNG SÔNG HỒNG,#haiduong,1P2MTuO0c50,Ecorivers Hải Dương,Thương HD,2025-11-25T06:18:29Z,9,1,0,https://www.youtube.com/watch?v=1P2MTuO0c50,TP. Hải Phòng
Hải Phòng,ĐỒNG BẰNG SÔNG HỒNG,#haiduong,0zXy0BofS30,Karaoke HẢI DƯƠNG VÙNG ĐẤT ĐỊA LINH,zum ba PHẠM MẠNH ,2025-12-01T08:17:32Z,142,3,1,https://www.youtube.com/watch?v=0zXy0BofS30,TP. Hải Phòng
Hải Phòng,ĐỒNG BẰNG SÔNG HỒNG,#haiduong,_GogGZZf5GQ,Giúp bà cụ bán rau ở Hải Dương 31 - 8 - 2023,Văn phòng luật sư Giang Thanh,2025-11-18T09:38:16Z,31,0,0,https://www.youtube.com/watch?v=_GogGZZf5GQ,TP. Hải Phòng
Hải Phòng,ĐỒNG BẰNG SÔNG HỒNG,#haiduong,lxLzg9X71mM,Reading-Nguyễn Hải Dương và Hoàng Thanh Huy /6A cùng với 6B,Dương Nguyễn,2025-12-09T10:37:26Z,26,9,0,https://www.youtube.com/watch?v=lxLzg9X71mM,TP. Hải Phòng
Hải Phòng,ĐỒNG BẰNG SÔNG HỒNG,#haiduong,CMyA58Xk2Ps,Lê Thùy Ô TÔ Hải Dương đang phát trực tiếp!,Lê Thùy Ô TÔ Hải Dương,2025-12-09T17:42:28Z,1109,15,0,https://www.youtube.com/watch?v=CMyA58Xk2Ps,TP. Hải Phòng
Hải Phòng,ĐỒNG BẰNG SÔNG HỒNG,#haiduong,S-ACnoZsrL4,26/11 Dàn ken A85 đi Cẩm Giàng Hải Dương LH 0982760098,Hữu Thuấn audio Ninh giang,2025-11-26T03:21:07Z,159,0,1,https://www.youtube.com/watch?v=S-ACnoZsrL4,TP. Hải Phòng
Hải Phòng,ĐỒNG BẰNG SÔNG HỒNG,#haiduong,uvIPqI4e7_0,CHỨNG KHOÁN HÔM NAY 24/11: Bình minh luôn bắt đầu tư bóng tối - Thống kê tháng 11,Hải Dương Chứng Khoán,2025-11-24T01:53:07Z,159,5,1,https://www.youtube.com/watch?v=uvIPqI4e7_0,TP. Hải Phòng
Hải Phòng,ĐỒNG BẰNG SÔNG HỒNG,#haiduong,2gZPUsqeBlI,2/12 ĐOA XE ĐẸP HẢI DƯƠNG 8X  báo giá nhiều mẫu cho ACE lựa chọn alo  0965839999,ĐOA XE ĐẸP HẢI DƯƠNG 8X,2025-12-03T03:20:48Z,789,3,0,https://www.youtube.com/watch?v=2gZPUsqeBlI,TP. Hải Phòng
Hải Phòng,ĐỒNG BẰNG SÔNG HỒNG,#haiduong,6CVZvJnjCVI,30/11 BIÊN XE ĐẸP HẢI DƯƠNG báo giá nhiều mẫu xe gầm cao mới về ace Quan tâm 0963882833,BIÊN XE ĐẸP HẢI DƯƠNG,2025-12-01T03:23:03Z,1840,7,0,https://www.youtube.com/watch?v=6CVZvJnjCVI,TP. Hải Phòng
Hải Phòng,ĐỒNG BẰNG SÔNG HỒNG,#haiduong,5PnZXSMpWvQ,Trường THCS & THPT Marie Curie  Hải Dương,Quyet O'Gem HD,2025-11-25T14:39:00Z,83,1,0,https://www.youtube.com/watch?v=5PnZXSMpWvQ,TP. Hải Phòng
Hải Phòng,ĐỒNG BẰNG SÔNG HỒNG,#haiduong,nSy6HkyliYg,Múa Chèo Nhớ Về Hải Dương do Tỉnh HD biểu diễn tại Ma Cao ,Thom Nguyen Thi,2025-11-29T00:42:56Z,32,2,0,https://www.youtube.com/watch?v=nSy6HkyliYg,TP. Hải Phòng
Hải Phòng,ĐỒNG BẰNG SÔNG HỒNG,#haiduong,I7YU-g4Kj1w,Lê Thùy Ô TÔ Hải Dương đang phát trực tiếp!,Lê Thùy Ô TÔ Hải Dương,2025-11-18T17:50:46Z,1406,17,1,https://www.youtube.com/watch?v=I7YU-g4Kj1w,TP. Hải Phòng
Hải Phòng,ĐỒNG BẰNG SÔNG HỒNG,#haiduong,buzcHvPZGzc,Múa Sắc hoa ngày mới - Đại học Hải Dương,Quang Kubi,2025-11-21T00:45:22Z,174,2,0,https://www.youtube.com/watch?v=buzcHvPZGzc,TP. Hải Phòng
Hải Phòng,ĐỒNG BẰNG SÔNG HỒNG,#haiphong,Pt5RKdNz18g,Công an Hải Phòng bắt đối tượng truy nã chiếm đoạt tài sản | ANTV,ANTV - Truyền hình Công an Nhân dân,2025-12-17T01:37:50Z,573,1,0,https://www.youtube.com/watch?v=Pt5RKdNz18g,TP. Hải Phòng
Hải Phòng,ĐỒNG BẰNG SÔNG HỒNG,#haiphong,RYSj9CQtKJs,"Nhà xây nhầm ở Hải Phòng: Vừa về đúng đất đã không có lối vào, gia chủ phải bắc thang sống tạm",VTC NEWS,2025-12-14T05:00:38Z,14823,33,4,https://www.youtube.com/watch?v=RYSj9CQtKJs,TP. Hải Phòng
Hải Phòng,ĐỒNG BẰNG SÔNG HỒNG,#haiphong,x-4wKdZIrdg,Oái Oăm: Chuyển Nhà Xây Nhầm Hết 250 Triệu Ở Hải Phòng Về Đúng Vị Trí Nhưng Vẫn Phải Bắc Thang Leo !,BLV Anh Quân TV,2025-12-12T23:01:20Z,185681,746,415,https://www.youtube.com/watch?v=x-4wKdZIrdg,TP. Hải Phòng
Hải Phòng,ĐỒNG BẰNG SÔNG HỒNG,#haiphong,nP6iD1uw2K0,Nguyên nhân vụ cháy công ty giày da ở Hải Phòng | ANTV,ANTV - Truyền hình Công an Nhân dân,2025-12-14T13:02:26Z,8755,8,0,https://www.youtube.com/watch?v=nP6iD1uw2K0,TP. Hải Phòng
Hải Phòng,ĐỒNG BẰNG SÔNG HỒNG,#haiphong,NIjvnOs1ekw,"Xưởng giày da ở Hải Phòng bốc cháy dữ dội, thiệt hại nghiêm trọng  | Tin tức",Báo Người Lao Động,2025-12-14T21:30:07Z,1358,5,0,https://www.youtube.com/watch?v=NIjvnOs1ekw,TP. Hải Phòng
Hải Phòng,ĐỒNG BẰNG SÔNG HỒNG,#haiphong,pvZdzMPriXY,Những Kiếp Nạn Của “Thần Đèn” Khi Dời Căn Nhà Xây Nhầm Ở Hải Phòng,BLV Anh Quân TV,2025-12-13T03:56:25Z,68689,383,103,https://www.youtube.com/watch?v=pvZdzMPriXY,TP. Hải Phòng
Hải Phòng,ĐỒNG BẰNG SÔNG HỒNG,#haiphong,4QGxPsJFceA,Most people have never tried this Vietnamese dish (Hải Phòng),Phúc Mập Vlog,2025-12-16T23:52:14Z,968,86,13,https://www.youtube.com/watch?v=4QGxPsJFceA,TP. Hải Phòng
Hải Phòng,ĐỒNG BẰNG SÔNG HỒNG,#haiphong,erH9CdvcVn0,Cháy lớn tại nhà máy giày da ở Hải Phòng - VNAMedia,VNAMEDIA - TRUNG TÂM NỘI DUNG SỐ VÀ TRUYỀN THÔNG,2025-12-14T15:01:15Z,1173,0,0,https://www.youtube.com/watch?v=erH9CdvcVn0,TP. Hải Phòng
Hải Phòng,ĐỒNG BẰNG SÔNG HỒNG,#haiphong,jcW5_FbwTz4,Vụ cháy tại công ty giày da Hải Phòng: Ngăn chặn thảm họa với cây xăng và khu dân cư liền kề,Báo Nghệ An,2025-12-14T09:58:23Z,10434,26,2,https://www.youtube.com/watch?v=jcW5_FbwTz4,TP. Hải Phòng
Hải Phòng,ĐỒNG BẰNG SÔNG HỒNG,#haiphong,BnLyhOl5dHk,"LOẠT KIẾP NẠN OÁI OĂM VỤ DI DỜI NHÀ Ở HẢI PHÒNG | THỀM NHÀ LƠ LỬNG, PHẢI CÚNG VÌ ĐI QUA MỘT NGÔI MỘ",BLV Mai Anh Tài Discovery,2025-12-13T11:25:23Z,36810,177,40,https://www.youtube.com/watch?v=BnLyhOl5dHk,TP. Hải Phòng
Hải Phòng,ĐỒNG BẰNG SÔNG HỒNG,#haiphong,Zo3AxBo5i5o,"CHẤN ĐỘNG HẢI PHÒNG PHÂN GÓA PHỤ LÀM 4 MẢNH, TỘI ÁC NHỮNG NGÀY GIÁP TẾT | CHUYỆN ÂM DƯƠNG",Chuyện Âm Dương,2025-12-15T03:14:56Z,784,6,2,https://www.youtube.com/watch?v=Zo3AxBo5i5o,TP. Hải Phòng
Hải Phòng,ĐỒNG BẰNG SÔNG HỒNG,#haiphong,w5s0v45tOJs,"Hải Phòng rung chuyển vì cháy lớn xưởng sản xuất giày da: Khói đen cuồn cuộn, nguy cơ cháy lan cao",VTC NEWS,2025-12-14T05:45:04Z,3438,9,0,https://www.youtube.com/watch?v=w5s0v45tOJs,TP. Hải Phòng
Hải Phòng,ĐỒNG BẰNG SÔNG HỒNG,#haiphong,NmBTu8JzdIE,"Hải Phòng khởi công, khánh thành 13 dự án gần 30.000 tỷ đồng chào mừng Đại hội XIV",Hải Phòng Trong Tôi,2025-12-14T05:00:06Z,6438,111,16,https://www.youtube.com/watch?v=NmBTu8JzdIE,TP. Hải Phòng
Hải Phòng,ĐỒNG BẰNG SÔNG HỒNG,#haiphong,sJ1cv8Gs5Wg,Chiếc tủ điện gây tranh cãi nhất lúc này ở Hải Phòng #tintuc #tinnong #haiphong #chuyenla #xaydung,Pháp Luật Xã Hội,2025-12-15T19:01:03Z,14309,299,18,https://www.youtube.com/watch?v=sJ1cv8Gs5Wg,TP. Hải Phòng
Hải Phòng,ĐỒNG BẰNG SÔNG HỒNG,#haiphong,tnKoeC6ZfNI,NNN221 Mỹ Úc loạn. Sư Tử Ăn Chay chê Hải Phòng ô nhiễm. Úc cấm trẻ em xài TikTok @bocphottaichinh,Trong N Nguyen,2025-12-15T17:48:56Z,37721,1816,448,https://www.youtube.com/watch?v=tnKoeC6ZfNI,TP. Hải Phòng
Hải Phòng,ĐỒNG BẰNG SÔNG HỒNG,#haiphong,lZlVKsMbKOM,"Từ chiều đến tối, hành trình xuyên qua thành phố Hải phòng",CUỘC SỐNG HẢI PHÒNG,2025-12-06T07:51:58Z,650,18,2,https://www.youtube.com/watch?v=lZlVKsMbKOM,TP. Hải Phòng
Hải Phòng,ĐỒNG BẰNG SÔNG HỒNG,#haiphong,8iwpGZOZFtY,Đội Thần Đèn Di Chuyển Nhà Xây Nhầm Tại Hải Phòng Rất Nhanh Đã Hoàn Thành,Khánh Thợ Xây,2025-12-15T03:56:20Z,11773,98,16,https://www.youtube.com/watch?v=8iwpGZOZFtY,TP. Hải Phòng
Hải Phòng,ĐỒNG BẰNG SÔNG HỒNG,#haiphong,K9rCcDtTBbI,Cháy dữ dội tại xưởng sản xuất giày da ở Hải Phòng,Báo Tiền Phong News,2025-12-14T08:33:00Z,4384,6,0,https://www.youtube.com/watch?v=K9rCcDtTBbI,TP. Hải Phòng
Hải Phòng,ĐỒNG BẰNG SÔNG HỒNG,#haiphong,esyCFUQo4z4,"Xét nghiệm ADN, người chồng Hải Phòng gục ngã khi phát hiện 2 con không cùng huyết thống | VTC News",VTC NEWS,2025-12-07T03:00:54Z,19916,131,3,https://www.youtube.com/watch?v=esyCFUQo4z4,TP. Hải Phòng
Hải Phòng,ĐỒNG BẰNG SÔNG HỒNG,#haiphong,Nh2AkO_AsgM,"Ngôi Nhà Xây Nhầm Ở Hải Phòng: Thần Đèn Lại Phát Hiện Ngôi Mộ, Phải Tạm Dừng Để Làm Lễ!",BLV Anh Quân TV,2025-12-04T23:30:09Z,180027,849,376,https://www.youtube.com/watch?v=Nh2AkO_AsgM,TP. Hải Phòng
Hải Phòng,ĐỒNG BẰNG SÔNG HỒNG,#haiphong,Aa9and255RE,"Hải Phòng, điểm đến du lịch | Trăm miền hội tụ",HTV - Đài Hà Nội,2025-11-28T15:20:00Z,1194,20,0,https://www.youtube.com/watch?v=Aa9and255RE,TP. Hải Phòng
Hải Phòng,ĐỒNG BẰNG SÔNG HỒNG,#haiphong,gOzRwZJ0lws,Tiến Độ 2 Ngôi Nhà Được Đoàn Hải Phòng Tài Trợ Để Xây ở Đồng Văn.Mí Tủa VLOG,Mí Tủa VLOG ,2025-12-16T09:30:24Z,18163,341,25,https://www.youtube.com/watch?v=gOzRwZJ0lws,TP. Hải Phòng
Hải Phòng,ĐỒNG BẰNG SÔNG HỒNG,#haiphong,aXgNI41oR2U,Rất Vui Mừng Khi Được Gia Đình Bác Ở Hải Phòng Ghé Thăm.NMT ,Nguyễn Miền Tây,2025-12-16T11:30:02Z,2196,190,17,https://www.youtube.com/watch?v=aXgNI41oR2U,TP. Hải Phòng
Hải Phòng,ĐỒNG BẰNG SÔNG HỒNG,#haiphong,DpbjwZtYLYw,Chợ Sắt cũ và chợ Tam Bạc ở Hải Phòng tháng 12/2025 video 4k quay chậm,Tôi Yêu Hải Phòng,2025-12-07T11:30:14Z,2460,73,18,https://www.youtube.com/watch?v=DpbjwZtYLYw,TP. Hải Phòng
Hải Phòng,ĐỒNG BẰNG SÔNG HỒNG,#haiphong,yTrmGfKwYC0,Điều Ít Ai Biết Về Việc Sáp Nhập Hải Dương Vào Hải Phòng,Hải Phòng Trong Tôi,2025-11-29T12:30:06Z,25790,219,54,https://www.youtube.com/watch?v=yTrmGfKwYC0,TP. Hải Phòng
Hải Phòng,ĐỒNG BẰNG SÔNG HỒNG,#haiphong,cukQ4roi0lc,BẢNG GIÁ ĐẤT Hải Phòng 2026 GÂY SỐC: Khoảng cách giá giữa các khu vực lên tới TRĂM LẦN | CafeLand,CAFELAND,2025-11-23T04:30:07Z,1886,18,3,https://www.youtube.com/watch?v=cukQ4roi0lc,TP. Hải Phòng
Hải Phòng,ĐỒNG BẰNG SÔNG HỒNG,#haiphong,P9myGUAJpvA,Hải Phòng:  Ứng dụng công nghệ trong sản xuất hành tỏi,Miền Tây THĐT2,2025-12-15T12:00:00Z,15,0,0,https://www.youtube.com/watch?v=P9myGUAJpvA,TP. Hải Phòng
Hải Phòng,ĐỒNG BẰNG SÔNG HỒNG,#haiphong,ZuZHXtxl1lI,Diễn biến mới vụ xây nhầm nhà ở Hải Phòng: Phát hiện ngôi mộ khi “thần đèn” di chuyển căn nhà,Tạp chí VietTimes,2025-12-04T04:22:37Z,1777,2,0,https://www.youtube.com/watch?v=ZuZHXtxl1lI,TP. Hải Phòng
Hải Phòng,ĐỒNG BẰNG SÔNG HỒNG,#haiphong,7AJ6fp6m5gI,"Rúng động Hải Phòng: Mộ liệt sĩ bị phá hoại nhiều lần, gia đình bất lực chính quyền vào cuộc",VẤN ĐỀ HÔM NAY,2025-11-26T11:09:23Z,10576,1299,1,https://www.youtube.com/watch?v=7AJ6fp6m5gI,TP. Hải Phòng
Hải Phòng,ĐỒNG BẰNG SÔNG HỒNG,#haiphong,TsexRuF1_dI,"YDL #302: Khám phá ẩm thực Hải Phòng: nem cua bể, kem trứng, bánh đa cua quá ngon | Yêu Máy Bay",Yêu Máy Bay,2025-11-23T03:14:59Z,107369,1092,104,https://www.youtube.com/watch?v=TsexRuF1_dI,TP. Hải Phòng
Hải Phòng,ĐỒNG BẰNG SÔNG HỒNG,#haiphong,wNlnk3ZKlsg,"Ngôi Nhà Xây Nhầm Ở Hải Phòng Chính Thức Yên Vị Đúng Chỗ, Ông Hữu Đã Dọn Vào Ở An Toàn",BLV Anh Quân TV,2025-12-08T23:30:20Z,23274,226,73,https://www.youtube.com/watch?v=wNlnk3ZKlsg,TP. Hải Phòng
Hải Phòng,ĐỒNG BẰNG SÔNG HỒNG,#haiphong,9a_74tb3S0s,"Hải Phòng: Ra quân tấn công tội phạm, bảo vệ các sự kiện quan trọng - VNAMedia",VNAMEDIA - TRUNG TÂM NỘI DUNG SỐ VÀ TRUYỀN THÔNG,2025-12-13T08:33:00Z,977,1,0,https://www.youtube.com/watch?v=9a_74tb3S0s,TP. Hải Phòng
Hải Phòng,ĐỒNG BẰNG SÔNG HỒNG,#haiphong,ofiWrN-ITxc,"Bất Ngờ Giao Diện Của Ngôi Nhà Xây Nhầm Ở Hải Phòng, Sắp Về Đúng Chỗ Với View Nghĩa Trang",BLV Anh Quân TV,2025-12-02T23:30:27Z,147003,705,203,https://www.youtube.com/watch?v=ofiWrN-ITxc,TP. Hải Phòng
Hải Phòng,ĐỒNG BẰNG SÔNG HỒNG,#haiphong,8uhbdvHYLYY,Cảng Hải Phòng thông qua TEU thứ 2 triệu trong năm 2025,Miền Tây THĐT2,2025-12-16T05:30:00Z,12,0,0,https://www.youtube.com/watch?v=8uhbdvHYLYY,TP. Hải Phòng
Hải Phòng,ĐỒNG BẰNG SÔNG HỒNG,#haiphong,-AxzMZLA8xo,MIXTAPE HẢI PHÒNG HOUSE x MERRY CHRISTMAS,VTEE IN DA HOUSE,2025-12-05T11:08:26Z,16298,253,22,https://www.youtube.com/watch?v=-AxzMZLA8xo,TP. Hải Phòng
Hải Phòng,ĐỒNG BẰNG SÔNG HỒNG,#haiphong,qY9soH2TrvE,"Sáng 8/12: Tông chết người phụ nữ đi xe đạp, gã đàn ông ở Hải Phòng ra đầu thú sau 7 năm trốn nã",Tạp chí VietTimes,2025-12-08T00:06:00Z,3597,304,0,https://www.youtube.com/watch?v=qY9soH2TrvE,TP. Hải Phòng
Hải Phòng,ĐỒNG BẰNG SÔNG HỒNG,#haiphong,-YhLGQRfcTw,Hải Phòng phát triển đô thị gắn với hạ tầng | VTV4,VTV4,2025-12-10T07:09:28Z,1022,5,0,https://www.youtube.com/watch?v=-YhLGQRfcTw,TP. Hải Phòng
Hải Phòng,ĐỒNG BẰNG SÔNG HỒNG,#haiphong,BWStVoNZefY,Bảo Tàng TP Hải Phòng,Hanh Tăng Bá,2025-12-17T02:15:26Z,648,7,0,https://www.youtube.com/watch?v=BWStVoNZefY,TP. Hải Phòng
Hải Phòng,ĐỒNG BẰNG SÔNG HỒNG,#haiphong,50nX0wjkT5o,Hải Phòng: Cháy lớn tại công ty giày da do chập điện | THDT,Truyền Hình Đồng Tháp,2025-12-14T13:34:40Z,1805,13,0,https://www.youtube.com/watch?v=50nX0wjkT5o,TP. Hải Phòng
Hải Phòng,ĐỒNG BẰNG SÔNG HỒNG,#haiphong,MWV7QvZEmFI,"Hải Phòng tổ chức 11 điểm cầu truyền hình khởi công, khánh thành các công trình, dự án lớn",Báo Hải Phòng Plus,2025-12-17T00:30:17Z,44,1,0,https://www.youtube.com/watch?v=MWV7QvZEmFI,TP. Hải Phòng
Hải Phòng,ĐỒNG BẰNG SÔNG HỒNG,#haiphong,1iEOa0yuMIY,Trung tâm hành chính mới Hải Phòng 10/2025,Dân Lan Du Ký,2025-12-07T03:47:47Z,187,2,1,https://www.youtube.com/watch?v=1iEOa0yuMIY,TP. Hải Phòng
Hải Phòng,ĐỒNG BẰNG SÔNG HỒNG,#haiphong,RPb_uyCmbno,Hết hồn: Vụ xây nhà nhầm đất ở Hải Phòng: Bất ngờ phát hiện ngôi mộ rất lớn | Vấn đề hôm nay,VẤN ĐỀ HÔM NAY,2025-12-04T05:03:15Z,34813,940,3,https://www.youtube.com/watch?v=RPb_uyCmbno,TP. Hải Phòng
Hải Phòng,ĐỒNG BẰNG SÔNG HỒNG,#haiphong,ZhoJIjjmXhI,Vua lì đòn Hải Phòng ngừng dời nhà vì phát hiện mộ trên lô đất khác của bà Loan,Ngộ Radio,2025-12-04T02:21:37Z,597853,6287,200,https://www.youtube.com/watch?v=ZhoJIjjmXhI,TP. Hải Phòng
Hải Phòng,ĐỒNG BẰNG SÔNG HỒNG,#haiphong,7wDbtIPwZ_4,Bất động sản Hải Phòng: Khơi dậy tiềm năng thành phố Cảng | Tin tức 24h,Tạp chí Diễn đàn doanh nghiệp,2025-11-30T02:17:12Z,327,2,0,https://www.youtube.com/watch?v=7wDbtIPwZ_4,TP. Hải Phòng
Hải Phòng,ĐỒNG BẰNG SÔNG HỒNG,#haiphong,nJ4j5W7gD0Y,Nhà vua lì đòn xây nhầm ở Hải Phòng cao hơn mặt đường 2m,Ngộ Radio,2025-12-12T10:13:52Z,91143,385,31,https://www.youtube.com/watch?v=nJ4j5W7gD0Y,TP. Hải Phòng
Hải Phòng,ĐỒNG BẰNG SÔNG HỒNG,#haiphong,nh2ZxerNVRQ,"#shorts  Đất nền 1xtr/m2 trung tâm Nhị Chiểu, Hải Phòng",Thinh bán nhà,2025-12-09T10:28:08Z,2,0,0,https://www.youtube.com/watch?v=nh2ZxerNVRQ,TP. Hải Phòng
Hải Phòng,ĐỒNG BẰNG SÔNG HỒNG,#haiphong,GrUl9MxW3Io,Chân Dung Cảnh Sẹo Hải Phòng Qua Lời Đức Cộng: Người Sinh Hoạt Nhiều Anh Em Trong Trại,tvbodoi,2025-12-01T04:00:30Z,16411,135,37,https://www.youtube.com/watch?v=GrUl9MxW3Io,TP. Hải Phòng
Hải Phòng,ĐỒNG BẰNG SÔNG HỒNG,#haiphong,wT5G27gPKSw,"🔴 TRỰC TIẾP | Lễ ra quân tấn công, trấn áp tội phạm, bảo vệ an ninh trật tự của Công an thành phố",Báo Hải Phòng Plus,2025-12-12T14:31:34Z,1632,0,1,https://www.youtube.com/watch?v=wT5G27gPKSw,TP. Hải Phòng
Hải Phòng,ĐỒNG BẰNG SÔNG HỒNG,#haiphong,bGFkYEFY_4Y,Trọng Sún Tiết Lộ Thùy Mượn Tiền Hải Phòng 5 Đầu Dây - Đáp Trả Bà TòTe Tội Bất Hiếu Nên Làm Biếng ?,Lang Thang Kiên Giang,2025-11-30T02:00:07Z,4497,627,63,https://www.youtube.com/watch?v=bGFkYEFY_4Y,TP. Hải Phòng
Hải Phòng,ĐỒNG BẰNG SÔNG HỒNG,#haiphong,5DfoDkq3L4Y,Căn nhà xây nhầm ở Hải Phòng được dời về đúng vị trí nhưng vẫn bất ổn #shorts #yannews,YAN News,2025-12-13T13:45:02Z,37725,217,27,https://www.youtube.com/watch?v=5DfoDkq3L4Y,TP. Hải Phòng
Hưng Yên,ĐỒNG BẰNG SÔNG HỒNG,#hungyen,7Ya2P0vxVSw,HƯNG YÊN TRỊ!,thoibao.de,2025-12-15T15:15:01Z,15477,464,19,https://www.youtube.com/watch?v=7Ya2P0vxVSw,Hưng Yên
Hưng Yên,ĐỒNG BẰNG SÔNG HỒNG,#hungyen,ubrVgQ-gMP4,Thời sự Hưng Yên thứ Ba ngày 16/12/2025,Truyền hình Hưng Yên - HYTV,2025-12-16T13:40:29Z,1059,14,0,https://www.youtube.com/watch?v=ubrVgQ-gMP4,Hưng Yên
Hưng Yên,ĐỒNG BẰNG SÔNG HỒNG,#hungyen,r-AIigD1DbI,"Tin vui Hưng Yên: Thuộc TOP 10 tỉnh có TỔNG THU LỚN NHẤT cả nước, LOẠT DỰ ÁN KẾT NỐI VƯƠN TẦM",PKT,2025-11-20T12:19:29Z,33127,241,33,https://www.youtube.com/watch?v=r-AIigD1DbI,Hưng Yên
Hưng Yên,ĐỒNG BẰNG SÔNG HỒNG,#hungyen,DwuWerRidjs,Tổng Bí thư Tô Lâm đánh giá cao kết quả phát triển của Hưng Yên sau hợp nhất,Báo Hà Tĩnh,2025-12-16T11:08:49Z,1298,109,1,https://www.youtube.com/watch?v=DwuWerRidjs,Hưng Yên
Hưng Yên,ĐỒNG BẰNG SÔNG HỒNG,#hungyen,hZ7w9zf2Q5Q,Thời sự Hưng Yên thứ Hai ngày 15/12/2025,Truyền hình Hưng Yên - HYTV,2025-12-15T14:09:38Z,1466,15,0,https://www.youtube.com/watch?v=hZ7w9zf2Q5Q,Hưng Yên
Hưng Yên,ĐỒNG BẰNG SÔNG HỒNG,#hungyen,4MOq9Fr9N6o,“HƯNG YÊN TRỊ” DƯỚI THỜI “ANH RỪNG”: QUYỀN LỰC ĐỒNG HƯƠNG HAY CHỈ LÀ TRÙNG HỢP?,thoibao.de,2025-12-17T00:00:06Z,1889,101,8,https://www.youtube.com/watch?v=4MOq9Fr9N6o,Hưng Yên
Hưng Yên,ĐỒNG BẰNG SÔNG HỒNG,#hungyen,_Jcl6Cx7VvU,Ông Trump Chính Thức Khởi Kiện BBC Yêu Cầu Bồi Thường 10 Tỷ USD  #my  #trump,Truyền hình Hưng Yên - HYTV,2025-12-16T21:00:46Z,661,4,0,https://www.youtube.com/watch?v=_Jcl6Cx7VvU,Hưng Yên
Hưng Yên,ĐỒNG BẰNG SÔNG HỒNG,#hungyen,rcSNCgIRlzE,Vì sao tấm hình Hưng Yên hóa bộ máy quyền lực đang làm dậy sóng trước Đại hội 14?,thoibao.de,2025-12-15T01:01:13Z,18020,278,24,https://www.youtube.com/watch?v=rcSNCgIRlzE,Hưng Yên
Hưng Yên,ĐỒNG BẰNG SÔNG HỒNG,#hungyen,NU-bH0b3FsE,Tổng Bí thư Tô Lâm tiếp xúc cử tri Hà Nội và Hưng Yên| VTV4,VTV4,2025-12-15T18:00:05Z,10342,38,0,https://www.youtube.com/watch?v=NU-bH0b3FsE,Hưng Yên
Hưng Yên,ĐỒNG BẰNG SÔNG HỒNG,#hungyen,O6xfQPMXGIQ,"Triệt phá “boongke” ma túy, bắt đối tượng từng có 4 tiền án và thu giữ nhiều heroin ở Hưng Yên",Tạp chí VietTimes,2025-12-17T02:33:12Z,16,0,0,https://www.youtube.com/watch?v=O6xfQPMXGIQ,Hưng Yên
Hưng Yên,ĐỒNG BẰNG SÔNG HỒNG,#hungyen,CkSeLc7N530,Đề nghị an ninh chưa từng có của Mỹ mở ra hy vọng ngừng bắn giữa Nga và Ukraine,Truyền hình Hưng Yên - HYTV,2025-12-17T02:45:03Z,562,5,0,https://www.youtube.com/watch?v=CkSeLc7N530,Hưng Yên
Hưng Yên,ĐỒNG BẰNG SÔNG HỒNG,#hungyen,4HGeHyWLHk8,"Đột kích ""Boong ke"" ở Hưng Yên như pháo đài cổng sắt quây kín và 10 con chó dữ bảo vệ",Báo Pháp luật Việt Nam,2025-12-17T03:27:52Z,488,3,1,https://www.youtube.com/watch?v=4HGeHyWLHk8,Hưng Yên
Hưng Yên,ĐỒNG BẰNG SÔNG HỒNG,#hungyen,LYdKk-vqp4s,Hưng Yên sẽ có Khu công nghệ cao; Công an khuyến cáo trả lại tiền nếu 'trót' nhận tiền môi giới NOXH,Tiền Phong TV,2025-12-04T02:46:47Z,977,6,0,https://www.youtube.com/watch?v=LYdKk-vqp4s,Hưng Yên
Hưng Yên,ĐỒNG BẰNG SÔNG HỒNG,#hungyen,SKUs62LwkqI,Thời sự Hưng Yên Chủ nhật ngày 14/12/2025,Truyền hình Hưng Yên - HYTV,2025-12-14T14:58:16Z,1047,4,0,https://www.youtube.com/watch?v=SKUs62LwkqI,Hưng Yên
Hưng Yên,ĐỒNG BẰNG SÔNG HỒNG,#hungyen,g1Zlx7fhKpw,Vụ thi thể trong túi nylon ở Hưng Yên: Gia đình sốc nhận kết quả giám định ADN,Báo Hà Tĩnh,2025-12-09T07:34:24Z,4389,130,0,https://www.youtube.com/watch?v=g1Zlx7fhKpw,Hưng Yên
Hưng Yên,ĐỒNG BẰNG SÔNG HỒNG,#hungyen,HTwtJKlnl1o,Hưng Yên - Điểm sáng công nghiệp vùng đồng bằng sông Hồng | VTV4,VTV4,2025-12-16T13:20:01Z,369,1,0,https://www.youtube.com/watch?v=HTwtJKlnl1o,Hưng Yên
Hưng Yên,ĐỒNG BẰNG SÔNG HỒNG,#hungyen,6iY-pMcU8Mg,Thời sự Hưng Yên thứ Bảy ngày 13/12/2025,Truyền hình Hưng Yên - HYTV,2025-12-13T15:54:31Z,1169,8,0,https://www.youtube.com/watch?v=6iY-pMcU8Mg,Hưng Yên
Hưng Yên,ĐỒNG BẰNG SÔNG HỒNG,#hungyen,RLCKyKWjBg4,Quy Hoạch Lại Siêu Dự Án 10 làn xe Trục Thái Bình - Phố Hiến đoạn Nút Giao Đồng Tu đến tp Hưng Yên,VHD,2025-12-12T09:16:54Z,1060,10,1,https://www.youtube.com/watch?v=RLCKyKWjBg4,Hưng Yên
Hưng Yên,ĐỒNG BẰNG SÔNG HỒNG,#hungyen,6Nbpc0N62Zc,Châu Âu Công Bố Kế Hoạch 6 Điểm Đảm Bảo An Ninh Cho Ukraine  #ukraine #tintuc #hungyentv,Truyền hình Hưng Yên - HYTV,2025-12-16T00:45:00Z,2120,14,0,https://www.youtube.com/watch?v=6Nbpc0N62Zc,Hưng Yên
Hưng Yên,ĐỒNG BẰNG SÔNG HỒNG,#hungyen,nFi6RSHLRbI,Mỹ Yêu Cầu Ukraine Rút Quân Khỏi Donetsk  #ukraine #my,Truyền hình Hưng Yên - HYTV,2025-12-16T07:00:54Z,1181,6,0,https://www.youtube.com/watch?v=nFi6RSHLRbI,Hưng Yên
Hưng Yên,ĐỒNG BẰNG SÔNG HỒNG,#hungyen,gJZ1jx6rx5I,Hưng Yên - Vùng Đất Tinh Hoa Kết Nối Thế Giới (Vươn Ra Thế Giới) | VTC News,VTC NEWS,2025-12-06T03:07:46Z,1848,6,0,https://www.youtube.com/watch?v=gJZ1jx6rx5I,Hưng Yên
Hưng Yên,ĐỒNG BẰNG SÔNG HỒNG,#hungyen,5O3eEPOStis,Giao Lưu Văn Nghệ CLB Liên Xã Bắc Hưng Yên Năm 2025 | YenMyMedia,YENMYMEDIA,2025-12-09T00:37:52Z,438,5,3,https://www.youtube.com/watch?v=5O3eEPOStis,Hưng Yên
Hưng Yên,ĐỒNG BẰNG SÔNG HỒNG,#hungyen,gEK7wEZjB2c,Thời sự Hưng Yên thứ Tư ngày 26/11/2025,Truyền hình Hưng Yên - HYTV,2025-11-26T13:27:22Z,1716,14,0,https://www.youtube.com/watch?v=gEK7wEZjB2c,Hưng Yên
Hưng Yên,ĐỒNG BẰNG SÔNG HỒNG,#hungyen,gx0ZDodGjcE,Trạm tin tối 15/12: Tổng Bí thư Tô Lâm tiếp xúc cử tri tỉnh Hưng Yên - VNAMedia,VNAMEDIA - TRUNG TÂM NỘI DUNG SỐ VÀ TRUYỀN THÔNG,2025-12-15T14:45:07Z,572,0,0,https://www.youtube.com/watch?v=gx0ZDodGjcE,Hưng Yên
Hưng Yên,ĐỒNG BẰNG SÔNG HỒNG,#hungyen,UQ3VM2vDEVk,Thời sự Hưng Yên thứ Năm ngày 11/12/2025,Truyền hình Hưng Yên - HYTV,2025-12-11T14:36:01Z,1422,15,0,https://www.youtube.com/watch?v=UQ3VM2vDEVk,Hưng Yên
Hưng Yên,ĐỒNG BẰNG SÔNG HỒNG,#hungyen,9LA4QM23ui8,Thời sự Hưng Yên thứ Hai ngày 1/12/2025,Truyền hình Hưng Yên - HYTV,2025-12-01T13:41:14Z,1736,11,0,https://www.youtube.com/watch?v=9LA4QM23ui8,Hưng Yên
Hưng Yên,ĐỒNG BẰNG SÔNG HỒNG,#hungyen,S2fdgbVwKy4,Đoàn đại biểu Quốc hội tỉnh Hưng Yên khóa XV đóng góp tích cực cho sự phát triển đất nước,Báo Đại biểu Nhân dân,2025-12-17T02:29:12Z,4,0,0,https://www.youtube.com/watch?v=S2fdgbVwKy4,Hưng Yên
Hưng Yên,ĐỒNG BẰNG SÔNG HỒNG,#hungyen,sqU3CPPrdV8,Thời sự Hưng Yên thứ Năm ngày 4/12/2025,Truyền hình Hưng Yên - HYTV,2025-12-04T15:23:06Z,1898,19,0,https://www.youtube.com/watch?v=sqU3CPPrdV8,Hưng Yên
Hưng Yên,ĐỒNG BẰNG SÔNG HỒNG,#hungyen,YMSxxNrbH_4,Hung Yen awaits | Tỉnh Hưng Yên sẵn sàng đón khách với tiềm năng đa dạng nhiều loại hình du lịch,Việt Nam News,2025-11-25T09:21:47Z,378,5,1,https://www.youtube.com/watch?v=YMSxxNrbH_4,Hưng Yên
Hưng Yên,ĐỒNG BẰNG SÔNG HỒNG,#hungyen,mH7e5KAJqtk,Thời sự Hưng Yên thứ Hai ngày 24/11/2025,Truyền hình Hưng Yên - HYTV,2025-11-24T13:57:31Z,1433,12,0,https://www.youtube.com/watch?v=mH7e5KAJqtk,Hưng Yên
Hưng Yên,ĐỒNG BẰNG SÔNG HỒNG,#hungyen,nYER1IMXXnI,Thời sự Hưng Yên thứ Tư ngày 10/12/2025,Truyền hình Hưng Yên - HYTV,2025-12-10T15:17:22Z,1262,9,0,https://www.youtube.com/watch?v=nYER1IMXXnI,Hưng Yên
Hưng Yên,ĐỒNG BẰNG SÔNG HỒNG,#hungyen,seKs0A86YbE,Thời sự Hưng Yên thứ Ba ngày 9/12/2025,Truyền hình Hưng Yên - HYTV,2025-12-09T14:39:05Z,1155,10,0,https://www.youtube.com/watch?v=seKs0A86YbE,Hưng Yên
Hưng Yên,ĐỒNG BẰNG SÔNG HỒNG,#hungyen,N-tOsrkC4ak,Thời sự Hưng Yên thứ Tư ngày 3/12/2025,Truyền hình Hưng Yên - HYTV,2025-12-03T14:41:26Z,1463,8,0,https://www.youtube.com/watch?v=N-tOsrkC4ak,Hưng Yên
Hưng Yên,ĐỒNG BẰNG SÔNG HỒNG,#hungyen,AWwKuyWje6Y,Thời sự Hưng Yên thứ Năm ngày 27/11/2025,Truyền hình Hưng Yên - HYTV,2025-11-27T13:55:07Z,1466,12,0,https://www.youtube.com/watch?v=AWwKuyWje6Y,Hưng Yên
Hưng Yên,ĐỒNG BẰNG SÔNG HỒNG,#hungyen,Opj3YvSEvn4,Thời sự Hưng Yên thứ Bảy ngày 29/11/2025,Truyền hình Hưng Yên - HYTV,2025-11-29T14:07:00Z,2131,21,0,https://www.youtube.com/watch?v=Opj3YvSEvn4,Hưng Yên
Hưng Yên,ĐỒNG BẰNG SÔNG HỒNG,#hungyen,oGq7qho0nnU,Thời sự Hưng Yên thứ Tư ngày 19/11/2025,Truyền hình Hưng Yên - HYTV,2025-11-19T13:58:31Z,1792,13,0,https://www.youtube.com/watch?v=oGq7qho0nnU,Hưng Yên
Hưng Yên,ĐỒNG BẰNG SÔNG HỒNG,#hungyen,2vfmBQFx37Y,Thời sự Hưng Yên thứ Ba ngày 25/11/2025,Truyền hình Hưng Yên - HYTV,2025-11-25T15:35:01Z,1564,15,0,https://www.youtube.com/watch?v=2vfmBQFx37Y,Hưng Yên
Hưng Yên,ĐỒNG BẰNG SÔNG HỒNG,#hungyen,nV2bC_pMStA,Tổng Bí thư Tô Lâm tiếp xúc cử tri tại Hưng Yên | VOV,Báo Điện tử Tiếng nói Việt Nam (VOV),2025-12-16T03:44:03Z,1038,7,0,https://www.youtube.com/watch?v=nV2bC_pMStA,Hưng Yên
Hưng Yên,ĐỒNG BẰNG SÔNG HỒNG,#hungyen,FmaItXmbzQg,Thơm lừng vị cá vùng chiêm trũng tại Hưng Yên | Vị quê | VTV Times,Một Vòng Việt Nam,2025-12-07T02:16:23Z,97,0,0,https://www.youtube.com/watch?v=FmaItXmbzQg,Hưng Yên
Hưng Yên,ĐỒNG BẰNG SÔNG HỒNG,#hungyen,sjbBzI7vm7s,"Nga chờ Mỹ cập nhật sau đàm phán với Ukraine, số quân ra trận đạt kỷ lục",Truyền hình Hưng Yên - HYTV,2025-12-16T05:45:05Z,1844,13,0,https://www.youtube.com/watch?v=sjbBzI7vm7s,Hưng Yên
Hưng Yên,ĐỒNG BẰNG SÔNG HỒNG,#hungyen,VZlgmKvvcFs,"Rúng động Hưng Yên: Phát hiện thi thể cô gái bị trói chặt, bỏ bao thả trôi sông",Tiền Phong TV,2025-11-24T04:14:50Z,6690,54,2,https://www.youtube.com/watch?v=VZlgmKvvcFs,Hưng Yên
Hưng Yên,ĐỒNG BẰNG SÔNG HỒNG,#hungyen,D8g4IcjGLQA,Tổng thống Ukraine Zelensky: Mỹ chưa phản hồi bản cập nhật kế hoạch hòa bình,Truyền hình Hưng Yên - HYTV,2025-12-16T04:30:12Z,978,7,0,https://www.youtube.com/watch?v=D8g4IcjGLQA,Hưng Yên
Hưng Yên,ĐỒNG BẰNG SÔNG HỒNG,#hungyen,yoXDeRjB5j8,"Sôi sục: Nguyễn Xuân Đạt biệt tích 10 năm ở Hưng Yên, bất ngờ bị công an xác minh",Thể Thao Văn Hóa,2025-11-29T11:18:33Z,66452,1627,1,https://www.youtube.com/watch?v=yoXDeRjB5j8,Hưng Yên
Hưng Yên,ĐỒNG BẰNG SÔNG HỒNG,#hungyen,L-fOcyCqxqk,Vua Bún Mọc ở Hưng Yên nhé #xuhuong #hungyen #dacsan #Bunmoc #hocsushihanoi #ecochef,Chef Quân Sushi Sauce,2025-12-12T06:10:10Z,9540,74,1,https://www.youtube.com/watch?v=L-fOcyCqxqk,Hưng Yên
Hưng Yên,ĐỒNG BẰNG SÔNG HỒNG,#hungyen,Ozu441mXBLs,Toàn Cảnh”Xã nghĩa trụ Hưng Yên- Quê Bác ,Đi Khắp Miền vlogs ,2025-11-22T11:00:46Z,9206,61,18,https://www.youtube.com/watch?v=Ozu441mXBLs,Hưng Yên
Hưng Yên,ĐỒNG BẰNG SÔNG HỒNG,#hungyen,DS-SBKqyzSw,Thời sự Hưng Yên Chủ nhật ngày 7/12/2025,Truyền hình Hưng Yên - HYTV,2025-12-07T15:25:55Z,1386,12,0,https://www.youtube.com/watch?v=DS-SBKqyzSw,Hưng Yên
Hưng Yên,ĐỒNG BẰNG SÔNG HỒNG,#hungyen,DM4EnK3-l1c,"MẬT MÃ HƯNG YÊN: Bàn Cờ QUYỀN LỰC ĐẠI HỘI 14 (Tô Lâm, Lương Tam Quang) VÀ HÀNG NGHÌN TỶ ĐỔ VỀ.",BÌNH LUẬN CHẤN ĐỘNG,2025-12-10T12:00:24Z,33341,631,135,https://www.youtube.com/watch?v=DM4EnK3-l1c,Hưng Yên
Hưng Yên,ĐỒNG BẰNG SÔNG HỒNG,#hungyen,ZegfVoOvxh4,Thời sự Hưng Yên thứ Bảy ngày 6/12/2025,Truyền hình Hưng Yên - HYTV,2025-12-06T13:50:09Z,1833,16,0,https://www.youtube.com/watch?v=ZegfVoOvxh4,Hưng Yên
Hưng Yên,ĐỒNG BẰNG SÔNG HỒNG,#hungyen,o3sfmfWCoK0,Thời sự Hưng Yên thứ Hai ngày 8/12/2025,Truyền hình Hưng Yên - HYTV,2025-12-08T14:24:22Z,1932,12,0,https://www.youtube.com/watch?v=o3sfmfWCoK0,Hưng Yên
Hưng Yên,ĐỒNG BẰNG SÔNG HỒNG,#hungyen,e87G1P2F3iU,🛑 HIGHLIGHTS: U10 HƯNG YÊN - U10 CÔNG AN HÀ NỘI / GIẢI BÓNG ĐÁ U10 HVL BẮC NINH MỞ RỘNG NĂM 2025,BLV Dương Hài Cốt,2025-11-19T13:00:06Z,482,14,2,https://www.youtube.com/watch?v=e87G1P2F3iU,Hưng Yên
Hưng Yên,ĐỒNG BẰNG SÔNG HỒNG,#thaibinh,_I3yzLpeYZM,Chèo cổ Đường Trường Duyên Phận (Duyên Phận Phải Chiều) - NSND Ánh Điện - NS Lê Vân NHC Thái Bình,Yêu Hát Chèo,2025-12-16T12:31:02Z,933,4,0,https://www.youtube.com/watch?v=_I3yzLpeYZM,Hưng Yên
Hưng Yên,ĐỒNG BẰNG SÔNG HỒNG,#thaibinh,ZnqB6pN8dnk,Giáo Hạt Chính Toà - Giáo Phận Thái Bình | Thánh Lễ Hành Hương Đại Hội Nhạc Kèn Mừng Chúa Giáng Sinh,Truyền Thông Giáo Phận Thái Bình,2025-12-16T23:41:44Z,2234,16,0,https://www.youtube.com/watch?v=ZnqB6pN8dnk,Hưng Yên
Hưng Yên,ĐỒNG BẰNG SÔNG HỒNG,#thaibinh,Mp1LzvzaFs4,Giáo Hạt Chính Toà - Giáo Phận Thái Bình | Đại Hội Nhạc Kèn Mừng Chúa Giáng Sinh 2025,Truyền Thông Giáo Phận Thái Bình,2025-12-16T15:02:13Z,7082,58,2,https://www.youtube.com/watch?v=Mp1LzvzaFs4,Hưng Yên
Hưng Yên,ĐỒNG BẰNG SÔNG HỒNG,#thaibinh,kOqeFDglstY,Cỗ Đám Cưới Thái Bình Tập 1,Thái Bình Quê Lúa,2025-12-15T12:00:06Z,3638,30,1,https://www.youtube.com/watch?v=kOqeFDglstY,Hưng Yên
Hưng Yên,ĐỒNG BẰNG SÔNG HỒNG,#thaibinh,1Pg526rOlFo,Giáo Hạt Chính Toà - Giáo Phận Thái Bình | Hội Thảo Đại Hội Nhạc Kèn Mừng Chúa Giáng Sinh 2025,Truyền Thông Giáo Phận Thái Bình,2025-12-16T22:31:36Z,1813,20,0,https://www.youtube.com/watch?v=1Pg526rOlFo,Hưng Yên
Hưng Yên,ĐỒNG BẰNG SÔNG HỒNG,#thaibinh,RLCKyKWjBg4,Quy Hoạch Lại Siêu Dự Án 10 làn xe Trục Thái Bình - Phố Hiến đoạn Nút Giao Đồng Tu đến tp Hưng Yên,VHD,2025-12-12T09:16:54Z,1060,10,1,https://www.youtube.com/watch?v=RLCKyKWjBg4,Hưng Yên
Hưng Yên,ĐỒNG BẰNG SÔNG HỒNG,#thaibinh,lyLwGWqXef8,"Quân đội Mỹ nổ súng trên Thái Bình Dương, ba tàu trúng đòn, 8 người thiệt mạng",Báo Pháp luật Việt Nam,2025-12-16T11:46:18Z,5200,307,1,https://www.youtube.com/watch?v=lyLwGWqXef8,Hưng Yên
Hưng Yên,ĐỒNG BẰNG SÔNG HỒNG,#thaibinh,_C5YsdI_LpU,"Bình luận quốc tế: Thái Lan “khóa cửa” Campuchia, chênh vênh cuộc chiến “lưỡng bại câu thương”",BNC Now,2025-12-15T14:30:25Z,341363,1825,100,https://www.youtube.com/watch?v=_C5YsdI_LpU,Hưng Yên
Hưng Yên,ĐỒNG BẰNG SÔNG HỒNG,#thaibinh,u5PEQKVUKWg,Chấn Động Thái Bình: Chồng Bị Bắt Quả Tang Khi Tằng Tịu Với Bồ Trước Quan Tài Vợ,Dấu Vết Kẻ Phạm Tội,2025-11-27T05:01:12Z,61205,167,34,https://www.youtube.com/watch?v=u5PEQKVUKWg,Hưng Yên
Hưng Yên,ĐỒNG BẰNG SÔNG HỒNG,#thaibinh,L1J23eOCncw,Kinh Hãi Đêm Ân Ái 7 Nam Nhân Của Thái Bình Công Chúa – Hầu Gái Tiết Lộ Bí Mật Động Trời,TOP LỊCH SỬ ,2025-12-11T13:30:21Z,384,16,2,https://www.youtube.com/watch?v=L1J23eOCncw,Hưng Yên
Hưng Yên,ĐỒNG BẰNG SÔNG HỒNG,#thaibinh,YxQz8DNHcc4,Phim Lẻ Mới Nhất - THÁI BÌNH CÔNG CHÚA - Phim Cổ Trang Cực Hay,MỌT PHIM TRUNG QUỐC,2025-11-22T06:30:31Z,2171,18,1,https://www.youtube.com/watch?v=YxQz8DNHcc4,Hưng Yên
Hưng Yên,ĐỒNG BẰNG SÔNG HỒNG,#thaibinh,ENw8mblw5jM,Đặc Sản Thịt Mèo Thịt Chó Thái Bình Mời Khách Miền Nam Về Thăm Quê,Thái Bình Quê Lúa,2025-12-10T12:00:06Z,3663,27,2,https://www.youtube.com/watch?v=ENw8mblw5jM,Hưng Yên
Hưng Yên,ĐỒNG BẰNG SÔNG HỒNG,#thaibinh,-W8-RAds6m0,🔴CHÀO ĐÓN VÀ KHAI MẠC - ĐẠI HỘI GIỚI TRẺ GIÁO TỈNH HÀ NỘI LẦN THỨ XXI,Truyền Thông Giáo Phận Thái Bình,2025-11-18T11:03:42Z,74763,556,22,https://www.youtube.com/watch?v=-W8-RAds6m0,Hưng Yên
Hưng Yên,ĐỒNG BẰNG SÔNG HỒNG,#thaibinh,JhfBE-1IWDc,"Video tổng hợp KHAI MẠC ĐẠI HỘI KHUYẾT TẬT LẦN THỨ 16 - Chủ đề: “Ta đã yêu thương con” (Kh 3,9)",Truyền Thông Giáo Phận Thái Bình,2025-12-13T13:28:05Z,4893,30,2,https://www.youtube.com/watch?v=JhfBE-1IWDc,Hưng Yên
Hưng Yên,ĐỒNG BẰNG SÔNG HỒNG,#thaibinh,kxR-tDlLFdk,Cặp Đôi Trai Xinh Gái Đẹp Song Ca Thái Bình Quê Hương Tôi Khiến Triệu Người Nghe Bồi Hồi,Từ Như Tài Official,2025-11-21T02:00:11Z,14730,40,4,https://www.youtube.com/watch?v=kxR-tDlLFdk,Hưng Yên
Hưng Yên,ĐỒNG BẰNG SÔNG HỒNG,#thaibinh,6b5qfs118vs,Chèo Thái Bình | Nghinh Hương Quán - Vu Quy - Vợ Chồng Ông Chài | nhà hát chèo Thái Bình,Yêu Hát Chèo,2025-12-06T12:30:10Z,7395,26,3,https://www.youtube.com/watch?v=6b5qfs118vs,Hưng Yên
Hưng Yên,ĐỒNG BẰNG SÔNG HỒNG,#thaibinh,cG9vrVnKpnE,"🔴HOAN CA, DIỄN NGUYỆN VÀ CHẦU THÁNH THỂ - ĐẠI HỘI GIỚI TRẺ GIÁO TỈNH HÀ NỘI LẦN THỨ XXI",Truyền Thông Giáo Phận Thái Bình,2025-11-18T15:57:42Z,57667,495,7,https://www.youtube.com/watch?v=cG9vrVnKpnE,Hưng Yên
Hưng Yên,ĐỒNG BẰNG SÔNG HỒNG,#thaibinh,ziGGJC_qk30,"Cách làm Giò Nây, Giò Hoa, Chả Quế truyền thống 5 đời đặc sản Thái Bình siêu ngon",Viet Nam Food,2025-12-11T09:01:41Z,67383,263,45,https://www.youtube.com/watch?v=ziGGJC_qk30,Hưng Yên
Hưng Yên,ĐỒNG BẰNG SÔNG HỒNG,#thaibinh,j5SBMkhyXr4,Bí ẩn đền Cửa Lân -  Tâm linh vùng đất Biển THÁI BÌNH,Thái Bình,2025-12-11T11:59:33Z,156,0,0,https://www.youtube.com/watch?v=j5SBMkhyXr4,Hưng Yên
Hưng Yên,ĐỒNG BẰNG SÔNG HỒNG,#thaibinh,c_wrEWKwBZ0,"Chèo Thái Bình Đặc Sắc Nhất | Trích đoạn chèo, hề chèo kinh điển của các nghệ sĩ Đoàn Chèo Thái Bình",Yêu Hát Chèo,2025-11-18T12:30:50Z,8063,24,4,https://www.youtube.com/watch?v=c_wrEWKwBZ0,Hưng Yên
Hưng Yên,ĐỒNG BẰNG SÔNG HỒNG,#thaibinh,Us08gc4swow,🔴[Trực tiếp] Thánh lễ CN III Mùa Vọng I Bế mạc Đại hội Khuyết tật lần thứ 16 I Giáo phận Thái Bình,Truyền Thông Giáo Phận Thái Bình,2025-12-14T16:19:14Z,4439,34,4,https://www.youtube.com/watch?v=Us08gc4swow,Hưng Yên
Hưng Yên,ĐỒNG BẰNG SÔNG HỒNG,#thaibinh,H8sJJ7UYGVM,QUỶ ĐÓI Ở THÁI BÌNH truyện ma làng quê rợn gáy | radio tâm linh,Radio Tâm Linh,2025-11-19T14:00:07Z,2976,38,5,https://www.youtube.com/watch?v=H8sJJ7UYGVM,Hưng Yên
Hưng Yên,ĐỒNG BẰNG SÔNG HỒNG,#thaibinh,jixkSEQjmbs,"🔴THÁNH LỄ TẠ ƠN - NGHI THỨC BẾ MẠC, TRAO THÁNH GIÁ VÀ CỜ ĐẠI HỘI CHO GP PHÁT DIỆM",Truyền Thông Giáo Phận Thái Bình,2025-11-19T07:56:21Z,50949,396,5,https://www.youtube.com/watch?v=jixkSEQjmbs,Hưng Yên
Hưng Yên,ĐỒNG BẰNG SÔNG HỒNG,#thaibinh,mLHT4dwSY_o,Recap | Truyện ma có thật nghề vớt xác ở Thái Bình #chuyenma #tamlinhcothat #truyendemkhuya,Bí ẩn Radio,2025-12-15T14:01:18Z,3048,22,1,https://www.youtube.com/watch?v=mLHT4dwSY_o,Hưng Yên
Hưng Yên,ĐỒNG BẰNG SÔNG HỒNG,#thaibinh,zLysbIrCaqo,Vở Chèo Giữa Hai Dòng Trong Đục - nhà hát chèo Thái Bình (cũ) | Sân khấu Chèo Thái Bình đặc sắc,Yêu Hát Chèo,2025-11-26T12:31:39Z,14276,39,1,https://www.youtube.com/watch?v=zLysbIrCaqo,Hưng Yên
Hưng Yên,ĐỒNG BẰNG SÔNG HỒNG,#thaibinh,mHww-BResds,Vở Chèo Sáng Mãi Nhân Tâm - nhà hát chèo Thái Bình | Sân Khấu Chèo Thái Bình Đặc Sắc,Yêu Hát Chèo,2025-12-03T12:31:11Z,3801,9,0,https://www.youtube.com/watch?v=mHww-BResds,Hưng Yên
Hưng Yên,ĐỒNG BẰNG SÔNG HỒNG,#thaibinh,KDQyiKaZHxw,🔴 Xem trực tiếp bóng chuyền: Việt Nam - Thái Lan | Chung kết SEA Games 33,VTV Bình Điền Long An,2025-12-15T03:15:32Z,39589,48,12,https://www.youtube.com/watch?v=KDQyiKaZHxw,Hưng Yên
Hưng Yên,ĐỒNG BẰNG SÔNG HỒNG,#thaibinh,C3NGBRjXfRY,Bình Vổ: Tiểu Sử Giang Hồ Đất Thái Bình - Ông Trùm Trường Gà Lớn Nhất Miền Bắc | 24h Phá Án,24h-Phá Án,2025-12-09T12:00:06Z,55294,506,44,https://www.youtube.com/watch?v=C3NGBRjXfRY,Hưng Yên
Hưng Yên,ĐỒNG BẰNG SÔNG HỒNG,#thaibinh,1vYxE8RVp_Q,“Ăn Cỗ Lấy Phần” ở Thái Bình và câu chuyện phía sau không phải ai cũng hiểu ? | Ăn Cỗ miền Bắc có gì,Thắng Cố Gắng,2025-11-27T00:00:02Z,147835,547,234,https://www.youtube.com/watch?v=1vYxE8RVp_Q,Hưng Yên
Hưng Yên,ĐỒNG BẰNG SÔNG HỒNG,#thaibinh,G6NjC1G7g18,"Quên Giò Lụa đi, đây mới là ""trùm cuối"" đặc sản GIÒ NÂY Thái Bình",Hà Nội Phố,2025-12-03T05:00:27Z,85677,510,92,https://www.youtube.com/watch?v=G6NjC1G7g18,Hưng Yên
Hưng Yên,ĐỒNG BẰNG SÔNG HỒNG,#thaibinh,75dHapfnz9o,Hát Chèo Đào Lý Một Cành | NS Lê Vân - nhà hát chèo Thái Bình,Yêu Hát Chèo,2025-12-10T12:30:11Z,10123,20,5,https://www.youtube.com/watch?v=75dHapfnz9o,Hưng Yên
Hưng Yên,ĐỒNG BẰNG SÔNG HỒNG,#thaibinh,yX9ViDrIpW4,Sân Khấu Chèo: SÁNG MÃI NHÂN TÂM - Nhà Hát Chèo Thái Bình - Liên Hoan Chèo Toàn Quốc 2025,Mai Đức Thiện,2025-12-02T11:00:06Z,1214,5,0,https://www.youtube.com/watch?v=yX9ViDrIpW4,Hưng Yên
Hưng Yên,ĐỒNG BẰNG SÔNG HỒNG,#thaibinh,Wd9uVdyuLpk,"Cường ""Dụ"": Tiểu Sử ""Đại Ca"" Bảo Kê Khét Tiếng Thái Bình - 17 Tuổi Đã Vào Tù",24h-Phá Án,2025-11-18T12:00:06Z,58933,174,28,https://www.youtube.com/watch?v=Wd9uVdyuLpk,Hưng Yên
Hưng Yên,ĐỒNG BẰNG SÔNG HỒNG,#thaibinh,lQkTN8qxfj4,THÁI BÌNH 37 Nhận Quà VIP Từ Xuân Xù,Thế Giới Mõm 4.0,2025-11-17T05:58:11Z,800,8,0,https://www.youtube.com/watch?v=lQkTN8qxfj4,Hưng Yên
Hưng Yên,ĐỒNG BẰNG SÔNG HỒNG,#thaibinh,sQRsneZEzLA,Bạn ơi hãy đến Thái Bình quê tôi #shorts,Từ Như Tài Official,2025-12-13T14:01:38Z,11008,60,0,https://www.youtube.com/watch?v=sQRsneZEzLA,Hưng Yên
Hưng Yên,ĐỒNG BẰNG SÔNG HỒNG,#thaibinh,Xnv0sCuExV0,Chèo cổ Sa Lệch Chênh | NSUT Mạnh Hà - NS Mộc Miên - nhà hát chèo Thái  Bình,Yêu Hát Chèo,2025-12-08T12:30:59Z,5251,19,2,https://www.youtube.com/watch?v=Xnv0sCuExV0,Hưng Yên
Hưng Yên,ĐỒNG BẰNG SÔNG HỒNG,#thaibinh,ENkbY6UlbsA,Chèo Cổ Thái Bình |Những làn điệu chèo cổ Hay Nhất qua sự thể hiện của các NS nhà hát chèo Thái Bình,Yêu Hát Chèo,2025-12-02T12:30:20Z,13164,33,7,https://www.youtube.com/watch?v=ENkbY6UlbsA,Hưng Yên
Hưng Yên,ĐỒNG BẰNG SÔNG HỒNG,#thaibinh,1QNmPIJibcY,🔴GẶP GỠ ĐỨC TỔNG GIÁM MỤC GIUSE VŨ VĂN THIÊN - TỔNG GIÁM MỤC TỔNG GIÁO PHẬN HÀ NỘI,Truyền Thông Giáo Phận Thái Bình,2025-11-19T13:26:53Z,13041,129,9,https://www.youtube.com/watch?v=1QNmPIJibcY,Hưng Yên
Hưng Yên,ĐỒNG BẰNG SÔNG HỒNG,#thaibinh,KkjDw64-rO0,Nỗi ám ảnh kinh hoàng của Trung Hoa – Thái Bình Thiên Quốc: Cuộc Chiến Nuốt Chửng 30 triệu Sinh Mạng,Tiếng Sử Vọng,2025-12-10T00:15:02Z,3981,32,9,https://www.youtube.com/watch?v=KkjDw64-rO0,Hưng Yên
Hưng Yên,ĐỒNG BẰNG SÔNG HỒNG,#thaibinh,ecaBSIs-izk,Cỗ Đám Cưới Lòng Lợn Tiết Canh Quê Lúa Thái Bình,Thái Bình Quê Lúa,2025-12-02T12:00:06Z,23079,68,7,https://www.youtube.com/watch?v=ecaBSIs-izk,Hưng Yên
Hưng Yên,ĐỒNG BẰNG SÔNG HỒNG,#thaibinh,rp7WlC6i-D4,Khám Phá Chùa Keo Thái Bình: Tuyệt Tác Kiến Trúc 400 Năm Tuổi,Thái Bình,2025-12-02T12:22:28Z,698,5,2,https://www.youtube.com/watch?v=rp7WlC6i-D4,Hưng Yên
Hưng Yên,ĐỒNG BẰNG SÔNG HỒNG,#thaibinh,ywHbocTqiyk,🔴 TRỰC TIẾP CHUNG KẾT | Thái Lan vs Việt Nam | Bóng chuyền nữ – SEA Games 33 | Live Volleyball,BÓNG ĐÁ LIVE,2025-12-15T13:15:27Z,878589,3969,0,https://www.youtube.com/watch?v=ywHbocTqiyk,Hưng Yên
Hưng Yên,ĐỒNG BẰNG SÔNG HỒNG,#thaibinh,jDUWno4StQI,Cỗ Đám Cưới Thịt Chó Luộc Quê Lúa Thái Bình,Thái Bình Quê Lúa,2025-12-05T12:00:06Z,12701,55,7,https://www.youtube.com/watch?v=jDUWno4StQI,Hưng Yên
Hưng Yên,ĐỒNG BẰNG SÔNG HỒNG,#thaibinh,-5yhiHSidxs,Đền Tiên La Thái Bình: Huyền Thoại Bát Nữ Tướng & Những Bí Ẩn Tâm Linh,Thái Bình,2025-12-02T14:18:43Z,683,5,0,https://www.youtube.com/watch?v=-5yhiHSidxs,Hưng Yên
Hưng Yên,ĐỒNG BẰNG SÔNG HỒNG,#thaibinh,4rPj5KehboM,THÁI BÌNH 37 Động Viên KHÁNH SKY,Thế Giới Mõm 4.0,2025-11-17T13:23:01Z,719,7,1,https://www.youtube.com/watch?v=4rPj5KehboM,Hưng Yên
Hưng Yên,ĐỒNG BẰNG SÔNG HỒNG,#thaibinh,G-LPZmbNH28,"🔴TRỰC TIẾP SEA GAMES 33 | NGÀY THI ĐẤU THỨ 7 CỦA ĐOÀN THỂ THAO VIỆT NAM TẠI BANGKOK, THÁI LAN",Sao Thể Thao,2025-12-16T16:49:00Z,136762,0,3,https://www.youtube.com/watch?v=G-LPZmbNH28,Hưng Yên
Hưng Yên,ĐỒNG BẰNG SÔNG HỒNG,#thaibinh,2hBntBnWxdY,Đường Nhuệ: Tiểu Sử Ông Trùm Giang Hồ Khét Tiếng Thái Bình Và Bản Án Hơn 30 Năm Tù,Giang Hồ Xưa,2025-11-28T13:00:06Z,26874,106,12,https://www.youtube.com/watch?v=2hBntBnWxdY,Hưng Yên
Hưng Yên,ĐỒNG BẰNG SÔNG HỒNG,#thaibinh,mebsnwwtTtE,Nghệ sỹ Thu Hoài Hát  Chèo Hay | Chèo Thái Bình Đặc Sắc Nhất,Thu Hoài Official,2025-12-06T00:01:06Z,21619,52,27,https://www.youtube.com/watch?v=mebsnwwtTtE,Hưng Yên
Hưng Yên,ĐỒNG BẰNG SÔNG HỒNG,#thaibinh,VPZl5-CMXOc,ĐƯỜNG NHUỆ: Tiểu Sử Giang hồ Quê Lúa Thái Bình - Dịch Vụ Bảo Kê người C.hết | 48h Phá Án,48h-Phá Án,2025-12-13T12:00:06Z,6821,2159,0,https://www.youtube.com/watch?v=VPZl5-CMXOc,Hưng Yên
Hưng Yên,ĐỒNG BẰNG SÔNG HỒNG,#thaibinh,BWHZQAkdA3A,Lòng Mẹ Bao La Như Biển Thái Bình #chimeconem,Chị Mẹ Con Em ,2025-12-14T05:00:18Z,30521,271,11,https://www.youtube.com/watch?v=BWHZQAkdA3A,Hưng Yên
Ninh Bình,ĐỒNG BẰNG SÔNG HỒNG,#hanam,gOsvoNYzWb0,Hà Sam 24H Đi Du Lịch Các Tỉnh Thành Bằng Tất Cả Các Phương Tiện,Hà Sam,2025-12-06T01:00:59Z,1662711,39857,1797,https://www.youtube.com/watch?v=gOsvoNYzWb0,Ninh Bình
Ninh Bình,ĐỒNG BẰNG SÔNG HỒNG,#hanam,iOaxt3vv4Bs,Hà Sam Thử Thách Đi Chợ Thú Cưng | Toàn Con Vật Dễ Thương,Hà Sam,2025-12-14T10:00:15Z,625642,6095,549,https://www.youtube.com/watch?v=iOaxt3vv4Bs,Ninh Bình
Ninh Bình,ĐỒNG BẰNG SÔNG HỒNG,#hanam,pPYqTw7Lwl0,Hà Sam Thử Thách Một Ngày Đi Đến Đảo Hoang Tìm Khỉ Và Cho Khỉ Ăn Chuối,Hà Sam,2025-11-29T01:01:12Z,1320070,4850,656,https://www.youtube.com/watch?v=pPYqTw7Lwl0,Ninh Bình
Ninh Bình,ĐỒNG BẰNG SÔNG HỒNG,#hanam,SgPY_9mmTrs,Hà Sam Thử Thách Trốn Tìm Ban Đêm Ngoài Công Viên Siêu Rộng,Hà Sam,2025-12-10T09:00:49Z,631032,4585,416,https://www.youtube.com/watch?v=SgPY_9mmTrs,Ninh Bình
Ninh Bình,ĐỒNG BẰNG SÔNG HỒNG,#hanam,Q7348ntZG8w,"[795]Nay Rời Khỏi Trường Sa Đến Hà Nam ,1Con Sông Phân Cách 2Miền Nam Bắc ",Thúy Kiều family cuộc sống Trung Quốc,2025-12-14T02:00:00Z,13366,1113,148,https://www.youtube.com/watch?v=Q7348ntZG8w,Ninh Bình
Ninh Bình,ĐỒNG BẰNG SÔNG HỒNG,#hanam,7S_bdK35faE,Gấu Đỏ TV - Hà Sam Đi Quay Video Bị Ốm Trên Đảo Hoang Cả Team Lo Lắng,Gấu Đỏ TV  & Family,2025-12-12T09:55:17Z,466014,4244,465,https://www.youtube.com/watch?v=7S_bdK35faE,Ninh Bình
Ninh Bình,ĐỒNG BẰNG SÔNG HỒNG,#hanam,iLtLGQCUsSg,Hà Sam Chuẩn Bị 100 Món Quà Sinh Nhật Cho BITA Từ Nhà Đến Thủ Đô Hà Nội,Hà Sam,2025-11-21T09:01:20Z,1264789,6958,1451,https://www.youtube.com/watch?v=iLtLGQCUsSg,Ninh Bình
Ninh Bình,ĐỒNG BẰNG SÔNG HỒNG,#hanam,n6eOLurSIs0,Ấm lòng 2 con yêu HÀ TIÊN - HÀ NAM TIỄN vợ chồng Ngọc Huyền và bà ngoại về Việt Nam dài ngày,Nghệ Sĩ Ngọc Huyền Official,2025-12-14T03:35:31Z,9304,196,24,https://www.youtube.com/watch?v=n6eOLurSIs0,Ninh Bình
Ninh Bình,ĐỒNG BẰNG SÔNG HỒNG,#hanam,5K0Yo1QntYQ,Giá heo hơi hôm nay 17/12/2025 chợ hà nam tăng giá mạnh vượt 70k heo dân tăng sát heo CTY ,Khanh nuôi lợn @,2025-12-16T23:00:06Z,3186,113,13,https://www.youtube.com/watch?v=5K0Yo1QntYQ,Ninh Bình
Ninh Bình,ĐỒNG BẰNG SÔNG HỒNG,#hanam,Gw1lwRIc_g0,NHẠN THÁNG 8 HƯỜNG HÀ NAM 0399930009 || PHONG LAN RỪNG,PHONG LAN RỪNG,2025-12-17T02:25:40Z,38,5,0,https://www.youtube.com/watch?v=Gw1lwRIc_g0,Ninh Bình
Ninh Bình,ĐỒNG BẰNG SÔNG HỒNG,#hanam,rVe2OWSpaMA,Bác còi to cứ vượt thôi #food #tuyenanngon #xuhuongyoutube #amthuc #goica #amthucbaclieu,Cường Gỏi Cá Hà Nam,2025-12-16T13:59:56Z,1272,33,1,https://www.youtube.com/watch?v=rVe2OWSpaMA,Ninh Bình
Ninh Bình,ĐỒNG BẰNG SÔNG HỒNG,#hanam,NVRgbvEb_cM,Choáng - Sun Urban CiTy Hà Nam xây dựng thần tốc -  đô thị nghỉ dưỡng hiện đại .,Thành Nam TV,2025-12-01T07:27:28Z,337,4,0,https://www.youtube.com/watch?v=NVRgbvEb_cM,Ninh Bình
Ninh Bình,ĐỒNG BẰNG SÔNG HỒNG,#hanam,74ze8FtKJMc,Ai làm bẩn lên áo mẹ🤔 #shots,Trường Cao Đẳng FPT Polytechnic cơ sở Hà Nam,2025-12-16T04:12:15Z,23395,71,16,https://www.youtube.com/watch?v=74ze8FtKJMc,Ninh Bình
Ninh Bình,ĐỒNG BẰNG SÔNG HỒNG,#hanam,147xaWJOtdY,Sau 3 Năm Quay Lại Vườn Chú Hạnh Ở Hà Nam Cũ Mà Không Nhận Ra Sự Thay Đổi Quá Lớn,Mạnh Bonsai,2025-12-03T11:31:05Z,1295,13,3,https://www.youtube.com/watch?v=147xaWJOtdY,Ninh Bình
Ninh Bình,ĐỒNG BẰNG SÔNG HỒNG,#hanam,Jh3XMROXS04,Ngọc Huyền và chồng rớt nước mắt khi Hà Tiên - Hà Nam hát bài hát đặc biệt tặng ba mẹ,Nghệ Sĩ Ngọc Huyền Official,2025-11-21T13:00:47Z,89937,1279,108,https://www.youtube.com/watch?v=Jh3XMROXS04,Ninh Bình
Ninh Bình,ĐỒNG BẰNG SÔNG HỒNG,#hanam,GXY7AowRCUo,"Hà Nam chuẩn bị có dự án của chủ đầu tư Onsen Fuji quy mô lên tới 6ha, năm ngay bệnh viện Bạch Mai",Trung Vũ BĐS - Chuyên tư vấn Sun Urban City ,2025-11-28T16:04:32Z,77,0,1,https://www.youtube.com/watch?v=GXY7AowRCUo,Ninh Bình
Ninh Bình,ĐỒNG BẰNG SÔNG HỒNG,#hanam,Xb4iqNv_CEo,Mô hình nuôi cá trê thương phẩm || Trại giống Hà Nam,Trại Giống Hà Nam,2025-11-19T10:40:00Z,1350,8,2,https://www.youtube.com/watch?v=Xb4iqNv_CEo,Ninh Bình
Ninh Bình,ĐỒNG BẰNG SÔNG HỒNG,#hanam,mL1JbBDIwCE,"Với 70 triệu, hoàn thiệ full nột thất đồ điên tử, bàn ghế, ... căn hộ Sun Urban City Hà Nam",Trung Vũ BĐS - Chuyên tư vấn Sun Urban City ,2025-12-16T15:04:17Z,22,0,0,https://www.youtube.com/watch?v=mL1JbBDIwCE,Ninh Bình
Ninh Bình,ĐỒNG BẰNG SÔNG HỒNG,#hanam,nJtzmlyuuMM,Recap | Truyện ma làng quê có thật ở Hà Nam #chuyenma #tamlinhcothat #truyendemkhuya,Bí ẩn Radio,2025-12-14T14:20:01Z,9108,77,15,https://www.youtube.com/watch?v=nJtzmlyuuMM,Ninh Bình
Ninh Bình,ĐỒNG BẰNG SÔNG HỒNG,#hanam,zbwBXeuySz4,Shophouse khối đế Sun Urban City Hà Nam,Mr Vinh BĐS Sun Urban City - Sun Mega City - Vpq🇻🇳,2025-12-17T02:14:28Z,136,0,0,https://www.youtube.com/watch?v=zbwBXeuySz4,Ninh Bình
Ninh Bình,ĐỒNG BẰNG SÔNG HỒNG,#hanam,xWdKC_gMYtc,Bệnh viện Việt Đức 2 Hà Nam trước ngày hoạt động chính thức / Diện mạo mới đẹp lạ thường.,Gió Biển TV,2025-11-29T13:43:25Z,7801,45,3,https://www.youtube.com/watch?v=xWdKC_gMYtc,Ninh Bình
Ninh Bình,ĐỒNG BẰNG SÔNG HỒNG,#hanam,uKwduIYGp5E,Tập ăn gỏi cá Hà Nam #food #tuyenanngon #xuhuongyoutube #amthuc #goica #lehoiamthuc #cooking,Cường Gỏi Cá Hà Nam,2025-12-14T04:57:52Z,8349,120,12,https://www.youtube.com/watch?v=uKwduIYGp5E,Ninh Bình
Ninh Bình,ĐỒNG BẰNG SÔNG HỒNG,#hanam,wQCayKD6b80,SUN URBAN CITY | PHÂN KHU KIM NGÂN - KIM TIỀN 10/12/25,Mr Vinh BĐS Sun Urban City - Sun Mega City - Vpq🇻🇳,2025-12-10T13:00:06Z,1328,6,0,https://www.youtube.com/watch?v=wQCayKD6b80,Ninh Bình
Ninh Bình,ĐỒNG BẰNG SÔNG HỒNG,#hanam,7uAdlBMPrZw,Người nhà em nhiều quá #food #tuyenanngon #xuhuongyoutube #amthuc #amthucbaclieu #goica,Cường Gỏi Cá Hà Nam,2025-12-16T05:39:37Z,1917,45,3,https://www.youtube.com/watch?v=7uAdlBMPrZw,Ninh Bình
Ninh Bình,ĐỒNG BẰNG SÔNG HỒNG,#hanam,zjGHvRHAUDk,Hà Nam in the past and now,Tiến Lê🤪,2025-11-26T16:03:12Z,17,1,0,https://www.youtube.com/watch?v=zjGHvRHAUDk,Ninh Bình
Ninh Bình,ĐỒNG BẰNG SÔNG HỒNG,#hanam,JqD4zzvUwGo,Tổng quan về căn shophouse góc tại Sun Hà Nam,Trung Vũ BĐS - Chuyên tư vấn Sun Urban City ,2025-12-16T15:02:47Z,515,0,0,https://www.youtube.com/watch?v=JqD4zzvUwGo,Ninh Bình
Ninh Bình,ĐỒNG BẰNG SÔNG HỒNG,#hanam,iobE9D3gzpw,Tiến độ dự án Sun Urban City Hà Nam ngày 20/11/2025,Mr Vinh BĐS Sun Urban City - Sun Mega City - Vpq🇻🇳,2025-11-20T13:00:06Z,513,8,0,https://www.youtube.com/watch?v=iobE9D3gzpw,Ninh Bình
Ninh Bình,ĐỒNG BẰNG SÔNG HỒNG,#hanam,3DHnENh4_z0,Thăm nom cá trê chuẩn bị thu hoạch @trại-giống-hà-nam,Trại Giống Hà Nam,2025-12-05T11:12:54Z,495,4,12,https://www.youtube.com/watch?v=3DHnENh4_z0,Ninh Bình
Ninh Bình,ĐỒNG BẰNG SÔNG HỒNG,#hanam,2XcQPWZgoSo,Hà Sam Thử Thách Ẩm Thực Từ A Đến Z - Ai Ăn Được Nhiều Đồ Nhất Sẽ Thắng,Hà Sam,2025-11-26T09:28:19Z,738153,5114,1032,https://www.youtube.com/watch?v=2XcQPWZgoSo,Ninh Bình
Ninh Bình,ĐỒNG BẰNG SÔNG HỒNG,#hanam,6IHeIzlamQY,"Căn hộ mẫu 2 ngủ Lynn Time Onsen Hà Nam, có khoáng nóng tận phòng",Trung Vũ BĐS - Chuyên tư vấn Sun Urban City ,2025-12-11T14:08:42Z,1402,2,0,https://www.youtube.com/watch?v=6IHeIzlamQY,Ninh Bình
Ninh Bình,ĐỒNG BẰNG SÔNG HỒNG,#hanam,vQ4Lrv4vuug,Hợp tác làm kinh tế nuôi sinh sản giống chó nghiệp vụ - #Malinois /Becgie Bỉ,Trại chó Nghiệp Vụ Malinois Tống Giang Hà nam ,2025-11-20T15:32:11Z,7083,15,3,https://www.youtube.com/watch?v=vQ4Lrv4vuug,Ninh Bình
Ninh Bình,ĐỒNG BẰNG SÔNG HỒNG,#hanam,0URoFeOBMuc,[2025] Hà Nam và Chùa Tam Trúc - Quê của Mẹ chồng Tui,Min Mon Vlog,2025-11-26T14:42:24Z,166,2,0,https://www.youtube.com/watch?v=0URoFeOBMuc,Ninh Bình
Ninh Bình,ĐỒNG BẰNG SÔNG HỒNG,#hanam,xXs_sLt3z5M,Sân khấu sự kiện Countdown 2026 Sun Urban City Hà Nam,Mr Vinh BĐS Sun Urban City - Sun Mega City - Vpq🇻🇳,2025-12-15T09:53:31Z,1155,9,0,https://www.youtube.com/watch?v=xXs_sLt3z5M,Ninh Bình
Ninh Bình,ĐỒNG BẰNG SÔNG HỒNG,#hanam,QMb8XRZh7PA,Gỏi cá phải ăn cùng muối #food #tuyenanngon #xuhuongyoutube #amthuc #goica #mientay,Cường Gỏi Cá Hà Nam,2025-12-15T04:42:44Z,5526,103,12,https://www.youtube.com/watch?v=QMb8XRZh7PA,Ninh Bình
Ninh Bình,ĐỒNG BẰNG SÔNG HỒNG,#hanam,JPVawyVVELQ,Doanh nghiệp Đồng Tháp xúc tiến giao thương tại Hà Nam (Trung Quốc) | THDT,Truyền Hình Đồng Tháp,2025-12-16T12:39:38Z,147,4,0,https://www.youtube.com/watch?v=JPVawyVVELQ,Ninh Bình
Ninh Bình,ĐỒNG BẰNG SÔNG HỒNG,#hanam,QCEJperZ1j8,Tiến độ dự án Sun Urban City Hà Nam ngày 25/11/25,Mr Vinh BĐS Sun Urban City - Sun Mega City - Vpq🇻🇳,2025-11-25T13:00:06Z,635,1,0,https://www.youtube.com/watch?v=QCEJperZ1j8,Ninh Bình
Ninh Bình,ĐỒNG BẰNG SÔNG HỒNG,#hanam,tH0O4YM1kp8,Cách làm món cơm cháy giòn tại nhà #food #xuhuongyoutube #amthuc #goica #cuonghanam,Cường Gỏi Cá Hà Nam,2025-12-14T11:54:04Z,5953,88,4,https://www.youtube.com/watch?v=tH0O4YM1kp8,Ninh Bình
Ninh Bình,ĐỒNG BẰNG SÔNG HỒNG,#hanam,XIVuOlXqyA8,Bóc giá nột thất bàn ăn căn hộ Sun Urban City Hà Nam của anh chị khách,Trung Vũ BĐS - Chuyên tư vấn Sun Urban City ,2025-12-17T03:30:26Z,58,0,0,https://www.youtube.com/watch?v=XIVuOlXqyA8,Ninh Bình
Ninh Bình,ĐỒNG BẰNG SÔNG HỒNG,#hanam,9obKBYpV8eI,@cadacsan 🐷 Trực tiếp Chợ Đầu Mối Lợn Hà Nam sáng nay xem Giá Heo bao nhiêu? #chợlợn #giaheoupdate,Giá Heo ∞ Update,2025-12-02T22:00:19Z,2486,29,4,https://www.youtube.com/watch?v=9obKBYpV8eI,Ninh Bình
Ninh Bình,ĐỒNG BẰNG SÔNG HỒNG,#hanam,U19pC1oWP_M,✨CÙNG HOA ANH HÀ NAM LÀM ĐẸP ĐÓN TẾT✨ #daongocanh #lamdep,Đào Ngọc Anh Clinic,2025-12-17T03:22:47Z,25,0,0,https://www.youtube.com/watch?v=U19pC1oWP_M,Ninh Bình
Ninh Bình,ĐỒNG BẰNG SÔNG HỒNG,#hanam,626t2DhV0aE,"HIEUTHUHAI ngẩn ngơ với cảnh đẹp ở Hà Nam, Ngân - Diễm bày mưu tính kế giấu ghế | BTS 2 Ngày 1 Đêm",2 NGÀY 1 ĐÊM VIETNAM,2025-11-22T12:00:21Z,17282,247,13,https://www.youtube.com/watch?v=626t2DhV0aE,Ninh Bình
Ninh Bình,ĐỒNG BẰNG SÔNG HỒNG,#hanam,iojIV2mx-G8,@cadacsan 🐷 Trực tiếp Chợ Đầu Mối Lợn Hà Nam sáng nay xem Giá Heo bao nhiêu? #chợlợn #giaheoupdate,Giá Heo ∞ Update,2025-12-01T22:00:56Z,1685,44,3,https://www.youtube.com/watch?v=iojIV2mx-G8,Ninh Bình
Ninh Bình,ĐỒNG BẰNG SÔNG HỒNG,#hanam,YoNwagi_G0E,"LS Nguyễn Giang Nam, quê Bình Lục- Hà Nam, tại NTLS thị trấn Trà My, Quảng Nam. #bongda #funny",TÌM LIỆT SỸ,2025-12-15T11:21:34Z,3153,21,0,https://www.youtube.com/watch?v=YoNwagi_G0E,Ninh Bình
Ninh Bình,ĐỒNG BẰNG SÔNG HỒNG,#hanam,p0FLRMRceI4,@cadacsan 🐷 Theo chân Thương LáI vào Chợ Heo Hà Nam: Giá Lợn nay được hét bao nhiêu? #giaheoupdate,Giá Heo ∞ Update,2025-12-08T08:30:26Z,1089,15,0,https://www.youtube.com/watch?v=p0FLRMRceI4,Ninh Bình
Ninh Bình,ĐỒNG BẰNG SÔNG HỒNG,#hanam,fEr54HM5Fbo,Ae hà nam về cơ sở mua lân  0385768789,Cơ sở sx Trống & Lân  Hưng Đại,2025-12-11T00:59:09Z,23266,173,1,https://www.youtube.com/watch?v=fEr54HM5Fbo,Ninh Bình
Ninh Bình,ĐỒNG BẰNG SÔNG HỒNG,#hanam,dRbTnbQ5Awg,Cư dân Sun Urban City nhận bàn giao nhà tòa A1 chung cư Art Residence T11/2025,Mr Vinh BĐS Sun Urban City - Sun Mega City - Vpq🇻🇳,2025-11-19T13:00:06Z,1465,10,8,https://www.youtube.com/watch?v=dRbTnbQ5Awg,Ninh Bình
Ninh Bình,ĐỒNG BẰNG SÔNG HỒNG,#hanam,d4twbwgt7T8,Giá heo hơi ngày 16 tháng 12 năm 2025 | Chạm Mốc 67.000đ/kg,GIÁ HEO HƠI HÔM NAY,2025-12-15T12:16:53Z,7936,82,5,https://www.youtube.com/watch?v=d4twbwgt7T8,Ninh Bình
Ninh Bình,ĐỒNG BẰNG SÔNG HỒNG,#hanam,8-EJazcvlbo,NGÀY ANH BUÔNG TAY - Huỳnh Hà Nam,nam huynh,2025-11-25T14:13:46Z,2527,5,0,https://www.youtube.com/watch?v=8-EJazcvlbo,Ninh Bình
Ninh Bình,ĐỒNG BẰNG SÔNG HỒNG,#hanam,jgZIZG_iNB8,Sun Urban City | Phân Khu Kim Ngân - Kim Tiền ngày 5/12/25,Mr Vinh BĐS Sun Urban City - Sun Mega City - Vpq🇻🇳,2025-12-05T13:01:06Z,706,5,0,https://www.youtube.com/watch?v=jgZIZG_iNB8,Ninh Bình
Ninh Bình,ĐỒNG BẰNG SÔNG HỒNG,#hanam,dqWEL79oHHs,@cadacsan 🐷 Theo chân Thương LáI vào Chợ Lợn Hà Nam: Giá Heo được hét bao nhiêu tiền? #giaheoupdate,Giá Heo ∞ Update,2025-12-06T05:00:50Z,867,14,0,https://www.youtube.com/watch?v=dqWEL79oHHs,Ninh Bình
Ninh Bình,ĐỒNG BẰNG SÔNG HỒNG,#namdinh,gHXr26W8bVA,INCREDIBLE WIN falls just short of a miracle! | Nam Dinh FC 🇻🇳 vs Eastern 🇭🇰 | Highlights ACL Two™,The AFC Hub,2025-12-11T13:48:02Z,61262,556,234,https://www.youtube.com/watch?v=gHXr26W8bVA,Ninh Bình
Ninh Bình,ĐỒNG BẰNG SÔNG HỒNG,#namdinh,_9y7ZrMyURE,Nam Dinh FC 🇻🇳 vs Eastern 🇭🇰 | Full Match | AFC Champions League Two™ 2025/26,The AFC Hub,2025-12-11T12:01:53Z,15486,150,0,https://www.youtube.com/watch?v=_9y7ZrMyURE,Ninh Bình
Ninh Bình,ĐỒNG BẰNG SÔNG HỒNG,#namdinh,frsD5gzaJnk,Tế Điên Nam Định và những ngày tháng lang thang bụi đời nhập nha ngay phải bà chị và cái kết,Tế Điên Nam Định,2025-12-16T15:27:23Z,22461,277,23,https://www.youtube.com/watch?v=frsD5gzaJnk,Ninh Bình
Ninh Bình,ĐỒNG BẰNG SÔNG HỒNG,#namdinh,671WrgHAvmY,Bất ngờ với những thay đổi ở thành phố Nam Định,Gia Huy - Videos,2025-11-29T04:30:04Z,408,23,5,https://www.youtube.com/watch?v=671WrgHAvmY,Ninh Bình
Ninh Bình,ĐỒNG BẰNG SÔNG HỒNG,#namdinh,Wc7aQncmlTs,"HIGHLIGHTS: THÉP XANH NAM ĐỊNH - LONG AN | HIỆP 2 BÙNG NỔ, VÉ ĐI TIẾP XỨNG ĐÁNG",FPT Bóng Đá Việt,2025-11-23T13:46:07Z,166669,0,40,https://www.youtube.com/watch?v=Wc7aQncmlTs,Ninh Bình
Ninh Bình,ĐỒNG BẰNG SÔNG HỒNG,#namdinh,CABax6UljG4,TỈNH NAM ĐỊNH CÔNG BỐ VỀ QUY HOẠCH VÀ TẦM NHÌN 2021-2030,Pipi mon (Hài),2025-11-24T09:29:36Z,132,0,1,https://www.youtube.com/watch?v=CABax6UljG4,Ninh Bình
Ninh Bình,ĐỒNG BẰNG SÔNG HỒNG,#namdinh,KWzJqQDD0Fk,Em cảm ơn anh chị ở Đà Nẵng về chơi với em Tế Điên Nam Định ,Tế Điên Nam Định,2025-12-16T16:18:59Z,2526,51,10,https://www.youtube.com/watch?v=KWzJqQDD0Fk,Ninh Bình
Ninh Bình,ĐỒNG BẰNG SÔNG HỒNG,#namdinh,1AIZGq_oBXo,SHAN UNITED 0-3 NAM ĐỊNH | #SHOPEECUP 2025/2026 HIGHLIGHTS,ASEAN United FC,2025-12-04T14:40:24Z,21772,202,40,https://www.youtube.com/watch?v=1AIZGq_oBXo,Ninh Bình
Ninh Bình,ĐỒNG BẰNG SÔNG HỒNG,#namdinh,hKf85MlLXro,Tế Điên Nam Định giao lưu với khán giả trên kênh Youtube,Tế Điên Nam Định,2025-12-16T10:27:10Z,14108,100,18,https://www.youtube.com/watch?v=hKf85MlLXro,Ninh Bình
Ninh Bình,ĐỒNG BẰNG SÔNG HỒNG,#namdinh,D3_Jjmld9J0,Chàng Trai Nam Định Nhảy Cầu Trước Ngày Cưới – Đinh Đoàn Phân Tích Sự Thật Đau Lòng Đằng Sau,Đinh Đoàn Tư Vấn,2025-11-29T04:00:24Z,35789,233,27,https://www.youtube.com/watch?v=D3_Jjmld9J0,Ninh Bình
Ninh Bình,ĐỒNG BẰNG SÔNG HỒNG,#namdinh,ihp1_E3E8sk,"Highlights: TX Nam Định - Long An | Xuân Son tái xuất, nhọc nhằn ngoài dự kiến ở lãnh địa",BÓNG ĐÁ VIỆT NAM,2025-11-23T13:42:29Z,130809,0,61,https://www.youtube.com/watch?v=ihp1_E3E8sk,Ninh Bình
Ninh Bình,ĐỒNG BẰNG SÔNG HỒNG,#namdinh,a4mEeZJp9JE,"Nỗ lực phi thường, ghi đến 9 bàn, Nam Định vẫn thiếu đúng 1 bàn để đi tiếp! #thethao247 #bongda",Thể Thao 247,2025-12-11T15:13:11Z,2459,4,2,https://www.youtube.com/watch?v=a4mEeZJp9JE,Ninh Bình
Ninh Bình,ĐỒNG BẰNG SÔNG HỒNG,#namdinh,DSg8EXObi4w,"DẤU ẤN: THÉP XANH NAM ĐỊNH - LONG AN | XUÂN SON TÁI XUẤT, BẦU KHÔNG KHÍ TÍCH CỰC TRỞ LẠI ""THÀNH NAM""",FPT Bóng Đá Việt,2025-11-25T11:00:33Z,76227,0,4,https://www.youtube.com/watch?v=DSg8EXObi4w,Ninh Bình
Ninh Bình,ĐỒNG BẰNG SÔNG HỒNG,#namdinh,SxYUypdWZOo,Quy Hoạch Mở Rộng  Đô Thị Ninh Bình 2025–2040: Thành Phố Hoa Lư – Ý Yên – Sông Đáy,VHD,2025-12-05T09:38:31Z,7683,51,11,https://www.youtube.com/watch?v=SxYUypdWZOo,Ninh Bình
